,corpus_id,sentence,start_idx,end_idx
131,249204508,"Looking to the generated translations, we see that, regardless of the decoding algorithm, the systems before fine-tuning and not using tagging hallucinate '¡/-... -/¿' style marks when translating sentences corresponding to typical headers like 'CURRENT DISEASE' or 'TREATMENT'.",26,27
132,207847180,"This gives rise to a tendency to hallucinate translations, i.e. to produce translations that are fluent, but unrelated to the content of the source sentence (Lee et al.,",7,8
133,237604955,"2019) , which is unlikely to hallucinate since the full source content is always available during training.",7,8
134,248779944,layout to hallucinate what might appear in the unobserved part of the scene.,2,3
135,248779944,"For the third row in the table, we design a model that takes FoV and an object type as an input and predicts a direction (i.e., hallucinate where it might appear) as output.",29,30
136,248779944,"Conclusion In this paper, we introduced HOLM -a model that can extract prior knowledge about objects from LMs and hallucinate objects in future observations.",20,21
137,226254579,"Neural sequence models can generate highly fluent sentences, but recent studies have also shown that they are also prone to hallucinate additional content not supported by the input.",21,22
138,218571335,"They are good at copying important source content, but tend to concatenate unrelated spans and hallucinate details when generating more abstractive sentences.",16,17
139,218571335,"Models tend to hallucinate information (e.g. entities, events, date) that is not present in the source.",3,4
140,236912977,"Due to their autoregressive nature, neural summarization models have the unique property to ""hallucinate"" new content (Kryscinski et al.,",15,16
141,52119752,"The example predictions in Table 7 illustrate how this model tends to drop content (""Alfred Warden"", ""mouth"", ""Hamburg""), hallucinate common elements from its training set (""food"", ""ingredient"", ""publisher"") and generally fails to produce coherent sentences.",29,30
142,248512968,"Question-Answer Filtering Generative models may hallucinate, that is, generate content that is inconsistent with its input source (Alberti et al.,",7,8
143,225070343,"2020) , demonstrate an impressive ability to generate fluent text, but their outputs are difficult to control beyond a prompt, and they manifest a tendency to hallucinate facts (Wiseman et al.,",29,30
144,225070343,"2020) , but they have a tendency to hallucinate facts (Wiseman et al.,",9,10
145,244909449,"However, recent studies have shown that these systems are prone to hallucinate content that is not supported by the source document (Maynez et al.,",12,13
146,244909449,"Kang and Hashimoto (2020) propose a ""loss truncation"" training algorithm that filters out noisy training samples which may lead a model to hallucinate.",26,27
147,233296346,"Data Hallucination The methods introduced here to combat the annotation bottleneck are somewhat orthogonal to the method of data hallucination introduced in Anastasopoulos and Neubig ( 2019 ), as we aim for identifying new real examples from a vocabulary, rather than hallucinate nonce ones.",43,44
148,245218924,"The latter is a particular issue as these claims can cause the model to learn to hallucinate during training, and should be impossible for the model to guess during evaluation.",16,17
149,233296059,"Despite maintaining plausible general linguistic capabilities, dialogue models are still unable to fully discern facts and may instead hallucinate factually invalid information.",19,20
150,233296059,"To ascertain the degree to which KG-grounded dialogue systems hallucinate and the nature of these hallucinations, we conduct a systematic evaluation by soliciting human judgement.",11,12
151,233296059,This reveals that in certain cases responses might be originally faithful to G k c but increasing diversity encourages the model to hallucinate.,22,23
152,233296059,2020) ) demonstrate that state-of-the-art natural language generation (NLG) models can hallucinate by missing important entities.,20,21
153,248085885,One of the most interesting observations is that neural NLG models can hallucinate not only factually inaccurate or unverifiable content but also politically biased content.,12,13
154,173990592,"2018) find that neural captioning models often ground object mentions into incorrect objects due to correlations in the training data, and can hallucinate non-existing objects.",24,25
155,250390521,"However, state-of-the-art NMT methods sometimes repeat words, leave out important pieces of the translation, and hallucinate information not contained in the source, or in other words, fail to accurately capture the semantics of the source in some cases.",24,25
156,226262386,"This pattern is expected in the OCR task, as the recognition model uses the image to make predictions and is more likely to confuse a character's shape for another than to hallucinate or erase pixels.",33,34
157,202724689,"Unlike seq2seq models that occasionally hallucinate content or generate incomprehensible outputs, our system remains faithful to its inputs, since it builds outputs by rearranging input elements and conjugating them.",5,6
158,207847447,At the same time they often hallucinate or drop attributes.,6,7
159,237558792,"As such, when the model ends up in a poorly trained part of its distribution, it can still hallucinate terminals; in particular, it can end up stuttering words until the maximum output length is reached, yielding an invalid tree structure.",20,21
160,30830682,"Li, 2008) proposed a scheme for large-scale discriminative training by using the parallel corpus directly, however such human-labeled parallel corpora are usually very expensive to acquire, hence later on (Li, 2010; Li, 2011) proposed semi-supervised methods to ""hallucinate"" training data for discrminative training.",53,54
161,30830682,"n. This has led to the recent development of semi-supervised training methods that hallucinate ""labeled"" training set by using samples y i from the target side only.",15,16
162,30830682,"If we hallucinate a raw training set G (namely the large monolingual corpus from which we select good samples to build up the final training set) with M sentences(that is |G| = M and G has 2 M subsets), of course we can select a subset D ∈ 2 G having the highest Q(D) score in brute-force manner by computing the score for each subset of G. But this is obviously not manageable when M is large, therefore we hope to compute Q(D) on-the-fly as a new training sample comes and decide if we want to add this sample to the final training set or not.",2,3
163,30830682,"Our baseline test set scores are given by the forward baseline system built in this step, and the reverse system is used to hallucinate the missing inputs for semi-supervised discriminative training, according to the ""round-trip"" method.",24,25
164,232404053,"However, this does not indicate Transformer models hallucinate more.",8,9
165,232404053,"Particularly, faithfulness reflects how likely the generated sentences hallucinate facts that are not supported by the tables.",9,10
166,51876975,A second difference is that COCO-trained models often seem to hallucinate objects.,12,13
167,51876975,"For instance, they hallucinate ""front of building"" for the first image, ""clock and two doors"" for the second, and ""birthday cake"" for the third image.",4,5
168,233204406,"Each of these categories is further divided into Intrinsic (errors that arise as a result of misinterpreting information from the source article) and Extrinsic (errors that hallucinate new information or facts not present in the source article), following the characterization from Maynez et al. (",29,30
169,233204406,Models trained on XSUM learn to hallucinate new content and consequently produce extrinsic errors: 60% of the errors made by BART models are extrinsic.,6,7
170,233204406,"When a word in the summary is non-factual, training on it encourages the model to hallucinate new content.",18,19
171,248780263,"This is especially pressing when predicting with incomplete intent, as the model is encouraged to hallucinate, and may hallucinate information that it has memorized from other users' data.",16,17
172,248780263,"This is especially pressing when predicting with incomplete intent, as the model is encouraged to hallucinate, and may hallucinate information that it has memorized from other users' data.",20,21
173,248780263,We could easily completely remove the model's ability to hallucinate free text.,10,11
174,239009616,"Despite generating plausible and engaging responses, existing models still hallucinate invalid information (Roller et al.,",10,11
175,234334020,"This is likely due to the reduction of noisy text that cannot be generated from the document, allowing the model to learn to synthesize information from the text without trying to hallucinate new information.",33,34
176,247793148,"Table 11 : Incorrect behavior on WebNLG: besides the minor disfluencies caused by the templates (""Akron, Ohio is from...""), the models (except for 3-STAGE filtered) tend to hallucinate and merge the facts incorrectly.",39,40
177,239015959,"This issue gets further exacerbated in the context of generation tasks, where neural models are prone to hallucinate additional content not supported by the input (Maynez et al.,",18,19
178,239015959,"They hallucinate to generate novel concepts like cloudy hail, drop relevant details like cafe located in Emeryville, and are repetitive in nature.",1,2
179,236034557,"Large language models, even though they store an impressive amount of knowledge within their weights, are known to hallucinate facts when generating dialogue (Shuster et al.,",20,21
180,236034557,"Further, static language models are known to hallucinate, that is they generate plausible looking statements that are factually incorrect, which can be interpreted as a form of lossy compression when employing training to encode that knowledge within the weights of a neural network; see Shuster et al. (",8,9
181,236034557,Standard BART-Large fine-tuned models on the other hand typically either hallucinate knowledge or else fall back to generic statements.,14,15
182,236034557,Standard BART-Large fine-tuned models on the other hand typically either hallucinate knowledge or else fall back to generic statements.,14,15
183,226262222,"They are widely considered too unreliable for business applications; they have a tendency to hallucinate facts, unsupported by the structured data they were given (Wiseman et al.,",15,16
184,225067001,the input triples that indicates whether or not the generated text captures the full meaning of the triples and does not hallucinate extra information.,21,22
185,233296487,"Entity Faithfulness Summary Faithfulness From the observation that models often hallucinate entities with no correct replacement in the source, we suspect that solving entity faithfulness alone does not guarantee the faithfulness of the summary.",10,11
186,247451272,"2020) hallucinate significantly in this setting, justifying our choice of an extractive framework here.",2,3
187,219720870,"We did this because neural models are known to hallucinate information (Rohrbach et al.,",9,10
188,1389109,"Generalization might be improved by methods that ""hallucinate"" unobserved productions (Mohri and Roark, 2006) , and robustness could be improved using manual or automated tree annotation (e.g., Klein and Manning, 2003; Petrov and Klein, 2007) .",8,9
189,5013006,"Both the SEQ2SEQ and the MULTISEQ2SEQ models ""hallucinate"" new information (""served as a test pilot"", ""born on Nov 18, 1983"").",8,9
190,244054458,Post and Vilar (2018) baseline is particularly prone to hallucinate Lee et al. (,11,12
191,244054458,"The LC model generates a correct translation and proceeds to hallucinate till it finally produces a sentence with ""a report"".",10,11
192,52287106,"The parameters tested are the hidden size of encoder/decoder (32, 64, 128) , size of the character embeddings (8, 16), whether to use patches or not and what amount of additional training data to hallucinate with the enhancer (1×, 5×).",44,45
193,245130929,"Our approach assumes that high-scoring candidates under the model are good quality, but this assumption is violated in certain cases, like when the model attempts to hallucinate information.",30,31
194,201679015,"Secondly, in order to reduce the bias of the decoder's language model, they hallucinate two types of data that encourage common affixes and character copying.",16,17
195,245219136,"However, prior work found that they often hallucinate (Xu et al.,",8,9
196,250390496,"Liu and Hulden (2022) introduce a more refined method to hallucinate synthetic stems, which aims to honor the phonology of the target language by generating sequences of random syllables rather than random characters.",12,13
197,202787716,"In a relatively simple task, such as contraction generation, rulebased methods are more reliable, and, overall, are preferable due to their robustness and easy repair comparing to neural models, which may, for instance, hallucinate incorrect content.",41,42
198,1530336,"To handle these situations, the Semantic Linker has a second type of state transition in which it is able to ""hallucinate"" an object of one of a pre-determined set of clases, and add link-groups between that hallucinated object and the fragment structures already present.",22,23
199,202542687,"The most prominent error case is that the model will sometimes hallucinate differences (Figure 5 , bottom row).",11,12
200,216869577,"In this example, a model that assigns high probability to the new fact (Thursday) must also frequently hallucinate dates on other examples.",20,21
201,216869577,"Much like in the earlier example, we can see that a model which aims to have low log loss on this dataset must spend a substantial amount of effort learning to hallucinate.",32,33
202,216869577,We would like the model to ignore data that would force it to unnecessarily hallucinate at test time.,14,15
203,216869577,"Examples that cause a model to hallucinate may still contain valid information about the fluency of a sentence, which hotstarting can capture.",6,7
204,216869577,"Top-p and direct sampling both have diverse phrasings, but also hallucinate facts ('earthquake' in sampling and 'torrential rains' in top-p sampling).",13,14
205,218487159,"We then hallucinate reduplication into 8% of the Base data, and Figure 7 : Reduplication in Kunwinjku has three forms, and each form has its own CV templates defining how much of the verb is captured and copied.",2,3
206,218487159,"In this second iteration, we may find that we no longer need to hallucinate reduplication because it is sufficiently represented in the new training set.",14,15
207,220045929,"Such a simple system would tend to hallucinate many spurious yet frequent morphological functions, which may not be possible morphologically from a richer linguistic perspective.",7,8
208,234688073,"Inaccuracy guardrail Modern text generation models are known to hallucinate facts (Huang et al.,",9,10
209,237440458,"Sentences whose translations cannot be regarded as hallucinations are not relevant to our study, neither are those for which the baseline and the system to which it is compared to both hallucinate.",33,34
210,237513517,"We give the precise p-values as well as more details about the questions crowd-workers were asked in Appendix E. We also conduct a manual analysis of the faithfulness errors made by FULL generations in Ap-pendix B; we generally find that FULL generations do not hallucinate more than S2S+Copy generations (the most faithful generations according to crowd-workers), but they do more frequently contradict information in the source table.",51,52
211,237431059,"Gold What fun it is, with feet in sharp steel shod, M How fun it is to wear iron-clad shoes, M+ST Their iron shoes are saucy fun, Analysis It is well-known that occasionally NMT systems have a tendency to generate translations that are grammatically correct but unrelated to the source sentence particularly for low-resource settings (e.g., hallucinate words that are not mentioned in the source language) (Arthur et al.,",68,69
212,247939302,"1  The main problems with this setup for RE are: 1) The model might ""hallucinate"" by generating entity mentions that do not appear in the source text.",18,19
213,218487034,In this paper we have analyzed limitations of these models for abstractive document summarization and found that these models are highly prone to hallucinate content that is unfaithful to the input document.,23,24
214,218487034,We seek to answer the following questions: (i) How frequently do abstractive summarizers hallucinate content?; (,16,17
215,218487034,"Hallucinations in Summarization Open-ended generation -the task of generating text that forms a natural continuation from the input text -requires the model to hallucinate text; hence the focus has been to ensure that the model learns to generate text that is more human-like (i.e., less repetitive or dull with more content-related words) (Holtzman et al.,",25,26
216,235313847,"Note that fine-tuning will probably give rise to different behavior on the 70% of CTX cases, since the S ∅ will hallucinate differently than the newly fine-tuned model (which further suggests why our analysis should focus on S ∅ ).",25,26
217,1296084,"The most important issue in performing reinterpretation is controlling the process that the system does not ""hallucinate"" arbitrary meanings into an expression.",17,18
218,2131195,"The semantic linker may also ""hallucinate"" a new node to bridge two fragments between whom no links can otherwise be computed.",6,7
219,1537555,"Node _£,atCCU~ 0 np 1 np 2 nC) 3 n([]) 4 n([1 I]) 5 n([1]) 6 n( Figure 4 In the example of the fierce brown cat we obtain connections listed in Figure 4 and the graph shown in Figure 5 Figure 5 It simplifies the algorithm to hallucinate a dummy node corresponding to the ""inverse"" of the target category of the derivation ; this is node 0.",61,62
220,2972357,the system can hallucinate likely words using word co-occurrence statistics alone.,3,4
221,2972357,"However, the system can still generate verbs when action and pose detectors have been run, and this framework allows the system to ""hallucinate"" likely verbal constructions between objects if specified at runtime.",25,26
222,2972357,"To evaluate the system against other systems, we specify that the system should ( 1 ) not hallucinate likely verbs; and (2) return the longest string possible.",18,19
223,14241519,"For example, it seems likely that for our application it is much less problematic to ""miss"" information than to ""hallucinate"".",23,24
224,221819253,"In this example, LSTM and Transformer hallucinate mentioning incorrect location such as ""moldavia"", and ""alaska"".",7,8
225,201740458,"which is not fluent at all, but doesn't hallucinate gays there so it may be more usable for post-editing.",10,11
226,249151889,"This is because DLMs continue to hallucinate while generating questions in general-purpose domains, which can lead to factually incorrect responses.",6,7
227,249151889,"Our experiments show that without process knowledge, DLMs hallucinate by generating unsafe, incoherent, and irrelevant questions that are not helpful for MHPs in pre-screening or triaging.",9,10
228,238743793,We further show that generated explanations often hallucinate information and miss key elements that indicate the label.,7,8
229,238743793,"We show the generated explanations contain words in the true explanations, but they fail to reproduce important phrases and often hallucinate entities during generation.",21,22
230,238743793,3b show that the BERT model and the E-SNLI-pretrained model (trained with k = 16) hallucinate for OOD vocab.,21,22
231,238743793,"4b show that both the BERT model and E-SNLI-pretrained model (trained with k = 4) hallucinate for OOD vocab, and the hallucination rate is slightly worse for OOD templates.",21,22
