,corpus_id,sentence,start_idx,end_idx
0,241583436,"Under this training paradigm, the learned model is prone to hallucinate knowledge, mixing knowledge fragments inappropriately.",11,12
1,237940440,"6 Interestingly, we see that when asked for a longer response, the model starts to hallucinate extra content (but not slots) not given in the MR in order to satisfy the control variable.",17,18
2,237592700,"Additionally, parametric knowledge may perform worse for less frequent facts, which don't appear often in the training set, and ""hallucinate"" responses.",24,25
3,207758149,This causes the MT model to hallucinate.,6,7
4,248780449,"Truth To the extent that a use case places importance on the truth of the outputs provided, it is not a good fit for GPT-3 (Dale, 2021) LMs have a tendency to ""hallucinate"" when summarizing documents.",37,38
5,248780005,"Detoxifying posts of this kind may constitute a mission impossible for most models (possibly even for humans); the only way to produce a non-toxic 'rephrase' may be to change the original post beyond recognition, which may be rewarding systems like CAE-T5 that often hallucinate in their rephrases, as already discussed.",53,54
6,1610577,"In automatic speech recognition (ASR), for example, OOV words pose a substantial problem, since the system will hallucinate a phonetically similar word in its vocabulary when an OOV word is encountered.",22,23
7,211258645,"5 This step is important for PseudoD and Seq2Seq (which would learn to hallucinate entities) but not ONUS (which must reconstruct entities in q from its own decomposition, as discussed next).",14,15
8,235294035,"2018) and also requires models to condition generation on the retrieved evidence -penalizing models that hallucinate (Holtzman et al.,",16,17
9,246240585,"This causes the model to hallucinate-for example, that Barack Obama's wife is Hillary Clinton based on the high co-occurrence of the two entities.",5,6
10,202558974,"The bias can help predict missing state changes (e.g., above), but can also cause XPAD to ""hallucinate"" state changes with weak evidence, simply to give each sentence a purpose.",21,22
11,233189560,Our work addresses current limitations of models for abstractive summarization that often hallucinate information or generate summaries with coherence issues.,12,13
12,233189560,Prior work on factuality in abstractive summarization has found that current models can hallucinate information more Stochastic birth-death-immigration models are widely used in biology and ecology to study population dynamics.,13,14
13,245218843,"However, such pre-trained models are susceptible to generating hallucinate content that is not supported by the source documents (Cao et al.,",11,12
14,247594092,"2020) observes that strong neural models, although fluent and creative, often hallucinate information.",14,15
15,235266260,"Additionally, since our test set includes novel objects not seen in training, we provide the names of the objects as additional context for the LM generator (e.g. 'Vase, Laptop'); this allows a LM to copy those names over rather than hallucinate wrong ones.",48,49
16,218596261,"We also note that GPT2 has high SER for the fully-unseen domain; upon inspection, we see slot hallucination from GPT2 within alarm 1, while Seq2Seq/CVAE never hallucinate.",33,34
17,235097391,"Even though our models yield factually consistent summaries, as judged by human evaluation, they can still generate factually inconsistent summaries or sometimes hallucinate information that the source document does not include.",24,25
18,248834340,"Although the generated questions do not appear biased, they may hallucinate content, which is a common problem for neural generation models.",11,12
19,222142312,"As a result, many entities that appear in the reference summary never appear in the source, which may cause abstractive summarization models to hallucinate severely with many factual errors (Maynez et al.,",25,26
20,222140820,"The off-the-shelf sentence-level realizer (see the supplementary material) favors the statistics-dense sentences of the baseline summaries, as it tends to hallucinate on less dense plans.",31,32
21,15029994,"As it would be difficult to hallucinate such dependencies, we have only attempted the deep task.",6,7
22,235294302,"When manually annotating results of our early tests, we found that BART was more likely to be extractive and copy input passages in their entirety while UQAT5 was more likely to compose new text and produce answers with textual overlap from multiple input candidates but was more likely to hallucinate content.",50,51
23,248779912,"Finally, we discuss and analyse the challenge of generating factually-correct sentences without hallucinate information, as well as the difficulty of handling unseen attributes in both ranking and answer presentation.",15,16
24,233204359,"Interestingly, all four models score almostperfect accuracy, meaning they don't hallucinate medical facts.",13,14
25,233204365,"Intrinsic evaluation metrics through Likert scales or ranking methods may help select the best model, but they * Equal contribution don't ensure the model will never hallucinate information or miss key items when generating the consultation note.",28,29
26,231847335,"In practice, the finetuned LM produces malformed, synthetic text which does not fully match with the MR it was conditioned on, as it might hallucinate additional values not consistent with its MR counterpart.",27,28
27,189999604,"Note that although the algorithm ensures that the output tree structure is compatible with the input structure, it turns out that the model can still occasionally hallucinate content: since the neural model allows all possible token sequences in principle, it sometimes generates word sequences that express a hallucinated slot by simply skipping over the disallowed slot annotation-thereby bypassing the constraints-especially when given an unusual input.",27,28
28,236486264,"Hallucination In some cases, ASR models can hallucinate transcriptions: e.g. providing transcriptions for audio even where no speech is present, or simply misbehaving on out-of-domain utterances (Liao et al.,",8,9
29,247594360,"Improved Data-to-Text Model Training A known problem in data-to-text generation is that the model tends to hallucinate or neglect information in the input (Wang et al.,",24,25
30,247594360,"This kind of examples may teach the model to hallucinate which is also an unwanted behavior, hence they are also filtered out.",9,10
31,202763347,"Again, tuning to account for this type of noise is a balancing act, since we don't want our system to hallucinate sounds that don't exist in the original utterance, but it needs to have enough leeway that it can recover the correct name from noisy transcripts where a phoneme may be dropped or added.",23,24
32,247694170,"Introduction A core issue in deploying text generation models for real-world applications is that they often generate factually inconsistent text with respect to the input they are conditioned on, or even completely ""hallucinate"" (Lee et al.,",36,37
33,250390859,"Introduction A core issue in deploying text generation models for real-world applications is that they often generate factually inconsistent text with respect to the input they are conditioned on, or even completely ""hallucinate"" (Lee et al.,",36,37
34,231692975,"We found that this additional data augmentation was particularly helpful; without it, the models would hallucinate the rest of a partial sentence.",17,18
35,222133959,"For example, in Table 1 , the chosen REs are coffee and hand; hand 21 Sentence Y being Faithful to Sentence X implies Y does not hallucinate or state information not already implied by X. 22 See Section §2.3.2 for an explanation.",28,29
36,202541012,"Transformers are also known to hallucinate (Lee et al.,",5,6
37,248506182,The underlying hypothesis is that the intra-class relation of the observed examples can be modeled and that this can be learned from a few-samples to hallucinate diverse unseen examples.,29,30
38,248506182,2017) as our hallucinator to hallucinate embeddings of sentences.,6,7
39,248506182,"By observing the real embeddings of examples from the fine-tuning dataset, the cWGAN plays an adversarial game to hallucinate embeddings that can fool the discriminator, while the discriminator is trying to classify the fake embeddings from the real ones.",21,22
40,248506182,"2021) which uses EDA (Wei and Zou, 2019) to augment examples at the discrete input space, we hallucinate auxiliary examples at the embedding space.",22,23
41,161067,Comparative system evaluation in shared tasks is usually performed by pitting scores in evaluawill hallucinate different incorrect ones.,14,15
42,14633379,Do systems hallucinate facts?,2,3
43,235186832,"We note that with smaller values of k, both ROBERTAS2S-based and PEGASUSbased models tend to hallucinate more often.",18,19
44,215768688,"The Missing Information and Added Information labels support the suggestion of Manning ( 2019 ) that although their system performs worse than others by most measures, its constraints make it less likely than machine-learning-based systems to omit or hallucinate information.",43,44
45,215768688,"Overall, the results from these questions indicate that neural AMR generation systems are prone to omit or hallucinate concepts from the AMR with concerning frequency.",18,19
46,215768688,Added information is perhaps the most troubling form of error; AMR generation systems will have severely limited potential for use in practical applications as long as they hallucinate meaning.,28,29
47,227216922,"System Overview Unlike novel end-to-end systems, which may hallucinate content (Moryossef et al.,",13,14
48,226226600,"We favor extractive over abstractive models as the latter are prone to hallucinate content that is unfaithful to the input (Kryscinski et al.,",12,13
49,196183567,"Recent neural language generation systems often hallucinate contents (i.e., producing irrelevant or contradicted facts), especially when trained on loosely corresponding pairs of the input structure and text.",6,7
50,236459782,"While usually fluent, existing methods often hallucinate phrases that contradict the facts in the table.",7,8
51,216562425,"Firstly, even our best models still make mistakes: they i) contradict or repeat themselves on occasion, ii) tend to repeat the same phrases in separate conversations, and iii) hallucinate knowledge as seen in other generative systems (Massarelli et al.,",35,36
52,216562425,"Knowledge Retrieval Generative models are known to hallucinate knowledge, and in general are unable to read and access external knowledge other than what is embedded in their model parameters, which may be imperfect.",7,8
53,235253772,"However, such methods can cause the following problems: (1) since the generated content-plan may contain errors, generating solely on the content-plan leads to inconsistencies; (2) even if a perfect content-plan is provided, the autoregressive model used in the second stage is still prone to hallucinate unfaithful contents due to the well-known exposure bias (Wang and Sennrich, 2020) problem; (3) there is no guarantee that the selected key-value pairs can be described in the generated text.",59,60
54,236486184,"We found out, that if we restrict model size and use regular language modeling objective, the model starts to hallucinate after 1-2 program tokens.",21,22
55,232233599,"2020) as language models tend to degenerate and hallucinate (Holtzman et al.,",9,10
56,237940882,"However, at the time of writing these models can hallucinate knowledge (Shuster et al.,",10,11
57,229923145,"2020) obtain state of the art performance on rationale generation benchmarks, they are vulnerable to having similar behaviours and can hallucinate new facts by tapping into stored world knowledge in the language model parameters.",22,23
58,235097501,"2016) and can hallucinate irrelevant content (Roller et al.,",4,5
59,227231683,"There is much discussion in the field of how to control the vexed tendencies of neural generators to 'hallucinate' content (Dušek et al.,",19,20
60,6118285,"This seems particularly useful in the case of APE, where we do not wish the neural models to ""hallucinate"" output when encountering unknown tokens.",20,21
61,233231373,"NMT models have a propensity to hallucinate more frequently under out-of-domain inputs (Müller et al.,",6,7
62,233231373,"Conclusion In this work we demonstrated that memorized training samples are far more likely to hallucinate under perturbation than non-memorized samples, under an extension of the Memory Value Estimator proposed in Feldman and Zhang (2020) .",15,16
63,234487207,"Specifically, in the case of GitHub, we see that for those projects whose NL messages exhibit a fixed pattern in their structure, such as in the case of youtube-dl where users add a header denoting the file that was edited in the commit, the model tends to more frequently hallucinate the content of the message.",55,56
64,237558722,"For example, some studies have shown that neural end-to-end data-totext approaches may hallucinate (Rohrbach et al.,",19,20
65,233394001,"or hallucinate information like ""Yes, and the Times published it on the front page."".",1,2
66,203734629,"In our initial experiments the generation model learns to ""hallucinate"" facts, as easily occurs when the target text is too loosely related to the conditioning input.",10,11
67,203734629,"This leads to the model learning to ""hallucinate"" facts and necessitates a manual alignment and editing of the training data.",8,9
68,250390612,"Inaccurate information Large language models are also known to hallucinate knowledge during text generation (Roller et al.,",9,10
69,235422493,"This is mostly because the complete target document contains much more information than can be inferred from the input; the model learns to hallucinate facts, necessitating heavy deletion by users.",24,25
70,237329050,"Moreover, they found that models with a more reliable visual representation hallucinate less, suggesting that a robust processing of the visual input is important for reducing hallucination.",12,13
71,237329050,"Secondly, to quantify the extent to which different models hallucinate entities during the dialogue, we compute the CHAIR metric (Caption Hallucination Assessment with Image Relevance) proposed in Rohrbach et al. (",10,11
72,237329050,"Instead, the other models frequently hallucinate entities that are not in the human hallucination list or have low frequency; we conjecture this means that the rate of real hallucinations is lower for VLP than for the other models.",6,7
73,248218547,We present our major findings below: • Both models are able to hallucinate imaginary contents fairly relevant to the limited contexts given as prompts. •,13,14
74,198975147,We show that • Using priors hallucinating the visual representation improves the performance of the model compared to when it receives only auditory inputs; • Language prior is slightly more effective than sound prior to hallucinate concurring vision.,36,37
75,198975147,"Using the latter to hallucinate the visual scene leads to an increase of 0.10 in correlation, and an even higher increase (+0.13) is obtained when the hallucination is induced by a linguistic description of the scene.",4,5
76,221186631,"For instance, the model can hallucinate details irrelevant to the context (the word ""bank"" in the bottom left example), a problem common in neural generative models (Tian et al.,",6,7
77,235422140,"2020) , in which there is no notion of higher level semantic reasoning and a tendency to hallucinate content, or COD3S (Weir et al.,",18,19
78,201657646,A good model can naturally include available facts from the persona and hallucinate others when the conversation context requires them.,12,13
79,247862902,"Intuitively, question generators that hallucinate less are more likely to stick to the text from the source paragraph.",5,6
80,248780300,"T5 and BART store world knowledge implicitly in their parameters and are known to hallucinate facts (Maynez et al.,",14,15
81,235458570,"2018) , and captioning metrics do not always measure if captions ""hallucinate"" objects in an image (Rohrbach et al.,",13,14
82,52176506,"Our analysis yields several interesting findings, including that models which score best on standard sentence metrics do not always have lower hallucination and that models which hallucinate more tend to make errors driven by language priors. *",27,28
83,52176506,"While missing salient objects is also a failure mode, captions are summaries and thus generally Figure 1 : Image captioning models often ""hallucinate"" objects that may appear in a given context, like e.g. a bench here.",24,25
84,52176506,"Interestingly, we find that models which score best on standard sentence metrics do not always hallucinate less.",16,17
85,52176506,"We propose image and language model consistency scores to investigate this issue, and find that models which hallucinate more tend to make mistakes consistent with a language model.",18,19
86,52176506,"In particular, models which optimize for CIDEr frequently hallucinate more.",9,10
87,52176506,"Human-like sentences are not likely to hallucinate objects, and a hallucinated object is likely a strong signal to the discriminator that a sentence is generated, and is not from a human.",8,9
88,52176506,"Moreover, vocabulary size does not correlate with hallucination either, i.e. models with more diverse descriptions may actually hallucinate less.",19,20
89,52176506,"This is somewhat surprising, as a model which has access to image information at each time step should be less likely to ""forget"" image content and hallucinate objects.",29,30
90,52176506,"Furthermore, we see that models with stronger image consistency frequently hallucinate fewer objects, suggesting that strong visual processing is important for avoiding hallucination.",11,12
91,53082704,"We instantiate these ideas in the domain of Visual Question Answering (VQA), by proposing two tasks that help measure how well a human 'understands' 4 When piloting the tasks ourselves, we found it easy to 'overfit' to the explanations and hallucinate patterns.",48,49
92,237414674,"Interestingly, the model output contains more gold concepts than the source input on XSum, possibly because the significant level of extrinsic information in the target out-put of XSum encourages the model to hallucinate.",36,37
93,237414674,"2020) show that models learned in a seq2seq manner are prone to hallucinate unfaithful or nonfactual information, hindering their applicability to real-world applications.",13,14
94,245144787,"2021b) ; data-to-text models sometimes hallucinate texts that are not supported by the data (Parikh et al.,",10,11
95,247594506,"For example, it can hallucinate facts that are not present in the theory.",5,6
96,247594506,It also makes many non-interpretable generation errors where the model's output format is completely violated or the model seems to hallucinate some facts (rows 3-6 in Table 14 ).,23,24
97,216641852,"While usually fluent, existing methods often hallucinate phrases that are not supported by the table, suggesting that this dataset can serve as a useful research benchmark for high-precision conditional text generation.",7,8
98,248721759,"2021; Goyal and Durrett, 2021) , we also train it to hallucinate incorrect modifiers into spans from P and A. To this end, we randomly drop adjectives and adverbs from 10% of the gold predicate and argument spans.",14,15
99,53222445,"To the extent that neural approaches continue to hallucinate content and fail to observe constraints and preferences implemented by grammar-based approaches in such a comparison, it would also be worthwhile to investigate additional ways of combining neural and grammarbased methods.",8,9
100,221802479,This is detrimental since the model can choose to hallucinate medical concepts that are not part of the snippet.,9,10
101,226262184,"2020) since neural abstractive summarizers have been shown to hallucinate/misrepresent facts (See et al.,",10,11
102,233296648,"2019) , and exhibit a propensity to hallucinate non-existent or incorrect content that is unacceptable in most user-oriented applications.",8,9
103,237491581,"Our findings demonstrate the importance for practitioners to evaluate model tendency to hallucinate rather than read, and show that our mitigation strategy encourages generalization to evolving information (i.e., time-dependent queries).",12,13
104,237491581,"However, this memorization behaviour has manifested in a penchant to hallucinate, or parrot answers memorized during training, completely ignoring relevant documents when provided (Krishna et al.,",11,12
105,237491581,"We find that a reason models either hallucinate an answer or picks a random context span is when the substituted answer is implausible, as is designed in the type-swap substitution.",7,8
106,227127272,The FINE 4-way output is more useful for system evaluation (we can distinguish whether the system tends to hallucinate or omit information).,21,22
107,247596715,"This is because, speech recognizers induce transcription errors and abstractive summarization models may hallucinate facts that are not entailed by the original (Kryscinski et al.,",14,15
108,233241131,"If this pattern occurs in similar types of examples in the training set (e.g., first-person written articles), then it may effectively teach the model to hallucinate, providing a possible explanation for the model behavior described earlier.",31,32
109,233241131,One remaining question is how state-of-the-art models can hallucinate but still perform well on benchmark datasets according to standard evaluation metrics.,14,15
110,233241131,"Of course, one reason is that the models only hallucinate on some fraction of examples in the dataset.",10,11
111,224818792,"Abstractive summarizers are considered to be less reliable despite their impressive performance on benchmark datasets, because they can hallucinate facts and struggle to keep the original meanings intact (Kryscinski et al.,",19,20
112,241583525,"2021) , pre-trained neural language models value v 1 value v 2 (hence neural architectures in general), are prone to hallucinate facts (Dušek et al.,",26,27
113,234742446,"Despite such improvement, PLMs fine-tuned only on the clean (or labeled) data might be more prone to hallucinate factual knowledge (e.g., ""Visvesvaraya Technological University"" in Table 1 ).",22,23
114,209086817,"Further, highlights are guaranteed to be true-to-the-original, while system abstracts can sometimes ""hallucinate"" facts and distort the original meaning.",21,22
115,227216973,"When generating game summaries, systems will often hallucinate these attributes as they deem it probable that such language is included in the summary, but the attribute is not available to the copy attention mechanism.",8,9
116,248227301,"Our study reveals that the standard benchmarks consist of >60% hallucinated responses, leading to models that not only hallucinate but even amplify hallucinations.",21,22
117,248227301,"Contrasting this with human gold responses, the models not only hallucinate but also amplify the percentage of hallucinations, except CTRL on WOW.",11,12
118,248227301,"Moreover, we show that conversational models trained on these benchmarks not only hallucinate but also amplify hallucinations, even the models that were designed to alleviate this issue.",13,14
119,237263305,Hallucinations Large LMs are known to hallucinate text content; we saw this happen frequently for style transfer.,6,7
120,249454984,"2020) , or hallucinate false knowledge (Roller et al.,",4,5
121,8680683,"We ""hallucinate"" new phrase table entries by composing the unigram translations from the baseline system's phrase table and translations learned from comparable monolingual corpora.",2,3
122,8680683,"Augment the baseline phrase table with hallucinated translations and new feature functions estimated from monolingual corpora We define an algorithm for generating loosely compositional phrase pairs, which we use to hallucinate new translations.",31,32
123,8680683,"q q q q q q q q q q q q 0 10 20 Because we hallucinate translations for source phrases that appear in the training data up to 100 times, our baseline models include some of the oracle phrase translations.",17,18
124,8680683,"2008) , however, unlike that work, we hallucinate phrase pairs that did not appear in training data in order to augment the original, bilingually extracted phrase table.",10,11
125,248810934,"Such examples include cases where some summaries hallucinate the first name of a person, which the workers should mark them as not factual.",7,8
126,237571691,"600 (150 × 2 × 2) summaries are annotated to demonstrate how often do the models ""hallucinate"", i.e., generating content not grounded by the source.",19,20
127,250390973,"Faithful and Factual Consistent Text Generation Contrastive learning is also used to improve faithfulness and factuality of data-to-text genera-tion and abstractive summarization, which has been shown a very challenging issue with the pretrained language models that often hallucinate (Kryscinski et al.,",44,45
128,225074971,"Thus, if the contextual knowledge is not sufficient to extrapolate a definition, the modelwhich is required to always generate an outputwill hallucinate an answer on the basis of contextual clues, incurring the risk of introducing nonfactualities.",23,24
129,239016608,"They show that around 70% of XSUM's training data consists of hallucinated content in gold summaries, which encourages the models to similarly learn to hallucinate facts.",27,28
130,218538004,"A closer inspection of segments where the MLE system was found to hallucinate shows that some segments were scored higher in adequacy with MRT, others lower in fluency.",12,13
