,corpus_id,sentence,start_idx,end_idx
461,247793725,"Escribir ""icon pack"" [ENG] en el buscador.",2,3
462,232417812,"Evaluation of the spatial reasoning instructions revealed that many referenced image features (e.g. ""click the hamburger menu icon""), which is not supported by RUSS.",19,20
463,5598307,"The list of potential MWEs had to be manually edited as the 2grams contain a large number of oversegmented words, e.g. アイコン aikoN ""icon"" was split: アイコ+ン, and オークション ōkushoN ""auction"" was split オーク+ション; b. the katakana sequences were extracted from a large collection of articles from 1999 in the Mainichi Shimbun (a Japanese daily newspaper), and the 100 highest-frequency MWEs extracted.",25,26
464,5223711,"The Eiffel Tower (French: Tour Eiffel, [tur efel]) is a 19th century iron lattice tower located on the Champ de Mars in Paris that has become both a global icon of France and one of the most recognizable structures in the world.",35,36
465,15238167,"Collocation is searched by clicking on the icon ""COLLOCATE"".",7,8
466,17521778,"Cues to identify them could be anchors like icon, tab and dialog box, and phrases such as where it says, and > sequences.",8,9
467,15119054,"The initial grammaticalization from the noun to the conjunction is a typical case of bleaching, i.e. reduction of semantic components whereby the semiotic function of while changes from an icon to an index.",30,31
468,237513667,We then check if the additions or deletions contain any of the words with the strategy-associated lex- icon.,19,20
469,9692275,"If something is entered into this window, the according string in the window above appears henceforth with an icon (1:3) behind it: In a similar fashion the other three definition parts of the conceptual schema can be defined: The type definition comprises name-and domain-specifications of all but the string-typed features allowed in the database.",19,20
470,250391022,"In contrast, other misogynistic memes portray violent acts against women in the caption and praise their actions in the image, e.g. with a thumbs-up icon or trophies.",28,29
471,53082532,"Second, we collect 283,427 usernames from Reddit identified through self-declarations of gender in /R/RELATIONSHIPS, e.g., ""I [23F] need to talk to my boyfriend [27M]"", and 84,068 usernames where the user has chosen a gender-indicating flair (a visual icon displayed within the subreddit).",55,56
472,52155604,"The agent, using a drone icon, is placed at the beginning of the path.",6,7
473,793580,This is due to measuring the cost of both the lexicon and the data in the optimization function: with a much larger corpus (more data) the optimal solution contains a much larger morph lex-icon.,38,39
474,6229041,"The AllDatesParser regular expression is entered by selecting the longest-match downward bracket operator (depicted with the icon @-> with ... underneath) from the palette above, which then inserts a template that has empty slots -three in this case.",19,20
475,6293901,"The first part is an icon which, when clicked, plays the speech file.",5,6
476,202542397,"While social media improves information sharing, it also facilitates The utterance following the human icon is a humanwritten intervention, while the utterance following the computer icon is machine-generated.",15,16
477,202542397,"While social media improves information sharing, it also facilitates The utterance following the human icon is a humanwritten intervention, while the utterance following the computer icon is machine-generated.",27,28
478,29080401,"In the case of dependency relations, if a relation is entered which is not a universal relation (or language-specific subrelation) then the arc in the graph turns red and in table view a warning icon is displayed next to the relation with a tooltip indicating that the relation is not valid.",39,40
479,218719869,"2009) and use the emoji package to translate emotion icons into text strings (here, each icon is referred to as a word token).",18,19
480,218719869,"We use a ""soft"" normalization strategy to all of the experimental datasets by translating word tokens of user mentions and web/url links into special tokens @USER and HTTPURL, respectively, and converting emotion icon tokens into corresponding strings.",38,39
481,9522614,"So for transferring emotional feelings like happiness, sadness and angers, emoticons (emotion + icon = emoticon; a chat jargon) are widely used.",16,17
482,235212487,"Therefore, we did not use images only when meaningless images such as non-image icon or update icon were used or the image links had expired.",16,17
483,235212487,"Therefore, we did not use images only when meaningless images such as non-image icon or update icon were used or the image links had expired.",19,20
484,15340723,"But in Janus, a mouse click on a screen icon is assigned honorary linguistic status via the logical form representation of a definite NP, and that introduces a new DE into the context.",10,11
485,15340723,"1988 ) of the MCC Human Interface Lab and applied to three user interface (UI) designs: a knowledge editor for the Cyc KB (Guha and Lenat, 1990) , an icon editor for designing display panels for photocopy machines, and an information retrieval (IR) tool for preparing multimedia presentations.",35,36
486,15340723,"However, only pegs introduced via the linguistic channel can sponsor linguistic anaphora, e.g., ""What is it"" requires the presence of an LO, but ""What is that"" can be sponsored directly by the peg for an icon that just appeared on the screen.",43,44
487,15340723,"Ambiguous mouse clicks of the sort explored in XTRA and CUBRICON plus the ability of the user to introduce new pegs for regions of the screen, or for events of moving a pane or icon across the screen, or encircling a set of existing icons to place their pegs in attentional focus should all be attempted using the pegs discourse model as a source of target interpretations of mouse clicks and as a place to encode novel, user-defined screen objects.",35,36
488,7708637,The window appears when the user double-clicks the icon on the lower right corner (the transcoding proxy automatically inserts the icon).,10,11
489,7708637,The window appears when the user double-clicks the icon on the lower right corner (the transcoding proxy automatically inserts the icon).,23,24
490,7708637,"When the user clicks the speaker icon, the MP3 player software is invoked and starts playing the synthesized voice data.",6,7
491,946674,"In addi-tion~ the icon inference ~ule allows the derivation of (23) given in (24) (see Figure 1 ), and the correspondi,g term in (25/: (25.)",5,6
492,6232448,"Even where other devices are available, the artificial languages they give the user access to --menu and icon selection, and programming, command, and database query languages --are limited.",18,19
493,17436634,"Constants could easily be represented using another function symbol, icon.",10,11
494,10669885,"For example, an abstract line-drawing icon in a graphics program (a ""brush"") might have its shape serve as an indicator of what kind of line it draws.",8,9
495,51871049,"The Google Translate system provides a microphone icon that one can click in order to provide live audio input via a microphone, rather than typing text in.",7,8
496,14812523,"When the author clicks on the corresponding icon in this e-mail, interactive disambiguation begins.",7,8
497,14288879,The new list was rhea post-edited by interaJ~ive scum edi~ md m~ with the old l~icon.,21,22
498,2157233,"This module is responsible for producing the multi-media output in a coordinated manner in real time (e.g., the Planner module can specify that a certain icon on the color-graphics display must be highlighted when the entity represented by the icon is mentioned in the simultaneous natural language output).",29,30
499,2157233,"This module is responsible for producing the multi-media output in a coordinated manner in real time (e.g., the Planner module can specify that a certain icon on the color-graphics display must be highlighted when the entity represented by the icon is mentioned in the simultaneous natural language output).",45,46
500,2157233,"To handle these pointing problems, some systems use default techniques such as having a point handler return the entity represented by (a) the ""top"" or ""foremost"" icon where the system has a data structure it uses to remember the order in which icons are ""painted"" on the display (i.e., which are further in the background and which are foremost in the foreground) or (b) the icon whose ""center"" is closest to the location on the screen/window touched by the point.",33,34
501,2157233,"To handle these pointing problems, some systems use default techniques such as having a point handler return the entity represented by (a) the ""top"" or ""foremost"" icon where the system has a data structure it uses to remember the order in which icons are ""painted"" on the display (i.e., which are further in the background and which are foremost in the foreground) or (b) the icon whose ""center"" is closest to the location on the screen/window touched by the point.",79,80
502,2157233,"In each of the following examples, assume that the <point> represents a point gesture with a device such as a mouse and each point gesture can be ambiguous (i.e., it can touch more than one icon).",40,41
503,2157233,"Example 3: USER: ""Enter this <point-map-icon> here <point-form-slot>.""",13,14
504,2157233,"Suppose that the <point-map-icon> selects the Nuernberg airbase on the map and the <point-form-slot> touches the ""origin airbase"" slot on the mission planning form.",8,9
505,2157233,"if the object is represented by an icon on the display, then CUBRICON generates a NL expression for the object and a simultaneous coordinated graphic gesture that points to its icon. .",7,8
506,2157233,"if the object is represented by an icon on the display, then CUBRICON generates a NL expression for the object and a simultaneous coordinated graphic gesture that points to its icon. .",31,32
507,2157233,"if the object (call it X) is not represented by an icon on the display, but is a component of such a visible object (call it Y), then CUBRICON generates a phrase that expresses object X as a component of object Y and uses a combined deictic-verbal expression for object Y as described in the above case.",13,14
508,2157233,"For example, if CUBRICON is generating a reference for the runway of an airbase called Merseberg and an icon for the airbase is visible on the map (the airbase as a whole is represented visiblyl but not its parts), then CUBRICON generates the phrase ""the runway of the Merseberg Airbase"" with a simultaneous point gesture that is directed at the Merseberg airbase icon on the map.",19,20
509,2157233,"For example, if CUBRICON is generating a reference for the runway of an airbase called Merseberg and an icon for the airbase is visible on the map (the airbase as a whole is represented visiblyl but not its parts), then CUBRICON generates the phrase ""the runway of the Merseberg Airbase"" with a simultaneous point gesture that is directed at the Merseberg airbase icon on the map.",68,69
510,2157233,"Therefore the system must select the visual representation(s) of the object (e.g., an icon, table entry, form slot entry) that it will use in its point gesture(s) from among the several candidates.",16,17
511,2157233,"The current CUBRICON methodology is to point out all the object's visible representations, but to use a strong pointing gesture (e.g., blink the icon to attract the user's attention and add a pointing textbox) for the most significant or relevant representations and weak non-distracting gestures (e.g., just highlight the visible representation) for the less significant ones.",27,28
512,2157233,"The <point> consists of a gesture that points out the Fritz Steel plant icon to the user via a gesture that uses a combination of blinking, highlighting, circling the icon and the attachment of a pointing label-box that identifies the icon.",15,16
513,2157233,"The <point> consists of a gesture that points out the Fritz Steel plant icon to the user via a gesture that uses a combination of blinking, highlighting, circling the icon and the attachment of a pointing label-box that identifies the icon.",33,34
514,2157233,"The <point> consists of a gesture that points out the Fritz Steel plant icon to the user via a gesture that uses a combination of blinking, highlighting, circling the icon and the attachment of a pointing label-box that identifies the icon.",46,47
515,2157233,"The <graphic-expression> is a visual presentation of the spatial relation between the figure object (Fritz steel plant) and the ground object (Dresden city), consisting of an arrow drawn from the Dresden city icon to the steel plant icon, a label stating the distance, and a label identifying the city (the steel plant should already be labeled).",41,42
516,2157233,"The <graphic-expression> is a visual presentation of the spatial relation between the figure object (Fritz steel plant) and the ground object (Dresden city), consisting of an arrow drawn from the Dresden city icon to the steel plant icon, a label stating the distance, and a label identifying the city (the steel plant should already be labeled).",46,47
517,6579986,Most of these words are coded as 2-icon sequences.,9,10
518,6579986,The first icon in the sequence (the category icon) establishes the word category.,2,3
519,6579986,The first icon in the sequence (the category icon) establishes the word category.,9,10
520,6579986,"For example, the <SKULL> icon indicates a body part word, the <MASKS> icon indicates a feeling word, and the <APPLE> icon indicates a food word.",7,8
521,6579986,"For example, the <SKULL> icon indicates a body part word, the <MASKS> icon indicates a feeling word, and the <APPLE> icon indicates a food word.",18,19
522,6579986,"For example, the <SKULL> icon indicates a body part word, the <MASKS> icon indicates a feeling word, and the <APPLE> icon indicates a food word.",29,30
523,6579986,The second icon denotes the specific word.,2,3
524,6579986,"The learning and use of icon sequences is facilitated by the incorporation of ""icon prediction"".",5,6
525,6579986,"The learning and use of icon sequences is facilitated by the incorporation of ""icon prediction"".",14,15
526,6579986,"In icon prediction the user is ""prompted"" for valid icon sequences using lights on keys.",1,2
527,6579986,"In icon prediction the user is ""prompted"" for valid icon sequences using lights on keys.",11,12
528,6579986,"For example, once the first icon is hit (e.g., <MASK>) lights will appear on icons that lead to a word (e.g., all icons that complete a valid feeling word will be lit).",6,7
529,6579986,"In addition to the words which are accessed via the icon sequences, Communic-EaseTMcontains some morphology and allows the addition of endings to regular tense verbs and regular noun plurals.",10,11
530,6579986,This allowed us to extend the icon prediction mechanism described in the Communic-Ease MApTMto the word level.,6,7
531,33485193,Her death marks the end of an era and the passing of an icon.,13,14
532,2608602,"Clicking on the magnifying glass icon brings up the original article in the right frame, with the extracted sentences highlighted.",5,6
533,857166,"In response, QuickSet creates the appropriate military icon on its map and asks for confirmation.",8,9
534,3264135,"For example, ""corbeille/wastebasket"" makes sense in the computer domain (in many popular graphical interfaces there is a wastebasket icon that is used for deleting files), but also in more general usage.",24,25
535,30141324,"Finally, the user can also click the Twitter icon to inspect the source tweets (Figure 4 ).",9,10
536,291199,"This window contains a microphone icon that indicates the state of CommandTalk (ready, listening, or busy), an area for the most recent recognized string to be printed, and an area for text 4 messages from the system to appear (confirmation messages and error messages).",5,6
537,291199,The second option is to click on the microphone icon with the left mouse button to signal the computer to start listening (click-to-talk).,9,10
538,15292026,"D</pa 4 > P5 by poconell <pc 5 >It's amazing to see him so serious too!</pc 5 ><pa 5 >This is one tough, no-nonsense man!</pa 5 > P6 by penny sieve My icon says it all :) P7 by poconell <pc 6 >And I'm jealous of you with that President!</pc 6 ><pa 6 >We tried to overthrow our Prime Minister, but he went crying to the Governor General.",41,42
539,1406305,The task was for the matcher to get his car icon parked in the same spot as the car displayed on only the director's screen.,10,11
540,1406305,"In one condition, Visual Evidence, the director could see the matcher's car icon and its movements.",15,16
541,1406305,"During each trial, the x and y coordinates of the matcher's icon were recorded and time-stamped, as a moment-bymoment estimate of where the matcher thought the target location was.",13,14
542,1406305,"For the sample of 48 trials, I plotted the distance between the matchers' icon and the target (the director's icon) over time, to provide a visible display of how their beliefs about the target location converged.",15,16
543,1406305,"For the sample of 48 trials, I plotted the distance between the matchers' icon and the target (the director's icon) over time, to provide a visible display of how their beliefs about the target location converged.",23,24
544,1406305,"Typically, distance diminished relatively steeply early in the trial, while the matcher interpreted the director's initial description and rapidly moved his icon toward the target location.",24,25
545,1406305,"Many of the plots then showed a distinct elbow followed by a nearly horizontal region, meaning that the matcher then paused or moved away only slightly before returning to park his car icon.",33,34
546,219306983,"It is therefore an i n t e g r a t e d l e x icon-encyclopedia, s t o r i n g information needed f o r parsing, for development of an i n t e r n a l model, and 201; making inferences.",17,18
547,1890344,A generalized definition of an icon is proposed: a visual representation of an object (physical or abstract) which has relational dependencies with other icons.,5,6
548,1890344,"The Icon Manager includes facilities for icon creation, icon interpretation, icon exploration, icon saving (on files), and an interactively programmable menu system; it provides basic support to create icons and relate them to other icons.",6,7
549,1890344,"The Icon Manager includes facilities for icon creation, icon interpretation, icon exploration, icon saving (on files), and an interactively programmable menu system; it provides basic support to create icons and relate them to other icons.",9,10
550,1890344,"The Icon Manager includes facilities for icon creation, icon interpretation, icon exploration, icon saving (on files), and an interactively programmable menu system; it provides basic support to create icons and relate them to other icons.",12,13
551,1890344,"The Icon Manager includes facilities for icon creation, icon interpretation, icon exploration, icon saving (on files), and an interactively programmable menu system; it provides basic support to create icons and relate them to other icons.",15,16
552,1890344,several methods to interactively edit an icon from sketch representations or icon structure representations.,6,7
553,1890344,several methods to interactively edit an icon from sketch representations or icon structure representations.,11,12
554,1890344,"Applications of this iconic programming environment to visual programming, to program design and electronic circuit design (from icon selection and editing), to knowledge systems based on icon graph matching and to multimedia communications are studied in detail.",19,20
555,1890344,"Applications of this iconic programming environment to visual programming, to program design and electronic circuit design (from icon selection and editing), to knowledge systems based on icon graph matching and to multimedia communications are studied in detail.",30,31
556,1890344,"Finally, a possible hardware structure to support an icon management system is proposed which is based on a pyramid of microprocessors architecture.",9,10
557,5313088,"This happened when information was needed to analyze a syntactic constituent (perhaps a noun phrase like ""the mouse"") but the referent of the constituent (the mouse icon on the screen), was not represented in the knowledge base.",31,32
558,10175863,"A NL sentence or clause, an icon placed in a certain position on the map, and a lexical or numerical weather value put in a cell of the weather table are all constructs of this type.",7,8
559,10175863,"A statement (q,x,y) of the map plan drives the formatter to place icon q in the position with coordinates (x, y).",18,19
560,10175863,It consists of a reference part determined by the weather value (the user associates it with the corresponding icon) and possibly by the region (if r f'l r ' # /; the user should identify it with the locations where the icons are situated) and a specificalion part determined by the elements t' f'lt (if different from t ') and p (if not high).,19,20
561,3156886,"In addition, time and place of birth and death are added as icon graphical attributes, again color coded.",13,14
562,8942406,"The bear icon, at the bottom in the middle, represents the system itself (i.e., EDWARD).",2,3
563,8942406,A <contain> relation is represented graphically by a straight line linking the icon that represents the container and the icon representing the object contained.,14,15
564,8942406,A <contain> relation is represented graphically by a straight line linking the icon that represents the container and the icon representing the object contained.,21,22
565,8942406,<Name> relations (if present) are represented by a label underneath the icon of the named object (see Figure 2 ).,15,16
566,8942406,"A selected referent CF is created when an icon has been selected by the user (by moving the mouse to the icon and clicking the left mouse button), or when the user has requested the system (in natural or formal language) to select icons.",8,9
567,8942406,"A selected referent CF is created when an icon has been selected by the user (by moving the mouse to the icon and clicking the left mouse button), or when the user has requested the system (in natural or formal language) to select icons.",22,23
568,8942406,"Its significance weight is initially 2, and it remains 2 for as long as the icon remains selected.",16,17
569,8942406,"As soon as the icon is deselected, the weight drops to 0 and the CF will be discarded.",4,5
570,8942406,"Indication by the system is done by means of a simulated pointing gesture: a fat, animated growing arrow to a particular icon (for instance, generated upon the question ""Which e-mail message is about parsing?"").",23,24
571,8942406,An example is the NP the closed bookcase in the case that only one icon resembles a closed bookcase.,14,15
572,8942406,"The indicated object, henceforward referred to as the demonstratum, (e.g., a file icon, directory tree, or screen position), is marked using reverse video and becomes selected.",16,17
573,8942406,"In parspro-toto pointing, an object is selected by pointing to a pixel that is within the object's selection area (which encloses the area covered by its icon) and subsequently pressing the select object mouse button.",31,32
574,8942406,"In totum-pro-parte pointing, objects are selected either by enclosing the icons in a mouse-driven rectangle, or by pointing to an icon that is part of a compound object, typically the root of a directory tree, and pressing the select compound object mouse button.",28,29
575,8942406,"So, if the user points to an icon, the salience of its referent increases immediately, making it the most likely candidate referent of the phrase at hand.",8,9
576,14586568,"For example, instead of ""In several windows, an icon shows the current status/activity of a printer.",11,12
577,16698123,Talmy is a pioneer of cognitive linguistics and something of an icon.,11,12
578,8328292,"Click on the icon that says ""background image"" [→ ""theater performance""].",3,4
579,16102917,"Users usually selected for each review an icon indicating ""postive"" or ""negative"".",7,8
580,16102917,The reviews were first categorized into positive and negative classes according to the associated icon.,14,15
581,7015571,"g is an intended DRT-function that verifies K. fi (d,) E g(railway), fi (d2) E g(station), fi (d2) = g(station Hoshi), fi (d3) E g(church), f2(c i ) E g(church),f2(c2) E g(house), g(x7) = Picture B, and d3 is associated with the icon t. To connect information from these three sources, we pose the following constraints: Verbal and pictorial information can be unified by using a function that combines both.",66,67
582,235914941,This allows the user to start searching by simply dragging a word or a phrase from the source text to the special icon above the dictionary window.,22,23
583,235914941,"To initiate smart search, the user drags the word/phrase to be found from another application (text editor) and drops it onto the special PG-PARS icon above the PG-PARS window.",31,32
584,16858278,"Sending the base file to MT/Validating or postediting the MT output In the environment discussed in this paper, the base file is sent to the MT engine by simply clicking an icon in a toolbar.",34,35
585,3002688,"The Transclick translation application appears as a screen icon, which, once activated, allows translation in three modalities: Basic Text Translation, E-mail Translation and SMS translation.",8,9
586,32935727,An important point is that a Han character is a kind of icon -a highly developed visual symbol.,12,13
