,corpus_id,sentence,start_idx,end_idx
129,51744460,"In particular, translators appeared to appreciate the possibility of previewing their translation in its original file format at any time by clicking on an icon, in order to ensure that they have not missed any non-editable text that also requires translation.",25,26
130,52013214,"Lexi currently implements this functionality, letting the user solicit simplifications for the entire site via a click on the Lexi icon.",21,22
131,17079655,"The current user interface is very similar to that of the original VOYAGER system, except that a separate recording icon is used for each language.",20,21
132,18828466,"An icon to display a tree is attached to each line of a concordance, the tree is visualized in PML-TQ format.",1,2
133,21724340,"Thus, we have devised a new system that can display all the retrieved corpora in a single page by reducing the size of each corpus icon.",26,27
134,21724340,"When there are too many retrieved results, each corpus icon is illustrated with a very small size, suggesting that the user should add more retrieval conditions to reduce the number of retrieved corpora.",10,11
135,14539281,"8 For instance, in the sentence ""Click the icon, then select Shut Down."",",10,11
136,14539281,"we can suggest to translate ""Shut Down"" into Czech as ""Vypnout"": Click the icon, then select <item translation=""Vypnout"" prob=""0.8"">Shut Down</item>.",18,19
137,46888733,"This set of candidate words is itself a combined, general-purpose sentiment lex-  icon, so we name it the GI+BL lexicon.",16,17
138,219301409,"Modern mobile operating systems even allow users to store websites as de-facto apps, representing them as a dedicated app icon on the home screen and hiding the web browser interface.",22,23
139,5225133,Tags can be removed from the tag search box by dragging them to the trash icon below it.,15,16
140,232307259,The second lex icon was used to classify the rest of the data.,3,4
141,21718900,"For example the lexical item MOVIE is built by one head icon with the SWML index 04-01-001-01-01-01, two handshape icons (left and right hand) with the SWML indices 01-05-001-01-01-03 and 01-05-001-01-01-11 and two directional icons (for left and right hand) with the SWML indices 02-03-006-01-01-13 and 02-03-006-01-02-01.",11,12
142,372377,"Sunny, sun and fair will all be represented by the icon ""sun"".",11,12
143,372377,The system can be used for generation by placing a certain icon on the map and calling for generation.,11,12
144,372377,Translation The generation triggered by placing a meteorological icon on the map can be rendered in English or Swedish.,8,9
145,227230665,"Similarly, an operator may refer to an icon on the digital map as a real object or location, and vice versa.",8,9
146,227230665,"This is an icon on the digital map that represents a physical POI, like in Example 4.3(a).",3,4
147,227230665,We use the displayed POI tag when it is clear that an expression refers to an icon on the map.,16,17
148,14550044,"The POSs, Conjugation type, and Conjugation form are listed by clicking the ▽ icon.",15,16
149,14550044,"The boxes can be expanded by clicking '+', reduced by clicking '×', or cleared by clicking the eraser icon.",24,25
150,238226584,"For example, most prepositions in the SentiWord lex-icon are neutral, yet by checking the data, it was found out that a mistranslation of a preposition can distort the affect message.",10,11
151,8467411,"The state of each AT, pass or fail, is known by the colour of the icon, green or red.",17,18
152,235358300,Both It is the best-known icon of Bacheng.,7,8
153,16907306,"We propose to apl)ly a crucial component of his generative lea:icon, tile qualia st'ructurc, to tile semantic interpre~tation of conlpOullds.",12,13
154,244119759,"By hovering over each attention head block in the view, the user can click on the close icon to prune the respective attention head from the model.",18,19
155,44037818,"Compound sentence: -The shortcut is a direct link to the archived item, and it has the following icon.",19,20
156,235368364,"Accordingly, ""Los Angeles"" and ""Los Angeles hospital"" are marked as coreferent in the sentences ""Yesterday in Los Angeles, pin-up icon Bettie Page succumbed to complications.. and ""Pinup icon Bettie Page died Thursday evening at a hospital in Los Angeles.."" because they refer to the location of the same event.",28,29
157,235368364,"Accordingly, ""Los Angeles"" and ""Los Angeles hospital"" are marked as coreferent in the sentences ""Yesterday in Los Angeles, pin-up icon Bettie Page succumbed to complications.. and ""Pinup icon Bettie Page died Thursday evening at a hospital in Los Angeles.."" because they refer to the location of the same event.",38,39
158,18175352,"There is an icon next to the column name, marked as R. Clicking on this icon pops up a window with a result table that summarizes the performance of that model (Figure 2 ).",3,4
159,18175352,"There is an icon next to the column name, marked as R. Clicking on this icon pops up a window with a result table that summarizes the performance of that model (Figure 2 ).",16,17
160,250390899,"Even for seasoned domain experts estimating future user requirements at design time is challenging and these often have to be discovered from recent user logs which contain information corresponding to past user utterances, model response (i.e., predicted intent), implicit (confidence or softmax probability), and explicit (user clicks on a thumbs up or thumbs down icon) feedback as shown in Fig 1 .",63,64
161,33009628,"The cosine similarity between icon and deity was 0.266, which is smaller than expected.",4,5
162,33009628,"We randomly sampled 100 lines containing icon from English Wikipedia text, which we used for calculating word embeddings, and found that the dominant sense of icon in Wikipedia is not a religious painting or figure, but a representative person or thing' as in the Wikipedia page of a football superstar David Beckham 14 : Beckham became known as a fashion icon, and together with Victoria, the couple became • • • Thus, the reason of icon's anomalous behavior is that the distribution over senses in Wikipedia was a lot different from the expected one.",6,7
163,33009628,"We randomly sampled 100 lines containing icon from English Wikipedia text, which we used for calculating word embeddings, and found that the dominant sense of icon in Wikipedia is not a religious painting or figure, but a representative person or thing' as in the Wikipedia page of a football superstar David Beckham 14 : Beckham became known as a fashion icon, and together with Victoria, the couple became • • • Thus, the reason of icon's anomalous behavior is that the distribution over senses in Wikipedia was a lot different from the expected one.",27,28
164,33009628,"We randomly sampled 100 lines containing icon from English Wikipedia text, which we used for calculating word embeddings, and found that the dominant sense of icon in Wikipedia is not a religious painting or figure, but a representative person or thing' as in the Wikipedia page of a football superstar David Beckham 14 : Beckham became known as a fashion icon, and together with Victoria, the couple became • • • Thus, the reason of icon's anomalous behavior is that the distribution over senses in Wikipedia was a lot different from the expected one.",64,65
165,33009628,"We randomly sampled 100 lines containing icon from English Wikipedia text, which we used for calculating word embeddings, and found that the dominant sense of icon in Wikipedia is not a religious painting or figure, but a representative person or thing' as in the Wikipedia page of a football superstar David Beckham 14 : Beckham became known as a fashion icon, and together with Victoria, the couple became • • • Thus, the reason of icon's anomalous behavior is that the distribution over senses in Wikipedia was a lot different from the expected one.",82,83
166,33009628,We now return to the English word icon that was mentioned as an exception in Section 4.3.,7,8
167,33009628,"Besides icons, the nearest neighbors of icon are iverskaya, nicopeia, eleusa, and derzhavnaya.",7,8
168,8818263,Results containing only the added co-references are marked with an icon.,12,13
169,8818263,Here all search results found through the selected co-references are marked with an icon.,15,16
170,232221438,The second sub-column with the robot icon shows binary labels and confidence scores.,8,9
171,248780081,"academy, advance, aircraft, ally, ammo, ammunition, armor, arms, army, arrow, arsenal, artillery, attack, attention, ballistic, barracks, base, battalion, battery, battle, battlefield, bomb, bombard, bombardment, brig, brigade, bullet, camouflage, camp, cannon, captain, capture, carrier, casualty, catapult, cavalry, colonel, combat, command, commander, commission, company, conflict, conquest, convoy, corps, covert, crew, decode, defeat, defend, defense, destroyer, division, draft, encode, enemy, engage, enlist, evacuate, explosive, fight, fire, fleet, force, formation, fort, front, garrison, general, grenade, grunt, guerrilla, gun, headquarters, helmet, honor, hospital, infantry, injury, intelligence, invade, invasion, jet, kill, leave, lieutenant, major, maneuver, marines, MIA, mid, military, mine, missile, mortar, navy, neutral, offense, officer, ordinance, parachute, peace, plane, platoon, private, radar, rank, recruit, regiment, rescue, reserves, retreat, ribbon, sabotage, sailor, salute, section, sergeant, service, shell, shoot, shot, siege, sniper, soldier, spear, specialist, squad, squadron, staff, submarine, surrender, tactical, tactics, tank, torpedo, troops, truce, uniform, unit, veteran, volley, war, warfare, warrior, weapon, win, wound Computers: algorithm, analog, app, application, array, backup, bandwidth, binary, bit, bite, blog, blogger, bookmark, boot, broadband, browser, buffer, bug, bus, byte, cache, caps, captcha, CD, client, command, compile, compress, computer, configure, cookie, copy, CPU, dashboard, data, database, debug, delete, desktop, development, digital, disk, document, domain, dot, download, drag, dynamic, email, encrypt, encryption, enter, FAQ, file, firewall, firmware, flaming, flash, folder, font, format, frame, graphics, hack, hacker, hardware, home, host, html, icon, inbox, integer, interface, Internet, IP, iteration, Java, joystick, kernel, key, keyboard, keyword, laptop, link, Linux, logic, login, lurking, Macintosh, macro, malware, media, memory, mirror, modem, monitor, motherboard, mouse, multimedia, net, network, node, offline, online, OS, option, output, page, password, paste, path, piracy, pirate, platform, podcast, portal, print, printer, privacy, process, program, programmer, protocol, RAM, reboot, resolution, restore, ROM, root, router, runtime, save, scan, scanner, screen, screenshot, script, scroll, security, server, shell, shift, snapshot, software, spam, spreadsheet, storage, surf, syntax, table, tag, template, thread, toolbar, trash, undo, Unix, upload, URL, user, UI, username, utility, version, virtual, virus, web, website, widget, wiki, window, Windows, wireless, worm, XML, Zip Legal: affidavit, allegation, appeal, appearance, argument, arrest, assault, attorney, bail, bankrupt, bankruptcy, bar, bench, warrant, bond, booking, capital, crime, case, chambers, claim, complainant, complaint, confess, confession, constitution, constitutional, contract, counsel, court, custody, damages, decree, defendant, defense, deposition, discovery, equity, estate, ethics, evidence, examination, family, law, felony, file, fraud, grievance, guardian, guilty, hearing, immunity, incarceration, incompetent, indictment, injunction, innocent, instructions, jail, judge, judiciary, jurisdiction, jury, justice, law, lawsuit, lawyer, legal, legislation, liable, litigation, manslaughter, mediation, minor, misdemeanor, moot, murder, negligence, oath, objection, opinion, order, ordinance, pardon, parole, party, perjury, petition, plaintiff, plea, precedent, prison, probation, prosecute, prosecutor, proxy, record, redress, resolution, reverse, revoke, robbery, rules, sentence, settlement, sheriff, sidebar, standing, state, statute, stay, subpoena, suit, suppress, sustain, testimony, theft, title, tort, transcript, trial, trust, trustee, venue, verdict, waiver, warrant, will, #worth, creations, amazed, satisfying, splendid, improves, enjoying, pristine, pref, super, sharp, easiest, innoc, stir, exceptionally, flexibility, loving, anniversary, renewed, utmost, savior, hugs, superiority, appreciated, survived, extensive, compliment, extends, recommendations, enjoy, genius, gripping, inspire, graceful, graduated, permits, smartest, engaging, moist, inexpensive, authent, lightweight, flawless, inevitable, #heartedly, reaching, qual, vibrant, brav, gracious, protection, helps, prett, protector, surprisingly, modern, fancy, skyline, talent, abundant, celebrated, promotions, prolong, brill, abundantly, brilliantly, liberated, shortcuts, vic, suprem, smug, embraced, embrace, privileges, discreet, assures, tallest, standalone, awakened, imposing, #important, ambitious, resurrected, illuminating, poetic, #exper, startling, freedoms, perpetual, multim, injecting, adaptations, poised, optimize, orbiting, honors, dign, certify, prioritize, applauded, civilized, partnering, allegiance, ascending, daring, confident, polished, proud, good, spectacular, admission, #tops, additions, advantages, filtered, fortunate, durable, humble, bliss, coolest, modest, classic, extended, honesty, vers, recommend, timeless, arise, comfortable, appliances, plenty, attractive, pri Negative Sentiment: rude, acne, downhill, bland, enemies, disrespectful, monsters, puzzles, insult, diarrhea, patches, worst, disgrace, doom, horrible, insulting, pissed, clueless, offended, incompetent, disgusting, vomit, zombies, unacceptable, disgusted, enemy, terrible, liar, vomiting, pirate, apology, arrogant, laughable, imperson, disappointing, boring, plague, horrendous, nause, dishonest, violence, horrific, awful, conceal, lame, bully, mindless, depressing, nausea, offensive, appalling, itching, refused, unethical, ridiculous, unpleasant, dismissive, incompetence, denied, retarded, opponents, muzzle, itch, ignored, puzzle, apologies, assault, overweight, #oddy, rebel, expiration, yelled, apologize, prison, twitch, bored, sad, strike, asshole, corrupt, worse, dreadful, choking, fraud, theft, false, rotten, ripped, scam, nightmares, unwelcome, disappointment, stale, lied, poisoning, sewage, defeated, excruciating, bleeding, severely, shame, unsafe, inept, hostile, ordeal, cancelled, lifeless, uncontroll, shadows, hazards, raven, poorly, sadly, irritated, horribly, horrified, insulted, swallow, inappropriate, angry, wasted, inexperienced, criminal, chased, revenge, unsuspecting, fallout, misled, ghosts, waste, excuse, poor, defeat, lacked, pains, disgust, greedy, shrunk, sneaking, gore, cruel, displeasure, villains, pretending, disguised, idiots, crashes, frustrating, isolated, attack, cry, traps, mem, litter, filthy, lace, defeats, sick, outdated, crap, ignorant, embarrassment, corrupted, tolerated, poisonous, null, #dies, ashamed, embarrassing, disease, appalled, disaster, yelling, blamed, rant, sarcastic, absurd, nightmare, cheated, evil, boredom, diabetes, violent, fals, pesticide, deleting, seizure, piracy, slashing, unfortunate, rip, worthless, pointless, expired, limp, erratic, starving, trap, miserable, unbearable, sucked, embarrassed, poison, annoyed, sparse, declined, blood, crying, robbed, suspicious, plagued, tense, swelling, crashing, frust, lethal, ludicrous, meaningless, #strike, fraudulent, grave, apologized, attacking, ruins, torture, bizarre, unnatural, garbage, spit, deceptive, confused, headache, lousy, sorry, incorrect, nasty, upsetting, chaotic, #unders, #block, injured, obese, decay, betrayed, crimes, teasing, thigh, demon, donkey, demons, flu, glut, fatally, hilar, cruelty, poisoned, um, uncomfortable, stripped, shitty, unfortunately, hurts, unhappy, ignores, rage, badly, cancer, sucks, creepy, lacking, severe, apologizing, insomnia, strang, allergic, furious, canceled, dismal, inconsistent, boo, sluggish, painfully, stupid, unreliable, fec, losses, worsen, blatant, arrest, shudder, conflicts, regrett, raging, omission, penalty, hacks, #ishable, neurot, seizures, diseases, falsely, corruption, thugs, controversy, riddled, draconian, greed, holistic, denial, killed, terribly, killing, stink, thieves, hazardous, dumb, culprit, fake, deception, poorest, refuses, fucking, disappointed, dizz, bleed, scars, miser, blank, flawed, fatal, hell, useless, upset, crashed, sloppy, crappy, homeless, tainted, stereotypical, deadly, brawl, #icide, horrifying, sickness, fatalities, invasive, rampage, dise, #acid, scathing, criticisms, thorn, touted, sly, devoid, scams, agony, exasper, robbery, breach, raped, conceive, induce, criminals, #sin, undesirable, exclus, mayhem, fictional, deserted, shouting, penalties, wasting, frustrated, failure, acids, deficiency, deaths, wast, zombie, numb, dismay, lies, shortest, deceived, boasts, deficient, mob, cries, distress, infamous, hideous, unable, disconnected, shortage, disrespect, unrealistic, bugs, bad, bloated, forced, ghetto, nonexistent, mush, acid, downright, smelled, anxiety, refuse, unsatisf, busted, ignoring, bullshit, immature, #drops, offensively, obesity, Military Acknowledgements Xiaocheng Feng is the corresponding author of this work.",437,438
172,17897333,"They could then go to a PC, activate ERIM-Interp with ERIM-Assist for French-Chinese, click on the icon of an available interpreter, and begin a mediated conversation, which would be recorded if participants agree while using the service free of charge.",24,25
173,15287917,"A1: Madonna's first album, Madonna, came out in 1983 and since then she's had a string of hits, been a major influence in the music industry and become an international icon.",36,37
174,11339780,"icon comprises lexical units, i.e. words or short sequences of words, along with their mapping to semantic referents, e.g. ""pink goalie"" → pink1.",0,1
175,218973962,"8) reads as follows: if there is a processor y and a notification event e n of some information i, performed by y with respect to a data subject w (to whom some personal data z are related, processed by a processor x and controlled by y), then y is permitted to attach an icon ic to e n .",60,61
176,218973962,"On the other hand, (9) states that in case the icon is in electronic form, it ought to be machine-readable.",13,14
177,218973962,"e at refers to the action of attaching an icon to the notification, performed by the controller y, while e l refers to the fact that the icon ic is in electronic form.",9,10
178,218973962,"e at refers to the action of attaching an icon to the notification, performed by the controller y, while e l refers to the fact that the icon ic is in electronic form.",29,30
179,8222337,"To make an informed choice, the user has to access information about each restaurant by clicking on its icon.",19,20
180,51848072,Each icon represented an intention and the corresponding speech command had to be spoken.,1,2
181,6294175,Section-based retrieval A click on the SideNoter icon in the search results or in outline view results in the screen transiting to paper browsing view.,9,10
182,239024671,"For example ""Billy Mays, … pop culture icon, died at home in Tampa.""",9,10
183,224755,"Every time a new item gets focus, the system reads out a voice icon -a spoken representation of the item.",14,15
184,224755,"Every time a new element gets focus, all any ongoing voice output is interrupted by the voice icon for the element in focus.",18,19
185,6714218,"Therefore, Speechify supports three modes for interaction: • push-to-talk -In this mode, when the user taps any non-interactive part of the application's display, a microphone icon is presented in a transparent overlay on the application, and the user may speak.",36,37
186,6714218,"wait-to-talk -In this mode, when the application is not itself talking, a microphone icon is presented in a transparent overlay on the application to indicate that the application is listening.",19,20
187,218974504,"These keywords reflect vocabulary used to describe items in the world (e.g. dog, woman, coffee cup), abstract concepts (e.g. happiness, success), and some domain specific vocabulary (e.g. icon, vector, background) .",37,38
188,243865433,"This back-and-forth often uses canonical scenes, visual metaphor, or icon compositions to express challenging words, making it an ideal test for mixing language and visual/symbolic communication in AI.",15,16
189,243865433,"Repurposing 22.5%, 32.0% An icon is used to represent an object different than its intended meaning, such as a scarf for 'scabbard', or box + ring for 'boxing ring'.",7,8
190,243865433,"The first game shows TDRAWER drawing 'origami' with a sushi icon (presumably to indicate Japan), a turning icon and finally a paper icon once the human has guessed 'folds'.",12,13
191,243865433,"The first game shows TDRAWER drawing 'origami' with a sushi icon (presumably to indicate Japan), a turning icon and finally a paper icon once the human has guessed 'folds'.",22,23
192,243865433,"The first game shows TDRAWER drawing 'origami' with a sushi icon (presumably to indicate Japan), a turning icon and finally a paper icon once the human has guessed 'folds'.",27,28
193,243865433,"First, the Drawer is shown a short phrase and cre- Verb Icon 41.0%, 25.5% A single icon is used to indicate the verb, such as hammer for 'building' or eyes for 'reading'.",20,21
194,243865433,"Although this involves a visual modality, we propose to use language models for this task because (1) the icon names can be used to understand the drawing and (2) Iconary often requires using word knowledge (e.g., mapping person and thumb icons to 'hitchhiking' or milk and ice cream icons to 'milkshake') that is known to be captured by these models (Roberts et al.,",21,22
195,243865433,"A description of each icon is built by incorporating the icon name, possibly the prefix 'huge', 'large', 'small' and 'tiny' based on the icon's size relative to the other icons, the prefix 'rotated' if the icon is rotated, and the prefix 'flipped' if the icon is reflected.",4,5
196,243865433,"A description of each icon is built by incorporating the icon name, possibly the prefix 'huge', 'large', 'small' and 'tiny' based on the icon's size relative to the other icons, the prefix 'rotated' if the icon is rotated, and the prefix 'flipped' if the icon is reflected.",10,11
197,243865433,"A description of each icon is built by incorporating the icon name, possibly the prefix 'huge', 'large', 'small' and 'tiny' based on the icon's size relative to the other icons, the prefix 'rotated' if the icon is rotated, and the prefix 'flipped' if the icon is reflected.",34,35
198,243865433,"A description of each icon is built by incorporating the icon name, possibly the prefix 'huge', 'large', 'small' and 'tiny' based on the icon's size relative to the other icons, the prefix 'rotated' if the icon is rotated, and the prefix 'flipped' if the icon is reflected.",50,51
199,243865433,"A description of each icon is built by incorporating the icon name, possibly the prefix 'huge', 'large', 'small' and 'tiny' based on the icon's size relative to the other icons, the prefix 'rotated' if the icon is rotated, and the prefix 'flipped' if the icon is reflected.",62,63
200,243865433,"The output encodes icons with six special tokens, each drawn from a set of new tokens added to T5's vocabulary and initialized with random embeddings, one indicating the icon name, and five indicating the quantized x coordinate, y coordinate, scale, rotation and reflection (quantized with 32, 16, 11, 8 and 2 buckets respectively).",31,32
201,243865433,BART Drawer shows better perplexity but significantly worse icon overlap.,8,9
202,243865433,"but not OOD, which suggests the model struggles to make use of modifiers for unseen words, however just treating the drawing as a set of icon names clearly harms performance.",27,28
203,243865433,"While this can involve related skills like understanding arrows or using icons to represent concepts, diagrams are usually used to convey technical information and therefore are unlikely to use things like visual metaphor, scenes, or icon compositions to signal words.",38,39
204,243865433,Figure 2 shows games where the human player drew the icon compositions which were then sent to TGUESSER to guess.,10,11
205,243865433,Both models use a data augmentation strategy that leverages an icon to word mapping derived from the training data.,10,11
206,243865433,"Unlike TDRAWER, the icon ordering for the input and target output is determined by the word-toicon mapping described in Section I.3, in particular, icons are ordered in the order of the words they correspond to, and then in the order in which they were drawn.",4,5
207,243865433,"First, we derive an icon-to-word mapping from the training data using icon/word co-occurrences by learning icon/word embeddings that are similar for drawings and game phrases found in our data, but dissimilar for drawings paired with random game phrases.",5,6
208,243865433,"First, we derive an icon-to-word mapping from the training data using icon/word co-occurrences by learning icon/word embeddings that are similar for drawings and game phrases found in our data, but dissimilar for drawings paired with random game phrases.",16,17
209,243865433,"First, we derive an icon-to-word mapping from the training data using icon/word co-occurrences by learning icon/word embeddings that are similar for drawings and game phrases found in our data, but dissimilar for drawings paired with random game phrases.",24,25
