,corpus_id,sentence,start_idx,end_idx
307,236459932,"Our ongoing work aims to develop an automatic evaluation for path rationality to improve the mining quality, and thus facilitate our inferential pipeline.",11,12
308,248780430,"We apply the proposed L2I to TAGOP, the state-of-theart solution on TAT-QA, validating the rationality and effectiveness of our approach.",22,23
309,248780430,"We construct a challenging HQA dataset and conduct extensive experiments on the dataset, where the performance validates the rationality and effectiveness of the proposed L2I. Hypothetical Question Answering In the general setting of machine reading comprehension, the task is to answer a question according to the facts in a given context.",19,20
310,248780430,Such significant performance gain validates the effectiveness of the L2I module and reveal the rationality of modeling counterfactual thinking as a neural network module.,14,15
311,248780430,"From the figure, we can observe that: 1) The default choice largely outperforms the variants, validating the rationality of our module design.",21,22
312,248780430,"1) On most groups, TAGOP-L2I largely outperforms TAGOP-L2I-T, demonstrating the rationality of learning to imagine explicitly.",19,20
313,51874519,"Although we have already used NPMI in the semantic coherent score for finding semantically coherent links, it does not influence the rationality of the metric used for topic evaluation, because the semantic coherent score is defined upon two word types while the NPMI score on topics is defined upon two phrase types.",22,23
314,235358557,"We conduct extensive experiments, which validate the rationality and effectiveness of the proposed method.",8,9
315,235358557,"min ω (x * c ,c)∈T * r u * c , ũc + γl c, f (x * c − u * c | θ) + r u, ũc + γl y, f (x − u| θ) , (6) The rationality of setting ũc = 1 2 (x + x * c ) as the target class irrelevant content of x and x * c comes from the parallelogram law (Nash, 2003) .",52,53
316,235358557,"The performance gain is attributed to the retrospection module, which justifies the rationality and effectiveness of incorporating counterfactual thinking into the inference stage of language understanding model.",13,14
317,235358557,"Besides, the result indicates that training with counterfactual samples is insufficient for achieving counterfactual thinking, which reflects the rationality of enhancing the inference paradigm with a decision making procedure.",20,21
318,235358557,"Table 2 shows the performance, where we have the following observations: 1) The implicit modeling performs much worse than the proposed CRM in most cases, which justifies the effectiveness of the retrospection module and the rationality of modeling comparison explicitly.",39,40
319,235352906,"Nonetheless, our approach, without any additional training data, still achieves better performance, demonstrating its effectiveness and rationality.",20,21
320,235352906,"Polarity Check, Value Prediction, and World Comparison, three modules that require classification capability based on the given span prediction of the upstream modules, achieved high accuracy (88.8%, 91.5%, and 84.6%), indicating the rationality of our end-to-end sequential model design.",44,45
321,235352906,"To further examine the rationality of our work, we conduct an ablation study on partial modules.",4,5
322,208058458,"Both the golden reference and the model generated translations gain higher alignment score from D, which illustrates the rationality of discriminator design.",19,20
323,2664824,"If we achieve the learnt embeddings for all the entities, relations and words in mentions, we can simply use Equation ( 7 ) to measure the rationality of a relation r appearing between a pair of entities h, t with the evidence of m: Score(h, r, t, m) = D r (h, r, t) + D m (r, m) (7) Experiments We set up three objectives for evaluating the effectiveness of JRME, which are: • testing the effectiveness of JRME in terms of different evaluation protocols/metrics; • comparing the performances of JRME with other cutting-edge approaches; • judging the robustness of the proposed model by using a larger but noisy dataset.",28,29
324,85556928,"Alternatively, one can base an argument on morality and rationality of animals, or lack thereof.",10,11
325,85556928,"For example, for the claim in Figure 1 , multiple (nonredundant) perspectives should be retrieved from a pool of perspectives; one of them is ""animals have no interest or rationality"", a perspective that should be identified as taking an opposing stance with respect to the claim.",34,35
326,235097665,2021) uses some commonsense to generate a response with both rationality and emotion.,11,12
327,91184307,"The listener model and the base speaker model together define a pragmatic speaker, with output score given by: S R 1 (o | i) = L R (i | o) λ • S 0 (o | i) 1−λ (1) where λ is a rationality parameter that controls how much the model optimizes for discriminative outputs (see Monroe et al. (",53,54
328,91184307,"The listener L D and pragmatic speaker S D 1 are derived from the base speaker S 0 and a belief distribution p t (•) maintained at each timestep t over the possible inputs I D : L D (i | o <t ) ∝ S 0 (o <t | i) • p t−1 (i) (2) S D 1 (o t | i, o <t ) ∝ L D (i | o <t ) α • S 0 (o t | i, o <t ) (3) p t (i) ∝ S 0 (o t | i, o <t ) • L D (i | o <t ) (4) where α is again a rationality parameter, and the initial belief distribution p 0 (•) is uniform, i.e., p 0 (i) = p 0 ( ı ) = 0.5.",143,144
329,235254600,"Specifically, the guidance explains the rationality of the formulation of Eq.(",6,7
330,235254521,"We further explore using indicative words in history queries to interpret quotations, which shows rationality of our method.",15,16
331,247158115,"More interestingly, the commonsense and the entity concepts could explain the rationality of the predicted answer entities to enhance the users' credibility of the answers.",12,13
332,222341502,"Besides, our SAU-Solver also includes a novel subtree-level semanticallyaligned regularization to further enforce the semantic constraints and rationality of the generated expression tree by aligning with the contextual information.",22,23
333,222341502,"Besides, to further enforce the semantic constraints and rationality of the generated expression tree, we also propose a subtree-level semanticallyaligned regularization to further improve subtreelevel semantic representation by aligning with the contextual information of a problem, which can improve answer accuracy effectively.",9,10
334,216868075,"The hyperparameters include rationality α, entropy penalty β, and number of examples in a partition cell.",3,4
335,4899062,"The pragmatic listener L 0 is then defined in terms of this literal agent and a prior P (w) over possible images: L 0 (w|u) / S 0 (u|w) ⇤ P (w) P w 0 2W S 0 (u|w 0 ) ⇤ P (w 0 ) (1) The pragmatic speaker S 1 is then defined in terms of this pragmatic listener, with the addition of a rationality parameter ↵ > 0 governing how much it takes into account the L 0 distribution when choosing utterances.",80,81
336,4899062,"Hyperparameters We use a beam search with width 10 to produce captions, and a rationality parameter of ↵ = 5.0 for the S 1 .",15,16
337,235731777,Extensive experiments on public Math23K and our proposed CM17k demonstrate the superiority of our NS-Solver compared to stateof-the-art methods in predicting final results while ensuring intermediate equation rationality.,34,35
338,235731777,Extensive experiments on Math23K and CM17K demonstrate the superiority of our NS-Solver compared to state-ofthe-art methods in answer accuracy while ensuring intermediate equation rationality.,31,32
339,238582894,tion studies demonstrate the rationality and robustness of our self-collaborative denoising framework.,4,5
340,237353191,This pilot experiment proves the rationality of our proposed format.,5,6
341,222310263,"Position embeddings initialization To verify the rationality of E repeat , we also proposed two other methods as the comparison.",6,7
342,202677562,"-RL"" also performs worse, which again demonstrates the rationality of applying RL.",10,11
343,235266120,This result also showed the rationality of our extrinsic evaluation metrics.,5,6
344,235266120,Our results showed the rationality of adding such extensive evaluation.,4,5
345,229365756,"In particular, nouns in Tamil are inflected for number, gender, case and animacy while verbs are inflected for tense, mood, aspect, negation, interrogation, information about emphasis, speaker perspective, sentience or rationality, and conditional and causal relations.",40,41
346,239618391,"Engaging Comments: Engaging comments comprise language centering around rationality, mutual respect, empathy for others and their standpoints, and mediation (IAA: 0.71 < α < 1.0).",9,10
347,940795,"As underlined in Rhetorics and Argumentation Theory (Perelman and Olbrechts-Tyteca, 1973; van Eemeren and Eemeren, 2009) , the persuasiveness of a message lies at the interface between discourse form (i.e., use of hedges, connectives, rhetorical questions) and conceptual form such as the artful use of ethos (credibility and trustworthiness of the speaker), pathos (appeal to audience feelings), and logos (appeal to the rationality of the audience through logical reasoning).",81,82
348,940795,"The higher consensus in the labeling of ""agreement""(C A ) versus other types of evaluations can be explained looking at linguistic triggers: while ""agreement"" is signaled by unambiguous linguistic clues (I agree, you are right, yes), the degree of rationality/emotions conveyed by a judgment is not always transparent given the semantics of the sentiment expressed, but may call for wider contextual features.",48,49
349,2425509,"As judgment is a kind of response made by the rational subjective world to the objective world and the emotional subjective world, judgment and AEC combine to describe the relationship between subjectivity and objectivity, between rationality and emotionality (Zhang Keliang, 2002) .",37,38
350,21709510,"2014) reported on annotating Arabic data for gender, number and rationality (a hyponym of animacy).",12,13
351,21709510,"Moreover, what separates humans from non-humans is the feature of 'rationality'.",14,15
352,21709510,"The tag unsps_a is reserved for quantifiers (when used nominally), as they do not have intrinsic rationality and can be used variably to refer to rational or irrational objects, e.g. Al-baEoD ""some"", Al->akovar ""most"".",19,20
353,21709510,"Plurals that can receive plural inflection, such as: jamAEap ""group"", fariyq ""team"" (rationality: irrat).",20,21
354,21709510,"These are plurals not derived from the singular forms, e.g. nisA' ""women"", nAs ""people"" (rationality: rat).",22,23
355,21709510,"These plurals that do not have singular forms, e.g. ramol ""sand"", turAb ""dust"", DabAb ""cloud"" (rationality: irrat).",25,26
356,21709510,"In this class, the lemma has a plural meaning, and the singular is derived from the plural by adding a morpheme (taa marboutah) in the end, such as: baqar ""cows"", *ubAb ""flies"", tuf AH ""apples"" (rationality: irrat).",51,52
357,233189589,"To improve the quality and rationality of the generation, it is essential to retrieve suitable templates for it.",5,6
358,218974417,"Pártkongresszus ""8th Party Congress"", munkásosztály ""working class"", vállalás teljesítés ""fulfill commitment"", Csepel Vas ""Csepel Iron"", szocialista ""socialist"", osztályharc ""class struggle"", Háry Béla ""Béla Háry"", proletárdiktat úra ""dictatorship of the ploretariat"", szocialista munkaverseny-mozgalom ""socialist labor competition movement"", pártszervezet ""party organization"" Negative Propaganda burzsoá ""burgeois"", gyarmatosító ""colonis"", monopólium ""monopoly"", imperialista ország ""imperialist country"", kulák ""kulak"", imperialista ""imperialist"", szektás ""sect member"", uszítás ""incitement"", fenyegető ""threatening"", esztelen ""brainless"", reakciós ""reactionary"", józanabb ""more sober"", zsarolás ""blackmailing"", reakciósabb ""more reactionary"", nagybirtokos ""landowner"", faji ""racial"", veszedelmes ""dangerous"", feudális ""feudal"", ellenforradalom ""counter-revolution"", amerikai imperialista ""American imperialist"", tőkés ""capitalist"", totális ""absolute"", kapitalista ""capitalist"", lepel ""cover"", szít ""incite"", kispolgár ""petty burgeois"", ellenség ""enemy"", kaland ""adventure"", makacs ""stubborn"" Technology & Development teljesítményorientáltság ""performance-orientedness"", hatékony ""effective"", fejlődés ""development"", lényegi változás ""substantive change"", energia felszabadítás ""energy release"", vállalkozás ""enterprise"", kezdeményezés ""initiative"", erőteljes kibontakozás ""powerful evolution"", szemlélet erősödés ""perspective strengthening"", előrehaladás kulcskérdése ""key to progress"", meg újítás ""renewal"", eredmény ""result"", demokratizmus továbbfejlesztése ""development of democracy"", újjáalakítás ""reconstruction"", alkotókepesség kibontakoztatás ""evolvement of creative ability"", korszer űség ""modernity"", szemléletváltás ""change of perspective"", kormányzati irányátás ""governmental guidance"", fejlesztést célzó ""targeting development"", mechanizmus korszerűsítése ""modernizing the mechanism"", fejtesztés ""development"", kibontakoztatás ""evolvement"", hatékonyság ""effectiveness"", önállóság ""autonomy"", racionalitás ""rationality"" Table 1 : List of tokens belonging to the three lexicons we use to analyze trends in propaganda discourse.",382,383
359,16709891,"The first primarily makes use of a rulesbased method, while the second integrates parameters of similarity and syntax rationality using a linear regression model to predict erroneous characters.",19,20
360,16709891,"The first primarily makes use of a rules-based method, while the second integrates parameters of similarity and syntax rationality using a linear regression model to predict erroneous characters.",21,22
361,218973686,"We collected ratings from MTurk with regard to user rationality, user naturalness, and perceived task completion for both real users (WOz dialogues) and SUs.",9,10
362,218973686,"User rationality, user naturalness, and perceived task completion (whether the MTurkers thought that the tasks were accomplished) roughly evaluate the logic, natural language component, and persistence of the SU.",1,2
363,218973686,"We recruited 100 MTurkers and each MTurker had to rate 15 dialogues with regard to the rationality and naturalness of the user on a 7-point Likert scale (1:low, 7:high), and perceived task completion.",16,17
364,218973686,"The results with regard to user rationality, user naturalness, and perceived task completion are shown in Table 4 .",6,7
365,218973686,Finally the full-input SU is significantly different from the real user in terms of rationality (p=0.0412) and naturalness (p=0.0099).,16,17
366,208084430,"Animals have no interest or rationality."").",5,6
367,208084430,"Animals have no interest or rationality.""),",5,6
368,236460120,"Human Evaluation In order to ensure the rationality/correctness of the generated summary, we also conducted a human evaluation.",7,8
369,11202498,The similarity of projection vectors of different types of entities and relations indicates the rationality of our method.,14,15
370,227044274,"In addition to investigating various types of length normalization, their rationality is rarely explored.",11,12
371,16817780,"Evolutionary Game Theory EGT has been introduce by Smith and Price (1973) overcoming some limitations of traditional GT such as the hyper-rationality imposed on the players, in fact in real life situations the players choose a strategy according to heuristics or social norms (Szabó and Fath, 2007) .",25,26
372,201680290,Ahern and Clark (2017) demonstrate how rationality principles can account for semantic drift phenomena.,8,9
373,203688974,"Morphology of Tamil Verb morphology Verbs in Tamil realise a range of information including tense, mood, aspect, negation, interrogation, information about emphasis, speaker perspective, sentience or rationality, and conditional and causal relations (Annamalai et al.,",33,34
374,203688974,"In Tamil, PNG and rationality are expressed via a single portmanteau form (Nuhman, 1999; Sarveswaran et al.,",5,6
375,203688974,"Because PNG and rationality are marked by a single morph in Tamil, it is more efficient from a grammar engineering perspective to handle them together, thus reducing the number of lexical rules in the grammar (Butt et al.,",3,4
376,7655549,The assumption of rationality in ACT-R implies that retrievability is governed by the expectation to make use of a piece of information at a later point.,3,4
377,14544878,"Evolutionary Game Theory Evolutionary game theory was introduced by Smith and Price (1973) , overcoming some limitations of traditional game theory, such as the hyper-rationality imposed on the players.",29,30
378,5476154,"Since then, various finite-state approximations of OT have been developed that achieve rationality by modifying the framework to reduce its computational power.",15,16
379,5476154,"The rationality of HS provides an interesting distinction between standard OT and HS, and presents motivation for further work on HS phonology.",1,2
380,245118159,"The conflict of rationality we are about to consider is the most exasperating one known to man because it stems from the direct opposition of creative and conservative assumptions about what information is, where it comes from, and how it is used.",3,4
381,247996664,"We can formulate the optimality model with the Boltzmann distribution common in IRL, where speakers are noisily-rational about which trajectories to refer to: p opt (ξ | θ, M) ∝ exp(βr θ (ξ; M)), with rationality parameter β.",47,48
382,247996664,"2019) encoder: p L base (ξ | u, M) ∝ exp(MLP L base (ξ) • BERT L (u)) where the distribution is normalized over all actions (flights) available in the context, ξ ∈ M. We set the rationality parameter β = ∞ in p opt as speakers tend to refer primarily to the optimal option in our domain.",50,51
383,40901022,"<…> A motorcycle functions entirely in accordance with the laws of reason, and a study of the art of motorcycle maintenance is really a miniature study of the art of rationality itself.",33,34
384,7830505,"One intuitive reason for this model strategy is that the SRC step can use the same feature set as BI, and it can further prove the rationality of our feature optimization method.",27,28
385,2519809,"Also speech act classification is abandoned, in favour of contextual reasoning and rationality considerations.",13,14
386,2519809,"The decision about what to say next falls out as a result of the agent complying with the communicative principles which refer to the agent's rationality, sire cerity, motivation and consideration.",26,27
387,2519809,"Constructive Dialogue Model 2.1 Rational, (:()operative way to react Rational agents try to follow the principles of Ideal Cooperation (Allwood, 1976) in comimmication: (1) assume a joint l)urpose, (2) show cognitive consideration (epistemic rationality regarding appropriate ways to react) and ethical consideration (intention to react in a way that does not prevent the partner fi'om fiflfilling her goals), and (3) trust, that the partner is acting according to the same principles.",46,47
388,2519809,"In CDM, these aspects form the basis of the system's functionality: dialogues are regarded as collaborative activities, planned locally in the changed context as reactions to the previous contributions and governed by the rationality principles of Ideal Cooperation.",37,38
389,2519809,The logical omniscience assumption is tackled by partitioning the Context Model and focussing on specific knowledge with the hel f ) of thematic coherence; also rationality considerations constrain reasoning.,26,27
390,2519809,"We Mso use contextual knowledge extensively, and connect intention-based approaches to practical dialogue management: rationality and cooperation are not only tied to the agent's beliefs and intentions of the desidered next state of the world, but also to the wider social context in which the communication takes place.",18,19
391,13164636,"Another lexical challenge stems from the fact that existing Arabic lexical resources do not encode information on gender and rationality of nouns, which is crucial for enforcing N-Adj agreement.",19,20
392,13164636,"We implemented rules for the enforcement of N-Adj agreement on rationality and gender, and for V-Prep long distance collocation; but we still do not have the large-scale lexical resources to fully solve these problems.",12,13
393,13164636,"Irrational plural noun agreement The naïve solution is to lexically determine the rationality of each noun, and let two different rules generate the verb in the correct form according to the subject's rationality (given that the subject is plural).",12,13
394,13164636,"Irrational plural noun agreement The naïve solution is to lexically determine the rationality of each noun, and let two different rules generate the verb in the correct form according to the subject's rationality (given that the subject is plural).",34,35
395,13164636,"However, information on rationality is not currently available.",4,5
396,248779921,"3) DIST and Ent do not consider fluency and rationality, higher is not always better.",10,11
397,248779921,"We employed 3 well-educated native speakers as volunteers to score 200 sampled cases (1,000 comparisons in total) from three criteria: 1) Fluency considers the fluency; 2) Rationality measures the relevance and rationality; 3) Informativeness measures the quality of the information offered in the generated response.",39,40
398,248779921,"In terms of rationality and informativeness, the results are more distinguishable and can reflect the advantage of using external knowledge.",3,4
399,196178233,"Similarly, the pragmatic speaker s 1 computes an utterance distribution with respect to a literal listener l 0 , an utterance prior p(U | O), and a rationality parameter α.",30,31
400,196178233,"We generally use speaker rationality α = 8.0 based on dev set tuning, and we follow Monroe et al. (",4,5
401,7152340,The rationality of PU learning is closely related to human performance.,1,2
402,18751045,"Although a formal model of referring built within the framework of a general theory of speech acts and rationality is given in (Appelt and Kronfeld, 1987) , and this can be used to explain how referring acts achieve multiple goals, there is a gap between the general model and the planning of the linguistic content of a referring expression.",18,19
403,233864979,"Privileging a particular ethical or legal standard over another (or a particular interpretation of a common standard) could fuel the suspicion that, instead of reflecting a perspective of detached and 'pure rationality', such standards and interpretations are in fact just entrenching local (and, for that mat-ter, Western European or, more generally, Global Northern) prejudices and preconceptions, imposing them as mandatory norms on researchers who might not reflectively endorse them.",35,36
404,236477366,"To improve the diversity and rationality of the generated story endings, (Li et al.,",5,6
405,1854889,"RSA postulates a model of a pragmatic speaker (Figure 2c ) that behaves according to a distribution that soft-maximizes a utility function rewarding informativity and penalizing cost: C = { xx , xx , xx }; Figure s 1 (u | t, L) ∝ e α log(l 0 (t|u,L))−κ(u) (2) Here, κ is a real-valued cost function on utterances, and α ∈ [0, ∞) is an inverse temperature parameter governing the ""rationality"" of the speaker model.",93,94
406,7719615,We utilize the Decentralized Partially Observable Markov Decision Process (Dec-POMDP) model of multi-agent decision making which relies only on basic definitions of rationality and the ability of agents to reason about each other's beliefs in maximizing joint utility.,28,29
407,227305529,"Comparison with unified models (1) Over the best non-CRF baseline model Proto-Dot, PA-CRF achieves substantial improvements of 3.43%, 3.44%, 3.44% and 2.86% on four few-shot scenarios respectively, which confirms the effectiveness and rationality of PA-CRF to model the label dependency. (",50,51
408,231698993,"Open-mindedness is found to help in conflict resolution (Tjosvold and Morishima, 1999; Tjosvold and Poon, 1998) , boost creativity (Mitchell and Nicholas, 2006; Keskin, 2006) , increase rationality and neutrality, and play a significant role in the theory of education (Hare, 1993) .",39,40
409,236477631,"2021) , such as sampling a review from a corpus of product reviews and treating it as a summary of the remaining reviews, but such settings may lack rationality to guarantee the relevance of reviews and constructed pseudo-summaries.",30,31
410,893234,"2011) , assumptions about bounded rationality (Camerer et al.,",6,7
411,10681279,"Also, they have human-like constraints of imperfect information about each other; they do not know each other's reward function or degree of rationality (during learning our agents can be irrational).",27,28
412,226283918,"In particular, the average number of linked entities in the documents is 4.6, which illustrates the rationality of adopting hyperedges.",18,19
413,248780194,Random Insertion (RI) RI inserts edge-node pairs instead of concepts to preserve the rationality of AMR graph.,17,18
414,248780100,"We further investigate the rationality of CODE-SCRIBE's structure by comparison with five variants: (1) V-Copy that replaces MPG with the copying mechanism (See et al.,",4,5
