,corpus_id,sentence,start_idx,end_idx
175,237099288,It is noteworthy that even low rationality levels (α = 0.5 or λ = 0.7) improve the recall 5 .,6,7
176,237099288,"The average specificity for RSA with low rationality is surprisingly low, which could be due to the beam search scheme in which reasoning is integrated.",7,8
177,237099288,"Whereas there doesn't seem to be a systematic relation between rationality and the ratio of nouns and verbs, we observe a higher ratio for adjectives if rationality is increased.",11,12
178,237099288,"Whereas there doesn't seem to be a systematic relation between rationality and the ratio of nouns and verbs, we observe a higher ratio for adjectives if rationality is increased.",28,29
179,237558724,"2021) found similar trade-offs for decod-S 0 a group of people riding on the backs of horses S 1 two brown hornes grazing in a fenced grassy field S x two horses in a field in front of a field Figure 1 : Captions for the target image (large), generated by a literal (S 0 ), rational (S 1 ) and mixed speaker (S x ), with rationality parameter α = 5 and beam search.",80,81
180,237558724,"The pragmatic speaker S 1 is defined as: S 1 (u|w) ∝ L 0 (w|u) α * P(u) ∑ u ∈U L 0 (w|u ) α * P(u ) where P(u) is a uniform distribution over possible utterances U and α > 0 is a rationality parameter determining the relative influence of the pragmatic listener in the rational speaker, see Cohn-Gordon et al. (",53,54
181,27387420,"The best system achieves 93% error reduction on diacritization, 85% on case, 70-80% on voice, mood, state, and the Buckwalter tag, 55-69% on lemma, aspect, person, rationality, and token sequences, 40-49% on gender, number, and enclitics, 18-39% on proclitics, part-of-speech, and gloss.",43,44
182,18352263,"Also, one must note, that while the original treatment of these constructs deal with modelling agents in terms of bayesian rationality, we have no such unrealistic ambitions and are only using the broader framework to shed some light on the layers of perception that shape a speech act.",22,23
183,12085916,"This in a way is a rationality assumption: a rational speaker will, if at all, mention properties that are realised and not others (at least in non-negative contexts).",6,7
184,1190746,"Data Sources, Problem Definitions, and Motivation We provide information about the sources of our data, define the problems that we wish to solve, and explain the rationality of our approaches in this section.",30,31
185,236459913,"L rem = −logP (l mask |L tgt ∪ l wro , X) (10) The decoder could generate purificatory code relevant information with higher rationality with the above two tasks' learning.",28,29
186,3924348,"What makes all the difference here, rather, is the degree to which a usage is justified in terms of a strictly instrumental rationality.",24,25
187,14095338,"In discussing Gricean theory as regards those cases, I stress the importance of Grice's concept of ""rationality.""",19,20
188,14095338,"As previously mentioned, there are roughly two types of implicatures in view of Grice's notion of rationality.",18,19
189,9879031,"While mapping utterances to their underlying intentions is well studied through the application of plan recognition techniques (e.g., Grosz and Sidner (1990) , Allen and Litman (1987) ), game-theoretic models of rationality generally suggest that intentions result from a deliberation to find the optimal tradeoff between one's preferences and one's beliefs about possible outcomes (Rasmusen, 2007) .",40,41
190,218985642,"But Grice tacitly assumed a type of omniscient rationality: People in conversation have perfect knowledge of the language and the current common ground, and they have an unlimited processing capacity in choosing what to say.",8,9
191,218985642,"In reality, people's rationality is bounded, and that leads to quite a different view of language use.",5,6
192,218985642,I take up some of the consequences of bounded rationality in language use.,9,10
193,219571117,"A conservative speaker uses a description w k to identify x i in context C by striking a balance between the literal listener and literal speaker: S CB(λ) 1 (w k |x i , C) ∝ L 0 (x i |w k , C) λ S 0 (w k |x i , C) (9) The ""rationality parameter"" exponent λ is typically set to a value substantially greater than 1, which gives the model slim confidence that the listener will do cooperative reasoning to disambiguate.",66,67
194,3932031,"If A and B make certain assumptions about each other's rationality, they can use certain kinds of evidence, or states of affairs, to infer that each one of the infinite number of statements in mutual knowledge is true.",11,12
195,3932031,We will call this the rationality assumption.,5,6
196,3932031,"The assumptions Ann would need in order to infer mutual knowledge from immediate physical copresence are these: simultaneity, attention, and rationality.",23,24
197,3932031,"She would need an additional one for the delayed case: simultaneity, attention, rationality, and memory.",15,16
198,3932031,"Simultaneity, attention, and rationality refer to the assumptions we have described earlier.",5,6
199,11994461,"Thus, a further desirable property that will play a role for some annotation tasks is collective rationality (Grandi and Endriss, 2011) : if all individual annotations respect a given integrity constraint, then so should the collective annotation.",17,18
200,219308153,"The-assumptidns Ann would need fn order to infer mutual knowledge from immediate physical copresence are these: simultaneity, attention, and rationality.",24,25
201,219308153,"She would need an additional one fof the delayed case: simultanef t;y , attention, rationality, and memory.",16,17
202,219308153,"Simultaneity, attention, and rationality refer to the assumptions we have described earlier.",5,6
203,219308153,"To begin with, linguistic co-presence requires the assumptions of simultaneity, attention, and rationality.",17,18
204,247793069,"Finally, experimental results on three benchmark datasets demonstrate the effectiveness and the rationality of our proposed model and provide good interpretable insights for future semantic modeling.",13,14
205,247793069,"We conduct extensive experiments on three widely-used datasets where the results demonstrate the effectiveness, rationality and interpretability of the proposed model.",17,18
206,247793069,"To evaluate model rationality and interpretability, we conduct an study for dynamic semantic comprehension by eye tracker.",3,4
207,6090410,"We also ask human raters to rate negotiation transcripts between the RL policy and the agenda-based policy, regarding the rationality of the two negotiators.",22,23
208,6090410,"We also ask human raters to rate negotiation transcripts between the RL policy and the agenda-based SU, regarding the rationality of the two negotiators.",22,23
209,6090410,"In our negotiation task, both the agenda-based SU and the RL policy have human-like constraints of imperfect information about each other; they do not know each other's goals or preferences, number of available arguments, degree of persuadability, or degree of rationality.",50,51
210,6090410,"Interestingly, rationality was perceived differently by different human raters, e.g., revisiting an agreed-upon issue was considered as rational by some and irrational by others.",2,3
211,222133090,Extensive experiments in three fields demonstrate the effectiveness and rationality of our model compared with well-designed baselines and human-level evaluations.,9,10
212,222133090,Extensive experiments with datasets from three fields demonstrate the effectiveness and rationality of our model compared with well-designed baselines and human-level evaluations.,11,12
213,1263986,"We are the first to show that functional features for gender and number (e.g., ""broken plurals""), and optionally the related rationality (""humanness"") feature, are more helpful for parsing than form-based gender and number.",26,27
214,1263986,"This includes using functional NUMBER  and GENDER feature values, instead of form-based values; using the non-form-based rationality (RAT) feature; and combinations thereof.",25,26
215,1263986,"The rationality (or RAT) feature interacts with syntactic agreement and other inflectional features (discussed next); as such, we group it with those features in this article.",1,2
216,1263986,"6  Most available Arabic NLP tools and resources model morphology using formbased (""surface"") inflectional features, and do not mark rationality; this includes the Penn Arabic Treebank (PATB) (Maamouri et al.",25,26
217,1263986,"The Elixir-FM analyzer (Smrž 2007 ) readily provides the functional inflectional number feature, but not full functional gender (only for adjectives and verbs but not for nouns), nor rationality.",35,36
218,1263986,"In this article, we use an in-house system which provides functional gender, number, and rationality features (Alkuhlani and Habash 2012) .",19,20
219,1263986,Morpho-Syntactic Interactions Inflectional features and rationality interact with syntax in two ways.,7,8
220,1263986,"This section explores more sophisticated feature engineering: using functional NUMBER and GENDER feature values, instead of form-based values; using the non-form-based rationality (RAT) feature; and combinations thereof.",30,31
221,1263986,"Functional Gender and Number Features, and the Rationality Feature The ElixirFM lexical resource used previously provided functional NUMBER feature values but no functional GENDER values, nor RAT (rationality, or humanness) values.",30,31
222,1263986,"To address this issue, we use a version of the PATB3 training and dev sets manually annotated with functional gender, number, and rationality (Alkuhlani and Habash 2011) .",25,26
223,1263986,"19 The first part of Table 8 shows that the RAT (rationality) feature is very relevant (in gold), but suffers from low accuracy (no gains in machine-predicted input).",12,13
224,1263986,"The fourth part of the table shows the combination of these functional features with the other features that participated in the best combination so far (LMM, the extended DET2, and PERSON); without RAT, this combination is at least as useful as its form-based counterpart, in both gold and predicted input; adding RAT to this combination yields 0.4% (absolute) gain in gold, offering further support to the relevance of the rationality feature, but a slight decrease in predicted input, presumably due to insufficient accuracy again.",83,84
225,1263986,"Results with Easy-First Parser are consistently higher than the corresponding results with MaltParser, with similar trends for the various features' contribution: Functional GENDER and NUMBER features contribute more than their form-based counterparts, in both gold and predicted conditions; rationality (RAT) as a single feature on top of the POS tag set helps in gold (and with Easy-First Parser, also in predicted conditions)-but when used in combination with PERSON, LMM, functional GENDER, and NUMBER, it actually slightly lowers parsing scores in predicted conditions (but with Easy-First Parser, it helps in gold conditions); DET is the most useful single feature in predicted conditions (from those we tried here); and the best performing model in predicted conditions is the same as with MaltParser: CORE12+DET+LMM+PERSON+FN*NG.",47,48
226,1263986,"Both errors could be corrected (to the correct form as in our best model, on the righthand side of Figure 2 ) if functional morphological features were available to the parser, including the rationality feature, and if the parser could learn the agreement rule for non-rational subjects, as well as the requirement that the head of an idafa construction cannot have a definite article.",36,37
227,1263986,We then add the rationality feature (last line of Table 15 ).,4,5
228,1263986,We now see that all relations affected by agreement or assignment perform worse than without the rationality feature.,16,17
229,1263986,"The decrease in performance can be explained by the fact that the rationality (RAT) feature is not predicted with high accuracy; because it interacts directly with agreement, and because we are training on gold annotation, the models trained do not correspond to the seen data.",12,13
230,1263986,We expect rationality to contribute when we look at training that includes predicted features. (,2,3
231,1263986,"And, as expected, the penalty for using the rationality feature disappears because we have trained on predicted features as well.",10,11
232,1263986,"In fact the improvement due to rationality specifically benefits the relations affected by agreement and assignment, with subject reducing error by 13.4% now, nominal modification by 14.7%, and idafa by 34.0%.",6,7
233,1263986,"Note that the increase in the accuracy of idafa is probably not related to the interaction of syntax and morphology in assignment, because assignment in the idafa construction is not affected by rationality.",33,34
234,1263986,"Instead, we suspect that the parser can exploit the very different profile of the rationality feature in the dependent node of the idafa and modification constructions.",15,16
235,1263986,"Looking just at nominals, we see in the gold corpus that 62% of the dependents in a modification relation have no inherent rationality (this is the case notably for adjectives), whereas this number for idafa is only 18%.",24,25
236,1263986,"One difference stands out, however: whereas the MaltParser can exploit the rationality feature when trained on gold and predicted, the Easy-First Parser cannot.",13,14
237,1263986,"Object and prepositional modification perform identically with or without rationality, but subject and idafa perform worse; only nominal modification performs better (with overall performance decreasing).",9,10
238,1263986,"If we inspect the unlabeled attachment scores for subjects, we do detect an increase in accuracy (from 85.0% to 85.4%); perhaps the parser can exploit the rationality feature, but the labeler cannot.",32,33
239,1263986,"We further find that functional gender, number, and rationality features (FN*GENDER, FN*NUMBER, RAT) improve over form-based-only morphological features, as expected when considering the complex agreement rules of Arabic.",10,11
240,1263986,"The rationality (RAT) feature is more helpful in the gold condition, which suggests it is relevant; its associated parsing results in predicted condition are not as good, however.",1,2
241,14040767,"Third are the rationality (humanness) feature, which participates in morphosyntactic agreement in Arabic (Alkuhlani and Habash, 2011) , and a form of the lemma, which abstract over all inflectional morphology.",3,4
242,14040767,"Finally, we ran our existing converter (Alkuhlani and Habash, 2012) over this representation to obtain functional number and gender, as well as the rationality feature.",28,29
243,557333,"We further contrast the contribution of form-based and functional features, and show that functional gender and number (e.g., ""broken plurals"") and the related rationality feature improve over form-based features.",31,32
244,557333,"2 The rationality feature interacts with syntactic agreement and other inflectional features (discussed next); as such, we group it with those features in this paper's experiments.",2,3
245,557333,"Most available Arabic NLP tools and resources model morphology using surface inflectional features and do not mark rationality; this includes the PATB (Maamouri et al.,",17,18
246,557333,"The Elixir-FM analyzer (Smrž, 2007) readily provides the functional inflectional number feature, but not full functional gender (only for adjectives and verbs but not for nouns), nor rationality.",36,37
247,557333,"Most recently, Alkuhlani and Habash (2011) present a version of the PATB (part 3) that is annotated for functional gender, num-ber and rationality features for Arabic.",30,31
248,557333,Morpho-syntactic interactions Inflectional features and rationality interact with syntax in two ways.,7,8
249,557333,"For gender and number, we further back off to the surface values; for rationality, we back off to the most common value (irrational).",15,16
250,557333,"On our predicted dev set, the overall accuracy baseline of predicting correct functional gender-number-rationality using surface features is 85.1% (for all POS tags).",18,19
251,557333,"We further find that functional morphology features and rationality improve over surface morphological features, as predicted by the complex agreement rules of Arabic.",8,9
252,722195,"G w G s (11) We refer to Form (10) and (11) as fast MI (FMI) and fas us look back at the rationality ( ) G ws ation feature, o component parts are hardly independent since they are ""related"".",31,32
253,153312687,"System 1 could provide resources according to requests, while System 2 enables diving deeper into relational information by performing sequential thinking in the working memory, which is slower but with human-unique rationality (Baddeley, 1992) .",35,36
254,44144625,"The Effectiveness of Reinforcement Learning In It not only demonstrates the rationality of our pretraining strategy, but also verifies our hypothesis that most of the positive samples in Riedel dataset are true positive.",11,12
255,220045416,"Specifically, we first build a multi-hop generation model and guide it to satisfy the logical rationality by the reasoning chain extracted from a given text.",18,19
256,220045416,The logical rationality of the results is guided by the reasoning chain extracted from the text.,2,3
257,220045416,The evidential relations in the chain are used to enhance the logical rationality of the results.,12,13
258,220045416,"That is, the answer words may appear in the question that would reduce the rationality.",15,16
259,220045416,"The rating was in terms of three metrics, including valid syntax, relevance to input textual sentences, and logical rationality to the answer.",21,22
260,220045416,"Consistent with quantitatively analyzed results in Section 3.2, our model significantly outperformed all baselines in terms of three metrics, where the improvement on the rationality metric was the largest.",26,27
261,220045416,We first built a multi-hop QG model and guided it to satisfy the logical rationality by the reasoning chain extracted from a given text.,16,17
262,196182171,"2018) , rationality (Li et al.,",3,4
263,5845797,The result demonstrates the rationality of documentlevel reconstruction and the effectiveness of neural document model.,4,5
264,11422374,"This is demonstrated by the fact that words such as ""theory"" and ""function"" are among Input: Individual rationality, or doing what is best for oneself, is a standard model used to explain and predict human behavior, and von Neumann-Morgenstern game theory is the classical mathematical formalization of this theory in multiple-agent settings.",22,23
265,11422374,"Individual rationality, however, is an inadequate model for the synthesis of artificial social systems where cooperation is essential, since it does not permit the accommodation of group interests other than as aggregations of individual interests.",1,2
266,226262361,"On the one hand, such modeling helps evaluate the local coherence between the previously sorted sentences and the candidate sentence for investigating the rationality of each candidate choice.",24,25
267,248780318,"First, we cannot completely deny the rationality of evaluation 1.",8,9
268,202540096,Introduction Human beings are rational and a major component of rationality is the ability to reason.,10,11
269,202773257,Empirical results are used to verify the rationality of the SAC structure and demonstrate the SAC model's potential in performance improvement against our baseline approaches.,7,8
270,202773257,1 The empirical results verify the rationality of SAC's structure and demonstrate that the SAC model can reduce segmentation problems and exhibit good performance in recognizing enti-ties of different lengths.,6,7
271,202773257,"2) By analyzing the experimental results, we verify the rationality of SAC's structure and demonstrate the advantages of using the weighted sum of tag vectors compared to a list of scores denoting classification results.",11,12
272,202773257,"4 Experiments Development experiments To verify the rationality of the structure of SAC and the role of the tag vectors, we designed two development experiments on the CoNLL 2003 dataset.",7,8
273,196208027,The ablation analysis demonstrates the rationality of the method.,5,6
274,235390766,The rationality of this operation will be explained in the following analysis.,1,2
275,15281770,This paper proposes the use of a rationality model in a multi-agent framework to tackle this problem.,7,8
276,15281770,We employ a greedy strategy and use the NE rationality model to evaluate and detect all possible NEs in the text.,9,10
277,15281770,"In this paper, we consider a new approach of employing a rationality model in a multi-agent framework.",12,13
278,15281770,"First, we use an NE rationality measure to evaluate the probability of a sequence of tokens being a specific NE type, and adopt a greedy approach to detect all possible NEs.",6,7
279,15281770,The rest of the paper describes the details of our rationality-based and multi-agent negotiation approach to detect and refine NEs.,10,11
280,15281770,"The Rationality Computation If we know the probability distribution of each type of token in a window, NE recognition is then the procedure of evaluating the rationality or certainty of a sequence of tokens with respect to a NE type.",27,28
281,15281770,"We call R b R a c ab and ℜ ℜ ℜ , , the rationality values of tokens ab, a and b of being a PER, red ball or blue ball respectively.",15,16
282,15281770,"Surprisingly, our approach of rationality ℜ for NE with two tokens can be deduced as the product of their odds-likelihood.",5,6
283,15281770,"By linking the concept of odds-likelihood and rationality, we can compute the probability of a sequence of tokens being a specific NE type.",9,10
284,15281770,"Since the rationality values of tokens could vary from 0 to ∞, it may incur overflow or underflow during the rationality evaluation.",2,3
285,15281770,"Since the rationality values of tokens could vary from 0 to ∞, it may incur overflow or underflow during the rationality evaluation.",21,22
286,15281770,This is especially so for unknown tokens where their rationality values will be zero.,9,10
287,15281770,"To resolve this problem, we construct a piecewise function to map the rationality values from the range [0, ∞] to [ℜ min ,ℜ max ].",13,14
288,15281770,"Here we set the parameters ℜ min =0.05 and ℜ max =50, and ensure that most rationality values will retain their original values after transformation.",19,20
289,15281770,Multi-Agent Framework for NE Confirmation 3.1 Relationships between possible NEs Our greedy approach of identifying all possible NEs using the rationality model results in over segmentation of NEs.,22,23
290,15281770,"If we knew the relationships between possible NEs, we can use this knowledge to modify the rationality values of possible NEs.",17,18
291,15281770,"In a competition relationship, the rationality values of losing NEs are decremented, whereas in a supporting relationship, the rationality of the winning NE can be used to reinforce other NEs.",6,7
292,15281770,"In a competition relationship, the rationality values of losing NEs are decremented, whereas in a supporting relationship, the rationality of the winning NE can be used to reinforce other NEs.",21,22
293,15281770,Agent-based Reasoning & Negotiation There is a need to modify the rationality values of possible NEs in order to identify the best possible NEs.,13,14
294,15281770,"However, it is difficult to use the decision tree to handle multiple relationships between conflicting NEs, and to perform incremental updates of rationality values in situations where the number, distribution and relationships in possible NEs are uncertain.",24,25
295,15281770,"In this work, we adopt a multi-agent approach to refine the rationality of possible NEs and vote the best potential NEs.",14,15
296,15281770,"Following the approach taken in the DBI system, we use the rationality of the NE as the belief, denoted by Br(A), of agent A. Agents are divided into Teams (Decker & Lesser 95) according to their contents and positions in the corpus.",12,13
297,15281770,"The new agents would inherit the evidences, including the rationality values, of its child agents.",10,11
298,15281770,"Second, we compute the rationality value of each token in the context of being a keyword, general word, or as boundary (prefix or suffix) of a specific NE type.",5,6
299,15281770,"Forth, we modify the rationality values of all possible NEs using the agent-based negotiation methodology.",5,6
300,15281770,"Fifth, we select NEs with the labels of its corresponding seed if their rationality values are above a predefined limit θ.",14,15
301,15281770,b. We extract all possible NEs by using only the rationality-based approach where the threshold ℜ is set to 1.1.,10,11
302,15281770,"If there are conflicts between possible NEs, we simply select the NE with the maximal rationality.",16,17
303,15281770,c. We employ the agent-based modification in conjunction with the rationality-based approach to select the best possible NEs.,12,13
304,15281770,"For comparison purpose, we also list in  Table 3 shows that as we apply the rationality model (Config.",17,18
305,15281770,"In this paper, we propose a new approach of employing a rationality model in a multi-agent framework.",12,13
306,15281770,We employ a greedy strategy and use the NE rationality measures to detect all possible NEs in the text.,9,10
