,corpus_id,sentence,start_idx,end_idx
1188,239009738,"Fearing for their safety, Sam Rainsy and his then-ally Prince Norodom Ranariddh led an exodus of opposition lawmakers out of Cambodia after parliament was ceremonially opened in late September.",3,4
1189,855149,"For example, the following NP has only the opening speech mark: (NP (DT the) ('' '') (NML (NN type) (NN F) ) (NN safety) (NN shape) ) In order to find the closing speech mark, we must look into the surrounding context: In these cases, we could not bracket the speech marks properly without altering the existing structure.",36,37
1190,9463965,This popularity has caused safety concerns leading many US states to pass laws prohibiting texting while driving.,4,5
1191,216867371,"The safety is on , and it 's fully loaded with one in the chamber "" 30.",1,2
1192,216867371,"He said , pointing to the safety switch .",6,7
1193,216867371,"The weapon felt heavy in my hand , I flicked the safety off with my thumb and gripped the gun tightly .",11,12
1194,222310757,Such an error can be dangerous in safety-critical domains.,7,8
1195,17966769,I think that priority should be given to the safety.,9,10
1196,372086,iv T China seeks solutions to its coal mine safety.,9,10
1197,245838307,"2015) analyzed the personality of a blogger based on the Big Five, which is an emotion judgment system that estimates nine emotions, such as anger , sadness , joy , disappointment , regret , guilt , shame , fear , and safety (Tsuchiya et al.,",44,45
1198,49210924,"Source Sentence Selection We seek to generate an abstractive summary containing multiple sentences from a cluster of documents discussing a single topic (e.g., health and safety).",27,28
1199,233365141,Improvement in these occupations leads to better airspace safety and rescue outcomes.,8,9
1200,18208128,"In practice, we use this as a ""safety net"", in cases where the higher levels of interpretation have not been computed by the analysis on some part of the text, so that a mapping between low-level structures is better than nothing.",9,10
1201,18208128,"The ""safety net"" made of the multiplicity of levels of interpretation available on the same structure makes it possible to use a broad spectrum between high-level and word-by-word translation.",2,3
1202,235683542,"2013) , health (Furini and Menegoni, 2018) and public safety professionals (Procter et al.,",13,14
1203,248780012,"2  This poses a serious threat to privacy-conscious individuals, especially human rights activists and journalists who seek anonymity for safety.",23,24
1204,15945816,"The 46 topics belong to five different categories or domains: Accidents and natural disasters, Criminal or terrorist attacks, Health and safety, Endangered resources, and Investigations and trials.",23,24
1205,14221574,"that sucks Poor on u guys… [R7] For the safety of US, I'm for Trump to be president, especially after this. [",12,13
1206,567614,"The first design was, amongst other things, unable to flesh out the problem of robustness, Combining a muitidimensienal representation with a b~sically all paths combinatorial algoritbm led to the inability to rely on the actual computation of combinations of information required by the safety net algorithm.",48,49
1207,567614,"As a consequence, T. was split into two subtheories, T~ and T~, were the former was directed at the needs of adequacy for simple transfer and the latter to the reliability of TRA The motivation .[or this design hinged on (i) the fact that the f-stratum could make use of know-how in computational linguistics, (2) the f-stratum was a good starting point for innovative research on what T~. stlould be for multilingoal TBMT, (3) the model gave content to the notion of safety nets (rmbostness), ( 4 ) developmental issues, The claim made was that with a monolithic l., the formulation of safety nets is hindered hy the hybridity prohlem~ their' input domain coold be any unpredictable mombination of feasibly computable and adequate information on several dimensions in the gds. ]",99,100
1208,567614,"As a consequence, T. was split into two subtheories, T~ and T~, were the former was directed at the needs of adequacy for simple transfer and the latter to the reliability of TRA The motivation .[or this design hinged on (i) the fact that the f-stratum could make use of know-how in computational linguistics, (2) the f-stratum was a good starting point for innovative research on what T~. stlould be for multilingoal TBMT, (3) the model gave content to the notion of safety nets (rmbostness), ( 4 ) developmental issues, The claim made was that with a monolithic l., the formulation of safety nets is hindered hy the hybridity prohlem~ their' input domain coold be any unpredictable mombination of feasibly computable and adequate information on several dimensions in the gds. ]",124,125
1209,567614,he new design provided the f-stratum as a more reliable basis for' safe safety nets.,16,17
1210,567614,"Nor were considerations of the computational complexity of arbitrary treetransformation formalisms taken into account in the definition of the levelo, A proposal to relate all these levels to each other by giving them all a lexicalist underpinning was rejected by the C,E.C. Finally, a stratificatienal strategy was imposed on the makers of the design, with the (unjustified) intuition that it would provide a basis for the incorporation of safety nets into the model.",75,76
1211,226283897,"However, human translation is time-consuming and subject to errors, potentially leading to medication errors and other patient safety risks due to prescription ambiguity.",21,22
1212,226283897,"As we noted in Section 3.2, consistency of key information is vital for patient safety.",15,16
1213,18522417,Time-sensitive communication of critical imaging findings like pneumothorax or pulmonary embolism to referring physicians is important for patient safety.,20,21
1214,18522417,"Natural language processing (NLP) can automatically extract, track, and report these findings in a timely manner to support patient safety efforts.",23,24
1215,12522650,"But it has a poor safety record , with thousands of people dying in accidents every year , including in train derailments and collisions .",5,6
1216,51154491,"Even this type of situation might however enable (assuming one could find appropriate ways of storing and referring to the information) improved disambiguation, such as perhaps avoiding translating the Dutch ""Wees een heer in de verkeer"" (a safety slogan meaning ""be courteous in traffic"") as ""Be a man in traffic.""",43,44
1217,201684676,"Substantively, our findings should be replicated with additional hypothetically creeping concepts, such as ""mental illness"" and ""safety"".",21,22
1218,237940411,"Additional measures for safety during the COVID-19 pandemic were taken with disinfection of the material, obligatory masks and breaks between scheduled recording sessions.",3,4
1219,496893,"If an utterance cannot be analyzed completely at the highest level of interpretation, it is still possible to translate the faulty part (and not the whole utterance) by starting from the next lower level, which acts as a kind of ""safety net"", and not word for word.",46,47
1220,496893,"We have already mentioned the ""safety net"" view of the various levels encoded in the m-structures, and the possibility to control the parallelism (or difference) in style if necessary.",6,7
1221,202625201,"Importantly, these systems improve safety and convenience in hands-free interactions, such as using Apple's Siri to dial contacts while driving.",5,6
1222,232168787,This suggests that there are no universally sensitive topics; their safety depends on the context and the goals of a conversation.,11,12
1223,237295792,"The Commission departments we serve in Luxembourg all deal with fairly technical subjects -medicine, industrial safety, coal and steel, statistics, finance, nuclear safeguards and information science -and to enable translators to cope more efficiently with this wide range of subject-matter, each translation division has a system of specialised groups.",16,17
1224,235097450,"In order to ensure safety and well * * Joint First Author being of online information consumers, it is crucial to identify and curb the spread of false information.",4,5
1225,233219395,"With safety in mind, numerous detoxification techniques (e.g., Dathathri et al.",1,2
1226,233210709,"The space shuttle program began in 1977 with Politics: The issue focused on how much power each company was willing to use in response to the request.\n\nAccording to the complaint, Comcast has not been forthcoming with any data, such as how often it uses the technology, and what it has paid for it, in order to meet the FCC's mandate to make its own data more accessible.\n\nAnd, according to the suit, the company also Military: The issue focused on the use of force by the armed forces and police, as well as the use of lethal force by civilians.\n\nThe bill would require that a shooting occur ""with reasonable care,"" meaning a shot was ""justified"" under the circumstances of the case and not in retaliation for an act of violence, and that a shooting was ""necessary for the safety of the officer or the Table 18 : The first generation by FUDGE using λ = 2 on the space, politics, and military topics given the prefix ""The issue focused on.""",154,155
1227,233210709,"In other words, a system based upon meritocracy and equality for all candidates, voters, candidates and parties.\n\nThe American people have a right to know whether the current system for electing state Military: More importantly, the military has a great deal of leverage with its own soldiers and their superiors, and its willingness to use that leverage to force an immediate end to this practice of indefinite detention and indefinite imprisonment was demonstrated by the recent court order issued by the US District Court for the District of Columbia, which requires the release of an Iraqi-American held in an indefinite military detentions facility and a detainee Legal: More importantly, in an effort to make the case that the law was needed because of its effects on the state's economy, the law's supporters claimed that the ""death penalty was necessary to protect public safety."" (",156,157
1228,248780215,"However, mental health is a safety-critical realm, where technological failure could lead to severe harm to users on social media (Sittig and Singh, 2015) .",6,7
1229,235097334,"Such conspiracy theories, when shared widely online, could influence people to make choices based on those beliefs which can jeopardize their own health and safety as well as others around them.",26,27
1230,232258000,"It consists of the most com-mon scientific or medical myths about COVID-19, which must be debunked correctly to ensure the safety of the public (e.g., ""drinking a bleach solution will prevent you from getting COVID-19"").",23,24
1231,248811664,"Large pre-trained neural language models have supported the effectiveness of many NLP tasks, yet are still prone to generating toxic language hindering the safety of their use.",26,27
1232,248085885,"After that, we investigate and discover an interesting relationship between framing bias and hallucination, an important safety-related problem in generation tasks.",18,19
1233,230435779,"In general, security breaches expose the users to different risks such as financial loss (due to losing employment or business opportunities), physical risks to safety, and identity theft.",28,29
1234,2715901,"<p> Fighter Squadron 213, a 14-plane unit based in Miramar Naval Base near San Diego, had developed by far the worst safety record among the Navy's 13 F-14 squadrons, with four crashes over the last 16 months, three after Kilian became its leader.",27,28
1235,2715901,"<p> Fighter Squadron 213, a 14-plane unit based in Miramar Naval Base near San Diego, had developed by far the worst safety record among the Navy's 13 F-14 squadrons, with four crashes over the last 16 months, three after Kilian became its leader.",27,28
1236,215415943,"the dark trend of governments using the death penalty in a futile attempt to tackle real or imaginary threats to state security and public safety was stark last year, "" said salil shetty, amnesty's secretary general in a release. """,24,25
1237,238873,"Integer fields represent numeric properties of the world such as temperature, string fields represent surface-level identifiers such as names of people, and categorical fields represent discrete concepts such as score types in football (touchdown, field goal, and safety).",44,45
1238,248779889,"The goal of developing such technologies is first and foremost to help efforts in improving language transmission and cultural safety and preservation for Innu-Aimun speakers, as those are considered urgent and vital issues.",19,20
1239,248779889,"Cultural safety overall has been identified as important to ensure safe interactions with health workers: if interactions between indigenous patients and health workers are not adequate, this can lead to potentially disastrous situations like death, as has been recently concluded by a coroner inquiry following the death of an indigenous patient in Canada 19 .",1,2
1240,248779889,"When it comes to interactions in the context of health and education services, ensuring language knowledge becomes a matter of cultural safety.",22,23
1241,248779889,We think the development of cross-lingual Innu-Aimun technologies is in line with those efforts and could be of great help to ensure cultural safety.,27,28
1242,248779889,We believe language technologies like machine translation could be useful in the efforts to ensure language transmission and improve cultural safety in services.,20,21
1243,237295800,"In this work is it not only necessary to collect solid information and documentation but the terminologist also has to pursue his investigation further to obtain a certain command of the terminology in a given field: mining, steelmaking, occupational health and safety, data processing, etc.",44,45
1244,31544729,"If IP contributed to OASIS TCs' chartered work came from contributors who had not agreed to OASIS IPR policy or who had not been authorized to contribute IP towards standardization in the specific area scoped by the specific TC Charter, it would undermine the legal safety of the standardization deliverables and could lead to inability to publish work products due to copyright or patent infringement claims, or worse implementers of published work could be sued by copyright or patent owners for infringing on their IP by implementing the standard.",47,48
1245,5940554,Potential travel industry users include: • Aviation flight crews can use the Phraselator for providing safety and emergency information to passengers in a large number of languages. •,16,17
1246,5940554,"The initial potential market is in excess of 30,000 users that include: • Police and fire departments • Fire departments • Customs inspectors and border patrols • Coast Guard inspections and safety Humanitarian Assistance This is a small, specialized market.",32,33
1247,237204596,"Additionally, they developed a culturally neutral global format and determined to meet local requirements for engineering, regulatory, safety and environmental conditions.",20,21
1248,237295790,"It is clear that people who need standards are the users -a consumer needs a standard for an electric kettle to be assured of its safety and performance; the kettle manufacturer needs a standard for connectors so that he can obtain components, again assured dimensionally and for performance, from a number of suppliers; the connector manufacturer needs a standard for the plastics .... etc etc.",25,26
1249,42162743,"From May, 1994, to June, 1995, work mainly concentrated on expanding the Russian and Russian-German lexicons with regard to general, common technical, and special vocabularies (subject areas: nuclear power and safety problems, law, railway transportation, banking and others).",40,41
1250,237055451,"Principle 5: Engage the Customer from the Beginning The Operations Directorate of NVTC is constantly performing translations whose timeliness and accuracy are critical for the United States defense, intelligence, and safety of the homeland.",33,34
1251,7877159,"Commitment translations, on the other hand, are required for contracts and other legally binding documents, medical reports, equipment operating instructions, product safety information, final versions of standards and specifications to name but a few types of documents.",26,27
1252,43622537,"While the long-term aim might be to emulate online text translation systems like Babel Fish which ""have a go"", with more or less success, at translating anything, the reality is that SLT systems, and in particular medical SLT systems, with their critically small safety margins regarding mistranslation, can only function within tightly constrained specific domains in which the range of utterances from both clinician and patient must be strictly limited.",52,53
1253,51811202,"For these forms of transfer there are strict safety regulations and legal aspects which make it imperative to deal with the problems that can arise at the interchange or ""crossover"" points between the departure and arrival platforms and the moving section in between.",8,9
1254,237256847,"IMO, the International Maritime Organization, is the specialised agency of the United Nations dealing only with maritime affairs and its main concern is to improve safety of life at sea and to protect the marine environment.",27,28
1255,18972667,In this paper we present an approach to EBMT that quantifies this concept of 'safety' and makes it a key criterion in case selection.,15,16
1256,236999890,"Every manufacturer who intends to export his products to markets where another language is spoken, and especially where it is a legal requirement that the user manual and safety instructions be in the local language of the user, needs Translation Memory. •",29,30
1257,26538892,"2013) at 5, as an extra safety measure against exploding gradients.",8,9
1258,51801236,"Parametric polymorphism is similar to the traditional object-oriented, sub-type polymorphism but does not require compatible types to be related via inheritance, which consequentially avoids the associated runtime overhead and type-safety issues.",37,38
1259,62527047,The seventh rule on conditional tenses is particularly important for clarity and safety.,12,13
1260,62629604,The length of each field normally has to be specified at the time of file creation and cannot be changed with safety thereafter.,22,23
1261,237155056,Advantages But METAL has other advantages: The system guarantees almost absolute terminological consistency over hundreds of pages in a subject area where drug safety and quality control require precise statements and information.,24,25
1262,237217097,Always attach the safety chains before towing the vehicle.,3,4
1263,110646805,"These two criteria (safety and efficiency) are, inevitably, in opposition to each other.",4,5
1264,110646805,"So it comes as a bit of a surprise to discover that, despite the railway's admirable safety record, this is far from the case and that, paradoxically, the majority of trains are still controlled by a technology which betrays its 19th century origins (semaphore signals) or its 20th century up-dates (light signals or track-circuit indicators).",18,19
1265,110646805,The reason for this is not a defect in the system but a safety requirement tied irrevocably to an order of actions which is completely fixed and imposed by the regulations: STOP-SPEAK-WRITE-REPEAT-DISPLAY-AUTHORISE.,13,14
1266,110646805,"A typical set of examples would be: AUDIO MESSAGES In keeping with the absolute and over-riding priority of safety, the automatic system has to be backed up with a spoken system not only in case of failure but also because of the limitations inherent in it as a communication system.",21,22
1267,11823859,"Traditionally, translation was considered a high quality text product for important documents on user safety or commercial information, for example, but currently there is an increased demand for gisting translation, users just need to understand the main idea of the text in their own language.",15,16
1268,41067176,"Offline working, i.e. production of subject or document based lists at a central sire for provision in printed form to translators, can give advantages when: -Documents are often worked on by several translators (all can be given specialised vocabularies to aid consistency), -The consequences of errors can be catastrophic (e.g. instruction manuals, safety rules) -with online production of printed word lists it is possible to check and eliminate any inconsistencies or ambiguities which might not be apparent when looking at single entries online.",60,61
1269,56549841,"On the other hand, electrical items where there is an element of safety involved usually come with a guarantee which not only assures the working life of the item but also states that it was manufactured to a specific standard.",13,14
1270,56549841,"Equally, one would expect some sort of formalised controls in place over quality or (at least) safety critical activities.",19,20
1271,236999911,"Reading the universities' current project literature, one is struck by the frequency with which the systems have recourse to safety nets to allow a failed translation to be automatically rerun under less strict grammatical parameters.",21,22
1272,237155058,"E.g.: safety instructions in the operation manual, maintenance manual, repair manual etc.",2,3
1273,196208241,"This can be seen by looking at one of the human-written reference summary of this topic: log f (t i , k i ) = α log(t i ) − β log(k i ) + A f (t i , k i ) = e A e [α log(t i )−β log(k i )] f (t i , k i ) = e A t α Reference summary for topic D0803 China sacrificed coal mine safety in its massive demand for energy.",84,85
1274,196208241,Officials are often illegally invested in mines and ignore safety procedures for production.,9,10
1275,196208241,South Africa recently provided China with information on mining safety and technology during a conference.,9,10
1276,196208241,China is beginning enforcement of safety regulations.,5,6
1277,182952931,"2013) at 0.5, as an extra safety measure against exploding gradients.",8,9
1278,52012184,"Detecting changes within an unfolding event in real time from news articles or social media enables to react promptly to serious issues in public safety, public health or natural disasters.",24,25
1279,52012184,"Most CPD algorithms are retrospective (Barry and Hartigan, 1993; James and Matteson, 2015) : the main drawback is that they can't be run before all the data has been acquired, which is a significant operational constraint when monitoring unfolding safety or health crises.",46,47
1280,247223086,This threshold should be chosen depending on the context (i.e. the degree of safety-criticalness).,14,15
1281,236459945,"One possible remedy for such potentially problematic situation is to employ fact checking system as a safety measure (Nadeem et al.,",16,17
1282,8843191,15) Also spurring the move to (:loth: diaper covers with wdcro fasteners that eliminate Om need for safety pins.,20,21
1283,249395508,"MC allows the consistent documentation of medical records, enabling the analysis of clinical trials, for example facilitating safety data retrieval or detection of adverse drug reactions.",19,20
1284,250390588,"However, the method could in theory be applied in any domain where confirmation that a long document has been read is important (e.g., legal agreements, safety manuals or human resources training documents).",29,30
1285,2854390,"In order to err on the side of safety, we disallow deleting the verb saw.",8,9
1286,479046,"They used machine learning to correlate features of an action X's relationship to the reader in terms of attention, awareness, and safety, with whether it was realized as Don't X, Never X, o r Take care not to X. In our research, we draw on their notion of identifying how features of the generation context correlate with how an utterance should be expressed.",24,25
1287,14685368,"pour*** *nonliteral cluster* wsj04:7878 N As manufacturers get bigger , they are likely to pour more money into the battle for shelf space , raising the ante for new players ./. wsj25:3283 N Salsa and rap music pour out of the windows ./. wsj06:300 U Investors hungering for safety and high yields are pouring record sums into single-premium , interest-earning annuities ./. *literal cluster* wsj59:3286 L Custom demands that cognac be poured from a freshly opened bottle ./. Each feedback set sentence is saved with a weight, with newly clustered sentences receiving a weight of 1.0.",53,54
1288,7606657,"Relevant documents are defined here as pairs of English and Japanese documents that report identical or closely related contents, e.g., a pair of documents describing an aircraft crash and the ensuing investigation to compensate the victims' families or any safety measures proposed as a result of the crash.",42,43
1289,9526475,"While we may miss relations if they are expressed in the query through obscure hints, allowing the relation to be ⊥ acts as a safety net.",25,26
1290,235592929,"However, the idea that speed bumps which slow down traffic would be sacrificed to help clean up the air we breathe is not a welcome concept according to road safety charity Brake. """,30,31
1291,226283429,"you've got to select for safety standards, of course, but when you're designing at a Mercedes level the folks buying those cars are going to expect a certain standard of comfort, too!",6,7
