,corpus_id,sentence,start_idx,end_idx
818,8058321,"We develop TAL applications for jobs requiring complicated knowledge and skills, complex or expensive equipment or work material, a high cost of on-the-job training or failure on the job, jobs where safety or spatial awareness is essential, and for large student throughput requirements [6, 12] .",38,39
819,15815899,"Particularly important for safety-critical applications, but of general use, would be low-level monitoring of channel noise and other environmental factors such as user gestures and gaze.",3,4
820,248780427,"If a customer violates the guidelines, moderators from the customer support of Mercari may give them a warning to protect the safety and trustworthiness of the market.",22,23
821,28821374,"In addition to maximising the cumulative reward J(θ), the optimisation is also subject to a Kullback-Leibler (KL) divergence limit between the updated policy θ and an average policy θ a to ensure safety.",38,39
822,3006421,"Consider, for example, pair 359 (dev set, RTE 2006) labeled as positive, for which the logic prover could not determine that 15 safety violations numerous safety violations.",28,29
823,3006421,"Consider, for example, pair 359 (dev set, RTE 2006) labeled as positive, for which the logic prover could not determine that 15 safety violations numerous safety violations.",31,32
824,236486266,Governmental agencies in-charge of industrial safety (OSHA; MINERVA) as well as the industrial enterprises themselves try and minimize the possibility of recurrence of industrial incidents.,7,8
825,236486266,Tanguy et al.(2016) use NLP techniques to analyze aviation safety re-ports.,10,11
826,236486266,2018) use neural network techniques to extract occupational health and safety related information from News articles related to industrial incidents.,11,12
827,236486266,"Specifically, they focus on extraction of target organization, safety issues, geographical location of the incident and penalty mentioned in the article.",10,11
828,235417195,"Chatbot safety has been studied from various aspects including sexism and racism (Lee et al.,",1,2
829,235417195,2020) conducted comprehensive exploration of safety protocols for chatbots.,6,7
830,235417195,"As we illustrate in our experiments, political prudence cannot always be captured from the existing safety tests, which mainly focus on offensiveness or toxicity.",17,18
831,235417195,ii) Offensiveness This is one of the most crucial aspects to be handled in the safety of chatbots.,16,17
832,235417195,2020) ; f) Blender-bot+Fact -our proposed naive yet safe and neutral chatbot which has a safety layer specialized for political discussion.,19,20
833,235417195,This chatbot is back-boned by Blenderbot with a safety layer that detects whether the context is political or not using a dialogue context classifier by Xu et al. (,10,11
834,235417195,"In contrast, we can observe that Blenderbot, without a safety layer, produces the most human-like responses (with winning rates of 61.7% and 58.3%), yet at the cost of being less prudent in political discussions.",11,12
835,235417195,"Also, the safety layer could be further improved considering 14.86% of the test context was not detected to be ""political.""",3,4
836,235417195,"Related Work The safety of chatbots has been studied with regard to their toxic or hostile behavior (Dinan et al.,",3,4
837,235417195,"One line of work addresses safety based on the fairness of chatbots regarding gen-der and race (Liu et al.,",5,6
838,235417195,"In comparison, the political aspect of chatbot safety has been given less attention.",8,9
839,235417195,"In response to safety issues, different mitigation methods have been researched, such as having a safety layer, data curation, and controlled generation (Xu et al.,",3,4
840,235417195,"In response to safety issues, different mitigation methods have been researched, such as having a safety layer, data curation, and controlled generation (Xu et al.,",17,18
841,248780400,We take the cleanliness and safety of our guests very seriously.,5,6
842,248780400,We take the safety and security of all of our guests very seriously and we will be following up with the appropriate departments to ensure this does not happen again.,3,4
843,250390719,"While morals, values and traits such as freedom, safety, harm, care, reciprocity, in-group loyalty, authority, equality are formed.",10,11
844,236170843,"In total, 14 domain categories were used in the study: Introduction category covers the beginning of the conversations, Guideline category covered conversations that refer to the physical activity guidelines for Americans, Benefit category covered conversations addressing the health benefits of physical activity, Goal category was related to setting short-term and long-term goals, Monitoring category pertained to conversations on self-monitoring and adherence, Motivation category was related to talking about staying motivated to being active, Barrier category was about identifying and overcoming barriers to being active, Relapse category pertained to talking about relapse and prevention, Safety category addressed safety of physical activity, Diet category addressed healthy diet, Weight category denoted weight loss and maintenance, and Off-Task category covered sustained conversations that do not fall into any of the above domain categories.",112,113
845,233864819,"Examples of compliance issues include detecting products that contain batteries and chemicals to comply with transportation and logistics regulations, as well as identifying products that require additional safety documentation and checks, such as products that may have unintended use by children (e.g. toys and products that may end up as toys should not have heavy metals or other poisons that cause illness or death when accidentally ingested).",28,29
846,12846234,We treated risk for falls by managing environment to provide safety.,10,11
847,46919376,We treated risk for falls by managing environment to provide safety.,10,11
848,16042670,"If guns cause death, that is only because of criminals, not because we carry them for our safety.",19,20
849,238260069,"1 tokens, , ← MATCHLOOP( , 0) 2 if < | | or ∉ { , ♯ } then 3 tokens ← [<unk>] Line 15 is only for safety reasons; it will not be visited since a whitespace is appended at the end.",35,36
850,6441832,Persing and Ng (2009) apply a multi-label text classification approach to document-level RC of aviation safety incident reports.,21,22
851,235368337,The interpretability of neural models will contribute to the trust and the safety.,12,13
852,245218726,"Thus, explaining LMs' behavior is crucial for promoting trust, ethics, and safety in NLP systems (Doshi-Velez and Kim, 2017; Lipton, 2018) .",15,16
853,959393,"Specifically, we created a system to mine information regarding the safety of people in the disaster-stricken area from Twitter, a massive yet highly unorganized information source.",11,12
854,959393,"As a result of our efforts, we were able to effectively deliver new information about the safety of over 100 people in the disasterstricken area to a central repository for safety information.",17,18
855,959393,"As a result of our efforts, we were able to effectively deliver new information about the safety of over 100 people in the disasterstricken area to a central repository for safety information.",31,32
856,959393,"As a result, Twitter or social network services (SNS) such as mixi 3 played an important role for propagating safety information among people.",22,23
857,959393,"In particular, we focused on mining and organizing information on Twitter regarding safety of individuals in the disaster-stricken area, as people are initially more concerned about the safety of their family or friends than anything else.",13,14
858,959393,"In particular, we focused on mining and organizing information on Twitter regarding safety of individuals in the disaster-stricken area, as people are initially more concerned about the safety of their family or friends than anything else.",31,32
859,959393,There were three major elements to this process: • Separating the tweets that contained safety information from the huge number of irrelevant tweets. •,15,16
860,959393,"The working group tackled these issues in safety information extraction from Twitter, preparing resources, building tools, and connecting the extracted information with Google Person Finder (GPF) 5 , a central location for safety information that was widely publicized through the Japanese news media.",7,8
861,959393,"The working group tackled these issues in safety information extraction from Twitter, preparing resources, building tools, and connecting the extracted information with Google Person Finder (GPF) 5 , a central location for safety information that was widely publicized through the Japanese news media.",37,38
862,959393,"At the same time, we also made efforts towards building a labeled corpus of tweets containing safety information, with the final goal of extracting information from unlabeled tweets.",17,18
863,959393,"Tweet Corpus Construction As Twitter contained a wide variety of earthquakerelated posts including information about the safety of people in the disaster-affected area, we decided to create a corpus of disaster-related tweets to aid our information extraction efforts.",16,17
864,959393,"We also collected tweets with the hash tags ""#anpi"" (safety information) such as ""#hinan"" (evacuation), ""#j j helpme"" (help request), and ""#save ""+ location names.",13,14
865,959393,A typical tweet containing safety information looked like the following 8 : 気仙沼市の田中太郎・花子さんと連絡 が取れません！どなたか消息をご存知 ありませんでしょうか？,4,5
866,959393,"Safety information is optionally added to every person tag, specifying the object of the safety information, as shown in the above example.",15,16
867,959393,Also multiple tags are permitted when multiple types of safety information are contained in a single tweet.,9,10
868,959393,"Safety Information Classifier Next, we describe the classifier that we built to find tweets containing safety information out of all the tweets in the corpus.",16,17
869,959393,"As NE features, co-occurrence information of PERSON and LOCATION in a single tweet was added as tweets for safety confirmation should generally include both of them.",21,22
870,959393,"We also used existence of the hash tag ""#anpi"" and the total number of appearance of hash tags except for ""#anpi"" as clues for dividing tweets not related to safety confirmation (label O, U, S) from the others.",35,36
871,959393,"The most frequent mis-prediction was occurred between U, S and O. This is not a big problem since all these three labels are unrelated to safety confirmation.",28,29
872,959393,We chose to verify and match the information by hand to prevent the provision of misinformation on a sensitive topic such as safety of earthquake victims.,22,23
873,959393,"Related Work Besides the safety information mining task which we described in the previous sections, we observed many other efforts to help the earthquake victims via NLP technologies as sub-projects of ANPI NLP.",4,5
874,959393,"2010) describe the annotation of a corpus about the Oklahoma wildfires, aiming at provision of broadscale information as opposed to safety information mining about individuals.",22,23
875,959393,"In the short term, this allowed us to provide information about the safety of over 100 people.",13,14
876,14492070,"The magnitude of the gun violence problem, the inherent gravity of the topic, and that fact that it inevitably leads to discussion of race, personal safety, and constitutional rights, makes the topic highly emotional and politically charged.",28,29
877,1697838,6 ) The government has issued a series of regulations and measures to improve the coun.try's coal mine safety situation. (,19,20
878,1697838,7)The mining safety technology and equipments have been sold to countries. (,2,3
879,1697838,"2)China will close down a number of ill-operated coal mines at the end of this month, said a work safety official here Monday. (",22,23
880,9300568,"Therefore, we have decided to use 1000 iterations for safety.",10,11
881,31399373,"Finally, on June 16 each of the negative opinion summaries represents one theme related to this topic, namely 'the decline of social housing', 'immigration and housing' and 'the votes on housing safety'.",39,40
882,2852730,"For example, during Hurricane Irene in 2011, updates from a user living in New York City about her own safety might be very informative to her friends and relatives, but not so informative to others.",21,22
883,18198045,"The Haskell language combines advantages of high-level programming and type safety with excellent performance of generated programs 5 , which makes it an ideal candidate for conceptually complex mathematical tasks.",12,13
884,202537222,"We also find that since ""strong safety"" is a kind of defensive back, the adjective ""strong"" is often associated with defensive backs, who are often nonwhite.",7,8
885,227230451,Annotators frequently annotated a Remove FD2 example (e.g. [they] actually care about the customers safety rather than taking their money) as Deprive FD2.,17,18
886,7277453,How many people are wearing safety jackets? (,5,6
887,250089342,"For the experiments reported here, we exclusively used the finetuned dialog model: both for safety reasons (LLM-D's finetuning includes a focus on reducing toxic text generation (Thoppilan et al.,",16,17
888,250089342,"Safety Large language models come with safety and toxicity issues (Bender et al.,",6,7
889,250089342,"The LLM-D model has been finetuned by its creators to help mitigate some of these safety concerns (Thoppilan et al.,",17,18
890,250089342,"LLM-D. We used a temperature of 1 and k = 40 for the top-k next token sampling, and we did not discard responses regardless of the ""safety"" score LLM-D assigned to them, as we found that this too severely curtailed the diversity of responses.",32,33
891,250089342,We mitigated the safety risks of this by ensuring that we had a robust human evaluation step in place later in the pipeline.,3,4
892,192327,"Effect of Topic Number South Korea, America, North Korea, work, safety, claim, military, exercise, united, report Shenzhou Nine will carry three astronauts, including the first Chinese female astronaut, and launch in a proper time during the middle of June.",14,15
893,15078449,"In this example, tweets (1) and (3) frame the issue of gun control as a matter of safety, while (2) frames it as an issue related to personal freedom, thus revealing the agreement and disagreement patterns between them.",22,23
894,215744908,2015) ) opt to enable it due to privacy and safety reasons.,11,12
895,386957,"For example, in political debating, the topic of nuclear energy can be framed as an economic development issue, a safety issue or an environmental issue.",22,23
896,386957,"To investigate this, we first randomly generated ten cars, each include eight aspects: safety, fuel economy, quality, style, price, luxury, performance and durability.",16,17
897,386957,"To control the influence of the value of a car aspect on a user's aspect selection decision (e.g., if the value of ""safety"" is ""poor"" and the value of ""fuel economy"" is ""good"", to promote the car, people almost always describe it as ""a car with good fuel economy"", not ""an unsafe car"", regardless of a receiver's personality).",26,27
898,386957,"b) the rank of ""safety"" is posi-tively correlated with ""conservation"", a trait associated with people who conform to tradition and pursue safety, harmony, and stability (p < 0.005).",6,7
899,386957,"b) the rank of ""safety"" is posi-tively correlated with ""conservation"", a trait associated with people who conform to tradition and pursue safety, harmony, and stability (p < 0.005).",29,30
900,386957,"This result suggests that for someone values ""conservation"", it is better to emphasize ""car safety"" in a personalized sales message. (",18,19
901,386957,"Other significant correlations uncovered in this analysis include a negative correlation between car ""price"" and ""conservation"" (p < 0.005), a negative correlation between car ""safety"" and ""conscientiousness"" (p < 0.05), and a positive correlation between ""openness to change"" and car ""performance"" (p < 0.05).",32,33
902,386957,"To encode the homogeneity constraint, for each car aspect (e.g. safety), we can simply add mustlinks between every pair of Turkers if they share the same aspect preference (e.g., both consider ""safety"" important) and add cannot-links for every pair of Turkers who do not share the same aspect preferences (e.g., one Turker considers ""safety"" ""Important"", the other considers it ""Not-Important"").",12,13
903,386957,"To encode the homogeneity constraint, for each car aspect (e.g. safety), we can simply add mustlinks between every pair of Turkers if they share the same aspect preference (e.g., both consider ""safety"" important) and add cannot-links for every pair of Turkers who do not share the same aspect preferences (e.g., one Turker considers ""safety"" ""Important"", the other considers it ""Not-Important"").",38,39
904,386957,"To encode the homogeneity constraint, for each car aspect (e.g. safety), we can simply add mustlinks between every pair of Turkers if they share the same aspect preference (e.g., both consider ""safety"" important) and add cannot-links for every pair of Turkers who do not share the same aspect preferences (e.g., one Turker considers ""safety"" ""Important"", the other considers it ""Not-Important"").",67,68
905,386957,"For example, based on the Safety-1 pattern, people who are more extraverted (extrave (+)) and more neurotic (neurotic (+)) tend to consider ""car safety"" important.",34,35
906,386957,"Similarly, based on pattern Safety-3, people who are more conscientious (conscie(+)) but less open (open(-)) tend to consider ""safety"" important.",27,28
907,2211211,"Users living under authoritarian governments have the incentive to conceal their identity for personal safety (Jardine, 2016) .",14,15
908,5636935,"For each article, annotators were asked to identify any of the 15 framing dimensions present in Economic: costs, benefits, or other financial implications Capacity and resources: availability of physical, human or financial resources, and capacity of current systems Morality: religious or ethical implications Fairness and equality: balance or distribution of rights, responsibilities, and resources Legality, constitutionality and jurisprudence: rights, freedoms, and authority of individuals, corporations, and government Policy prescription and evaluation: discussion of specific policies aimed at addressing problems Crime and punishment: effectiveness and implications of laws and their enforcement Security and defense: threats to welfare of the individual, community, or nation Health and safety: health care, sanitation, public safety Quality of life: threats and opportunities for the individual's wealth, happiness, and well-being Cultural identity: traditions, customs, or values of a social group in relation to a policy issue Public opinion: attitudes and opinions of the general public, including polling and demographics Political: considerations related to politics and politicians, including lobbying, elections, and attempts to sway voters External regulation and reputation: international reputation or foreign policy of the U.S. Other: any coherent group of frames not covered by the above categories the article and to label spans of text which cued them.",126,127
909,5636935,"For each article, annotators were asked to identify any of the 15 framing dimensions present in Economic: costs, benefits, or other financial implications Capacity and resources: availability of physical, human or financial resources, and capacity of current systems Morality: religious or ethical implications Fairness and equality: balance or distribution of rights, responsibilities, and resources Legality, constitutionality and jurisprudence: rights, freedoms, and authority of individuals, corporations, and government Policy prescription and evaluation: discussion of specific policies aimed at addressing problems Crime and punishment: effectiveness and implications of laws and their enforcement Security and defense: threats to welfare of the individual, community, or nation Health and safety: health care, sanitation, public safety Quality of life: threats and opportunities for the individual's wealth, happiness, and well-being Cultural identity: traditions, customs, or values of a social group in relation to a policy issue Public opinion: attitudes and opinions of the general public, including polling and demographics Political: considerations related to politics and politicians, including lobbying, elections, and attempts to sway voters External regulation and reputation: international reputation or foreign policy of the U.S. Other: any coherent group of frames not covered by the above categories the article and to label spans of text which cued them.",134,135
910,243865299,"However, due to excessive abstractiveness, current models usually face an unfaithful generation problem, which may affect human judgment and impair the safety of models in practical applications, thus severely restricts the development of technology.",24,25
911,220831090,Introduction Online offensive language is a critical problem that is threatening the safety and well-being of society.,12,13
912,233210527,"Reporters also deliver that ""Americans feel need for some more adventure in their lives (24%), followed by affection (21%), money (21%), safety (20%), new (19%), sex (19%), respect 18%, confidence 17%, pleasure 17%, connection 17%, knowledge 14%, protection 14%, importance 14%, learning 12%, freedom 11%, autocunoastere 10% and control 7%.""",34,35
913,53606526,The data was collected by the Visr child safety app from September 2014 to March 2016.,8,9
914,220446147,"Electronic consult (eConsult) systems allow specialists more flexibility to respond to referrals more efficiently, thereby increasing access in under-resourced healthcare settings like safety net systems.",27,28
915,208268267,Extracting DDI provides important clues for research in drug safety and human health care.,9,10
916,4382470,"reference Annan urged sharon to ensure israeli forces will ""adopt military tactic and weapons that cause a minimum possible threat to safety of palestinian people and personal properties. """,22,23
917,4382470,"human Annan called on Sharon to ensure that Israeli security forces "" use weapons and fighting methods that will cause minimum threat to the safety and property of the Palestinian civilians. """,24,25
918,4382470,"QuickEdit Annan calls on Sharon to "" use weapons and combat practices that will pose a minimum threat to the safety and property of Palestinian civilians. """,20,21
919,235415270,"Dataset Provider The dataset is provided by Yidu Cloud Technology Inc. E.4 Clinical Trial Criterion Dataset (CHIP-CTC) Task Background Clinical trials refer to scientific research conducted by human volunteers to determine the efficacy, safety, and side effects of a drug or a treatment method.",38,39
920,235352944,"First, it can improve patient safety by fostering more comprehensive and complete care by PCPs.",6,7
921,235352944,"Finally, the question of whether such an ap-proach to follow-up workflow augmentation is successful in increasing patient safety, clinician efficiency, or EHR usability is an empirical one.",22,23
922,51873595,original We want to reassure you that we take fire safety very seriously and we are doing everything we can to make sure our residents are safe.,10,11
923,51873595,s2s We want to reassure you that we take fire safety very seriously and we are doing everything we can to make sure our residents are safe.,10,11
924,51873595,<10> We want to reassure you that we take fire safety very seriously and we are doing everything we can to make sure our residents are safe.,12,13
925,51873595,<9> We want to reassure you that we take fire safety very seriously and we are doing everything we can to make sure our residents are safe.,12,13
926,51873595,<8> We want to reassure you that we take fire safety very seriously and we are doing everything we can to make sure our residents are safe.,12,13
927,51873595,<7> We want to reassure you that we take fire safety very seriously and we are doing everything we can to make sure our residents are safe.,12,13
928,51873595,<6> We want to reassure you that we take fire safety very seriously.,12,13
929,51873595,<5> We want to reassure you that we take fire safety very seriously.,12,13
930,51873595,<4> We want to make sure we take fire safety very seriously.,11,12
931,51873595,<3> We want to make sure people take fire safety very seriously.,10,11
932,51873595,<2> We want to make sure people take fire safety very seriously.,11,12
933,227231054,Health and safety matters or working conditions. (,2,3
934,53588093,"On the other hand, people who are vaccinated may also have concerns regarding the safety or efficacy of vaccines.",15,16
935,204976362,China continues to face widespread food safety problems.,6,7
936,237433629,"3) Model robustness, which is critical for production, is often missing from evaluation, leaving a possible safety risk.",20,21
