,corpus_id,sentence,start_idx,end_idx
354,227230259,"As an effective approach to model weight variance and generate predictions, Bayesian neural networks and their variants have been applied in computer vision for image classification (Kendall and Gal, 2017) and autonomous vehicles to better model safety (McAllister et al.,",40,41
355,195345563,"Arguments on controversial topics usually address a limited set of aspects, for example, many arguments on ""nuclear energy"" address safety concerns.",23,24
356,8954993,"Potential applications can increase the accessibility of text, which has great value in education, public health, and safety, and can aid natural language processing tasks such as machine translation and text generation.",20,21
357,5826108,The importance of these standards in safety-critical enterprises cannot be understated.,6,7
358,218486796,"However, these models can be opaque and difficult to interpret, posing barriers to widespread adoption and deployment in safety-critical or userfacing settings (Belinkov and Glass, 2019) .",20,21
359,13935427,"Besides, we are concerned only with crimes which affect safety of a person traveling through that region.",10,11
360,13935427,do not affect the safety of a person traveling through a region and should not be classified as commuter affecting crimes by the model.,4,5
361,13935427,"Identifying Safest Path Once the safety map showing the crime intensities is known, we can convert the safest path problem to a shortest path problem by modeling the edge weights as the sum of crime frequencies of the two connecting nodes.",5,6
362,16873097,"Based on dependency output as produced by mate (Bohnet, 2010) , we can extract the following categories: • Verb object pairs: Holz bohren (to drill wood), einen Kreis bohren (to drill a circle), ... • Subject verb pairs: Holz verzieht sich (wood warps), eine Absaugeeinrichtung spart Zeit (a suction device saves time) • Verb-dependent and adjunct PPs: auf Gehrung sägen (to miter), für Stabilität sorgen (to ensure stability), mit der Stichsäge ausschneiden (to cut with a jigsaw) • Negation: die Sicherheitskappe nicht abziehen (do not remove the safety cap) • Adverbs: heiß verleimen (to hot glue), trocken reiben (to rub dry), dünn beschichten (to coat thinly) • Predicative constructions: X is Y (Y can be adjectival or nominal): Bohrer ist ein Elektrowerkzeug (drill is a power tool) Spitze ist besonders dünn (tip is very thin) We can also combine these extractors to search for longer patterns, including negation or adverbs.",117,118
363,21732305,"Moreover, with respect to patient safety, appropriate strategies need to be defined in order to maintain full control of the medical devices even if IDACO is allowed to perform some pre-defined actions during the surgery and control devices automatically.",6,7
364,21732305,"This allows the surgeon to maintain full control of the medical devices, thus ensuring the patient safety.",17,18
365,232021663,"Toujours pour le même topic, notre système a extrait le passage suivant en autorisant des insertions et l'inversion de l'ordre de mots : ... purchasing , personnel , risk management , environmental health and safety ... Cette approche, qui ne considère donc que la position relative des mots sans utilisation de pondération, s'est révélée efficace lors de précédentes participations à INEX (SanJuan & Ibekwe-SanJuan, 2010).",35,36
366,218973946,"While the suggestion to take a break because of car-detected tiredness of the driver was still perceived as a somewhat positive feature (probably because of safety reasons as shown in (Schmidt et al.,",28,29
367,218973946,"As drivers are already cognitively occupied with the primary task of driving, proactively triggered interaction by the voice assistant has to remain unobtrusive to regard road safety.",27,28
368,21687154,"In this particular case the user (planning officer) is not so interested in the quantity of opinions, rather whether so-called Material Planning Considerations 8 have been raised: matters that will influence the decision of the application such as parking, traffic, conservation, safety, etc.",50,51
369,566029,"Similarly, requirements, in particular those related to safety, often exhibit complex structures (e.g., public regulations, to cite the worse case): several embedded conditions, negation, pronouns, etc.,",9,10
370,566029,"Indeed, procedures as well as safety requirements are dedicated to action: little space should be left to personal interpretations.",6,7
371,566029,"Uniformity of style over a set of instructions, over titles and various lists of equipments, uniformity of expression of safety warnings and advice. •",21,22
372,566029,"Correct position in the document of specific fields: safety precautions, prerequisites, etc. •",9,10
373,14524085,Important events related to the setup of security and ethic commissions to examine the safety of nuclear reactors can be spotted from Figure 4 .,14,15
374,243865348,"Correct choice: B Model's choice: B Model's choice after : A perturbation A: the to follow directions B: the ability to write a valid report C: the ability to follow the safety guidelines D: the ability to come up with a conclusion a drop over 35% in performance is observed in ARCT, ARC and PIQA, the same tasks that were flagged in the previous experiment with partial inputs.",38,39
375,248391811,Metamorphic testing has recently been used to check the safety of neural NLP models.,9,10
376,248391811,We believe that doing so could improve the safety and consistency of a model's predictions.,8,9
377,14503646,"with length equal to 9 and maxseq(w 1 , w 2 ) = 9 max{16,11} = 0.5625 costAlign(w i , w j ) = − edist(w i , w j ) ε + maxseq(wi, wj) (4) where ε is a small value 10 that acts like a ""safety hook"" against divisions by zero, when maxseq(w i , w j ) = 0.",53,54
378,8349531,"The experiments on ""food safety"" issue show that the proposed WDM method outperforms the wordlevel baseline method in predicting stock movement, especially during fluctuating period.",5,6
379,8349531,"As an example, food safety issue has become a prominent social problem and caused much concern in recent years in China.",5,6
380,8349531,"Figure 1 is an example tweet talking about food safety from Sina Weibo, in which the author expresses his dissatisfaction to the situation of food safety in China.",9,10
381,8349531,"Figure 1 is an example tweet talking about food safety from Sina Weibo, in which the author expresses his dissatisfaction to the situation of food safety in China.",26,27
382,8349531,"In this study, we conduct an experiment on the topic of ""food safety"" using tweets from Sina Weibo and Shenzhen Stock Exchange (SZSE) Food & Beverage Index.",14,15
383,8349531,"Considering the sentiment distribution of our experiment topic is skewed at the message level (very few positive tweets on food safety problem), we use Eq.3 as our basic daily mood indicator instead.",21,22
384,8349531,"6 Experiment on Sentiment Classification Text Data Given that Sina Weibo API does not provide search interface freely as Twitter does, we scrape tweets discussing food safety with the keyword -""食品 安全"" (food safety in Chinese) from its search service platform 4 .",27,28
385,8349531,"6 Experiment on Sentiment Classification Text Data Given that Sina Weibo API does not provide search interface freely as Twitter does, we scrape tweets discussing food safety with the keyword -""食品 安全"" (food safety in Chinese) from its search service platform 4 .",36,37
386,8349531,1 st 2012-Dec.31 st 2012) when food safety problem was the most concerned problem for Chinese people.,10,11
387,8349531,"The majority of subjective class in Corpus is negative, because public mood for food safety in China is irritated at the collecting period.",15,16
388,8349531,"Although we presented an experiment on the topic of ""food safety"", the described technique can be extended to any other social topics.",11,12
389,8064931,"For example, if the query is ""Is safety of LASIK operation high?,""",9,10
390,8064931,"and if ""risk"" and ""low"" are input into the dictionary as antonyms of ""safety"" and ""high,"" respectively, then the two generated inverse queries are ""Is risk of LASIK operation high?""",18,19
391,8064931,"and ""Is safety of LASIK operation low?""",3,4
392,8064931,"In the above example, ""safety"" and ""high"" are positive keywords, whereas ""risk"" and ""low"" are negative ones.",6,7
393,8064931,"For example, if ""Is safety of LASIK operation high?""",6,7
394,8064931,"is the submitted query, then the expanded query is ""Is safety of LASIK operation not high?""",12,13
395,8064931,"Because words such as ""LASIK"" in the query ""Is safety of LASIK operation high?""",12,13
396,8064931,"Table 1 shows an example of the extracted keywords when the given query is ""Is safety of LASIK operation high?""",16,17
397,8064931,"Is safety of LASIK operation high?,"" """,1,2
398,199379810,"ADR classification helps to identify negative effects of drugs, which can guide health professionals and pharmaceutical companies in making medications safer and advocating patients' safety.",26,27
399,212886318,Risk management is a vital activity to ensure employee safety in construction projects.,9,10
400,212886318,"While developing NER methods generally relies on annotated corpora, we are not aware of any such corpus targeted at concepts relevant to construction safety.",24,25
401,212886318,Four health and safety experts used the guidelines to annotate a total of 600 sentences from accident reports; an average inter-annotator agreement rate of 0.79 F-Score shows that our work constitutes an important first step towards developing tools for detailed semantic analysis of construction safety documents.,3,4
402,212886318,Four health and safety experts used the guidelines to annotate a total of 600 sentences from accident reports; an average inter-annotator agreement rate of 0.79 F-Score shows that our work constitutes an important first step towards developing tools for detailed semantic analysis of construction safety documents.,49,50
403,212886318,Introduction The health and safety of workers is of paramount importance in any construction project.,4,5
404,212886318,"As such, risk management is a vital activity, whose aims are to identify the potential risks to workers at each stage of the project and to determine appropriate safety measures that can mitigate these risks as effectively as possible.",30,31
405,212886318,"Reports on construction-related injuries and illnesses, site inspections and prosecutions, along with health and safety guidelines, can collectively provide details about which accidents have occurred during previous projects, together with possible reasons (e.g., failure to put adequate protection measures in place) and recommendations of how incidents can be minimised or avoided in future.",18,19
406,212886318,"In our case, these would include types of accidents, features of building sites, equipment or tools and safety measures, etc.",20,21
407,212886318,"In construction safety, examples may include linking accidents to relevant contextual factors (e.g., equipment being used when they occurred) or linking specific safety measures to the hazards that they aim to alleviate.",2,3
408,212886318,"In construction safety, examples may include linking accidents to relevant contextual factors (e.g., equipment being used when they occurred) or linking specific safety measures to the hazards that they aim to alleviate.",26,27
409,212886318,"Within the construction safety domain, NER is a largely unexplored problem, mainly due to the lack of suitably annotated corpora, which are required for the development and evaluation of supervised machine learning NER methods.",3,4
410,212886318,"In response, we have defined a novel NE annotation scheme for application to construction safety documents, accompanied by detailed guidelines to ensure consistent labelling by annotators.",15,16
411,212886318,The design of the scheme (a joint effort between experts in health and safety and corpus development) was guided by reference both to existing models of construction safety knowledge and to a range of relevant document types.,14,15
412,212886318,The design of the scheme (a joint effort between experts in health and safety and corpus development) was guided by reference both to existing models of construction safety knowledge and to a range of relevant document types.,29,30
413,212886318,"We subsequently trained four health and safety experts in the application of the scheme, and asked them to label a total of 600 sentences from accident reports.",6,7
414,212886318,"Our Approach Compared to previous work, our annotation scheme targets the development of supervised learning methods that can recognise mentions of a wider range of concepts relevant to construction safety, and can categorise them in a finergrained manner.",30,31
415,212886318,"They define fundamental concept types, and specify how these concepts are linked via various types of relations to encode different types Potential uses of this structured information in the construction domain include integrating safety information within Building Information Modelling (BIM) software (a widely used approach to design and construction, using a digital representation of the building process to facilitate the exchange and interoperability of information), coding of occupational injury and illness incidents (U.S. Department of Labor Bureau of Labor Statistics, 1997), or the (semi) automatic creation of risk registers (Figure 3 shows a risk register format recommended by the British Standards Institution (BSI, 2018)).",34,35
416,212886318,"These require specific safety measures, which are further split into Training, Inspection, Safe Guards and Personal Protective Equipment.",3,4
417,212886318,"In the BSI's recent PAS 1192-6 recommendations (BSI, 2018) about structuring health and safety knowledge in BIM (see Figure 2 ), activities are also seen as sources of hazards, as are specific products (parts of structures, prefabrications, materials and substances) and locations of work.",19,20
418,212886318,"A more detailed analysis of such consequences is suggested in the Occupational Injury and Illness Classification Manual (U.S. Department of Labor Bureau of Labor Statistics, 1997) , where consequences are broken down according to the Nature of Injury or Illness (e.g., fractures) Experimental Annotation Phase With the above in mind, we gathered a small corpus of document extracts from the construction sector repository of the Health and Safety Executive (HSE), which includes incident reports, enforcement activity documents and safety guidance.",89,90
419,212886318,"An iterative process of experimental labelling, discussion and refinement between two of the authors (one with health and safety experience and the other with annotated corpus development experience) aimed to explore whether and how the types of concepts outlined above manifest themselves in a range of relevant document types.",20,21
420,212886318,A general Protection Measure category was selected to label all safety and protection measures.,10,11
421,212886318,Annotation Using the Scheme Four annotators with a health and safety background were trained in the application of the scheme using the guidelines.,10,11
422,212886318,"However, our preliminary analysis of other types of documents, i.e., enforcement activity documents and safety guidance, strongly suggests that this category will be useful when the scheme more widely applied.",17,18
423,212886318,"For example, while some of the Physical Environment annotations are also covered by construction site attributes from Desvignes (2014) Conclusion and Future Work Motivated by the current scarcity of semantically annotated corpora for the construction safety domain, we have described the design of a novel NE annotation scheme that is specifically aimed at identifying mentions of concepts that are highly pertinent to identifying hazards, their contextual factors, their consequences and possible means to mitigate them.",38,39
424,212886318,"Corpora annotated according to the scheme are intended to facilitate the development of tools to support a range of practical tasks, such as semi-automatic generation of risk registers and integration of structured health and safety information into BIM software.",37,38
425,212886318,"Secondly, we will create a knowledge graph by extracting and structuring knowledge contained in construction safety documents.",16,17
426,13015753,"A bilingual pair would be judged to be correct when it can be registered in the MT dictionary without any modification of Japanese words: for example, the bilingual pair of ""Comprehensive Security Board"" and 総合安全保障審議会 sogo anzen hosho shingikai ""comprehensive safety security council"" is judged to be correct.",45,46
427,227231533,"We analyse the output for both success in obfuscation and language acceptability, as well as comparing the performance with some common baselines, showing promising results in finding a balance between safety and soundness of the perturbed texts.",32,33
428,227231533,"Work on author obfuscation generally fits with this, although in disparate ways; the PAN tasks, 6 for example, consider safety (broadly misclassification), soundness (textual entailment between original and adversarial texts) and sensibleness (inconspicuousness, or looking like regular text); the latter two are related to the typical utility criteria.",23,24
429,249204478,"Introduction Despite the progress in the fluency of machine translation (MT) systems, critical translation errors are still frequent, including deviations in meaning through toxic or offensive content, hallucinations, mistranslation of entities with health, safety, or financial implications, or deviation in sentiment polarity or negation.",40,41
430,18738421,"Introduction Extracting and linking temporal and medical information from medical documents is a highly useful task for many clinical applications and plays an important role in health care assessment and patient safety (Sun et al.,",31,32
431,237010894,"Another benefit of this approach is a consistent file system structure, allowing to use relative and absolute paths with safety.",20,21
432,5615076,"A good design must comply with the five principles of Ergonomics; safety, comfort, ease of use, productivity/performance and aesthetics (Karwowski, 2006) .",12,13
433,12841690,"Thus Anusaaraka provides a ""Robust Fall Back Mechanism"" which ensures a safety net by providing a ""padasutra layer 6 "", which is a word to word translation represented in special formulatic form, representing various senses of the source language word.",13,14
434,250391023,"Concerning information type classification, Table 5 7 shows that the SA-aware model in the [OE] setting is able to predict MATERIAL DAMAGES, NOT USEFUL as well as OTHER non urgent messages (related to animals, messages that aim to provide additional information via external links via URLs, photos or videos, and prevention messages that provide general-purpose safety instructions upstream of crisis).",67,68
435,90261373,"The model performs well for basic needs like food, safety, health, romance, etc.",10,11
436,203657592,"According to the hierarchy exposed in the article, human needs are as follows: physiological needs (food, water, shelter, sleep), safety (health, financial, well-being), social needs (family, intimacy, friendships), self-esteem, self-actualization (parenting), transcendence.",27,28
437,203657592,"The six categories of needs described in the input page directly follow as hyponyms: physiological, safety, social, self-esteem, self-actualization, transcendence.",17,18
438,235352659,Gold: Some PeopleA (who should not be there) start daring a SomeoneC to climb a SomethingC (without safety gear) >Causes/Enables> SomeoneC (who should not be there makes it to the top then falls down and SomeoneC (who is acting like monkey)).,21,22
439,17123801,"The latter is a part of an open list of well-formed PPs, as in dlja puschej vazhnosti, ('for greater importance'), soxrannosti (safety), ostrastki (frightening), but the word puschij in itself occurs only in this construction.",31,32
440,15291488,"2016) propose an array of machine learningbased strategies for ensuring safety in general AI systems, mostly focussing on autonomous system interacting with a real world environment.",11,12
441,250391065,Physiological and safety needs are considered basic needs that need to be satisfied first before one begins to explore the advanced needs related to esteem and self-actualization.,2,3
442,250391065,"Clearly, the meaning of safety has evolved and included topics such as housing, infection, unemployment, domestic violence, market and financial liabilities.",5,6
443,250391065,There is also a huge surge in self-actualization and safety needs starting week-24'2021.,11,12
444,250391065,Indian Twitter users voiced the safety need most often followed by physiological need during the lockdown.,5,6
445,250391065,"During the second phase of the pandemic, safety turned out to be the foremost concern and physiological needs peaked only after a delay of two weeks.",8,9
446,250391065,"The huge surge in self-actualization and safety needs starting week-24'2021 is due to large volume of tweets discussing Indian Premier League 2021 (Wikipedia contributors, 2022) and mass gatherings.",8,9
447,250391065,77.36% of physiological needs and 77.5% of safety needs expressed frustration.,9,10
448,16262293,Due to our safety measure of backing off to the original translation of the sentence in case the translation of the pivot is not found in the translation of the pivot skeleton (cf.,3,4
449,26873648,"Thus, if w(Vi, k) is above a certain threshold, for instance, if dispositivo and device are strongly associated, then, from all the candidates available for safety device the algorithm will select dispositivo de seguridad because it contains a member of an associated pair.",32,33
450,13479224,"It is reasonable to assume that such a governance system would require specific modifications for the AAC community to make policies more understandable, to allow for adaptations in privacy and internet safety education and to enable the role of family in decision support.",32,33
451,218977413,"They contain records that offer a holistic overview of a patient's medical history, rendering them a valuable tool source for drug safety surveillance.",23,24
452,226283449,"Doshi-Velez and Kim, 2017) • Ensuring safety to use AI models: Although prediction and recommendation systems might not seem dangerous, in certain sensitive scenarios the results can be catastrophic.",10,11
453,226283449,"In order to ensure safety while using these systems we need to understand the system's actions or predictions, measure the risk factors and take appropriate steps. (",4,5
454,218973945,Their task is to optimize the flight plan while ensuring the safety of all aircraft.,11,12
455,6083114,"These may have a metalinguistic force (insistence, customer safety, etc) that we will not examine in this paper.",10,11
456,1296374,i) is a category assertion (safety as a type of concern) and (ii) is an equivalence assertion (organization is an institution).,7,8
457,1296374,"Thus, example (i) would result in a link from safety to concern with weight 1.",12,13
458,11821532,Deference Power (1266): words indicating the influence to affect the policies of others Welfare Well-being (486): words describing the health and safety of organism: Table 2 : General Inquirer categories used in our study stituencies); personal attributes including gender and official status.,27,28
459,1118360,"For common entities, it applies to synonymy (e.g., ""security"" and ""safety"").",16,17
460,21698865,"In a survey commissioned by Amnesty International of women in eight countries (Denmark, Italy, New Zealand, Poland, Spain, Sweden, the United Kingdom, and the United States), 23% reported that they had been harassed or abused online, and of these, 41% felt that their physical safety was threatened (Magill, 2017) .",58,59
461,44425337,12) a. Increasing marine safety requires ongoing work.,5,6
462,248780360,We have also identified a hesitancy from lawyers who fear that de-identification can harm the safety of the data.,17,18
463,248780360,Related Research This related research section presents studies regarding the quality of the de-identification system both in terms of safety and privacy but also for down-stream tasks as for medical research.,21,22
464,1286350,"Document will report actual studies, or even unsubstantiated concerns about the safety to manufacturing employees and installation workers of fine-diameter fibers used in insulation and other products.",12,13
465,14945992,2002) obtained almost unanimous feedback from forum users that professionals should actively participate or offer a safety net of passive monitoring.,17,18
466,14945992,"In extreme cases they will occasionally redact content that is overly distressing or triggering, or where the author has jeopardized their own safety and anonymity.",23,24
467,18619809,"The latter, however, diverges from other dimensions in that any university webpage tends to contain some degree of informational content, which may lead this dimension to be considered as a 'safety margin' and, eventually, to be overrepresented in human annotation.",34,35
468,16930771,"Furthermore, the intensional reasoning required in any application involving natural language processing presents DL-safety restrictions, due to conclusions referring to unnamed objects.",16,17
