,corpus_id,sentence,start_idx,end_idx
0,219686914,"Neural models can be opaque and difficult to interpret, posing barriers to their deployment in safety-critical applications such as mental health or customer service (Belinkov and Glass, 2019) .",16,17
1,1102087,"3) bastard, by-blow, love child, illegitimate child, illegitimate, whoreson-the illegitimate offspring of unmarried parents (B) (4) atrophy-undergo atrophy; ""Muscles that are not used will atrophy"" (O:N) (5) guard, safety, safety device-a device designed to prevent injury (O:P) (6) nasty, awful-offensive or even (of persons) malicious;""in a nasty mood"";""a nasty accident""; ""a nasty shock"" (S:N) (7) happy-enjoying or showing or marked by joy or pleasure or good fortune; ""a happy smile"";""spent many happy days on the beach""; ""a happy marriage"" (S:P) (8) uncompromising, inflexible-not making concessions; ""took an uncompromising stance in the peace talks"" (S:V) As far as we are aware, this is the first annotation scheme for both subjectivity and polarity of word senses.",54,55
2,1102087,"3) bastard, by-blow, love child, illegitimate child, illegitimate, whoreson-the illegitimate offspring of unmarried parents (B) (4) atrophy-undergo atrophy; ""Muscles that are not used will atrophy"" (O:N) (5) guard, safety, safety device-a device designed to prevent injury (O:P) (6) nasty, awful-offensive or even (of persons) malicious;""in a nasty mood"";""a nasty accident""; ""a nasty shock"" (S:N) (7) happy-enjoying or showing or marked by joy or pleasure or good fortune; ""a happy smile"";""spent many happy days on the beach""; ""a happy marriage"" (S:P) (8) uncompromising, inflexible-not making concessions; ""took an uncompromising stance in the peace talks"" (S:V) As far as we are aware, this is the first annotation scheme for both subjectivity and polarity of word senses.",56,57
3,6332773,"Within the water pump and safety cutoff valve, the water pump sound indicator is normal.",5,6
4,13033483,"Social Event Radar is a new social networking-based service platform, that aim to alert as well as monitor any merchandise flaws, food-safety related issues, unexpected eruption of diseases or campaign issues towards to the Government, enterprises of any kind or election parties, through keyword expansion detection module, using bilingual sentiment opinion analysis tool kit to conclude the specific event social dashboard and deliver the outcome helping authorities to plan ""risk control"" strategy.",27,28
5,13033483,Food-safety Related Issues S.E.R. research and development team built up the DEPH [di(2-ethylhexyl)phthalate] searching website within 2 days and made an officially announcement in June.,2,3
6,207925157,"2013) , diseasedrug relations, as well as drug safety-related issues.",10,11
7,6033199,"Through the demonstration of the IlluMe system, we hope to show another way to apply language technology in life and retrieve the positive and relaxing atmosphere to rebuild our sense of trust and safety toward space, and finally recollect the long-lost attachment toward it.",34,35
8,16632593,"Due to the safety-critical nature of our domain, our main goal is to achieve precision, which explains why we chose a linguistic recognition and translation based on unification grammars and specialization techniques, provided by the Regulus toolkit (Rayner et al.,",3,4
9,207913145,"Such knowledge has been produced by biology and bioinformatics projects in the microbiology domain, including food safety, health sciences and waste processing.",17,18
10,248780022,We now summarize prior work around safety and unwanted biases.,6,7
11,3264891,"Our evaluation measures also include spam recall (SR) and spam precision (SP): L S S S S S N N N SR → → → + = S L S S S S N N N SP → → → + = SR measures the percentage of spam messages that the filter blocks (intuitively, its effectiveness), while SP measures how many blocked messages are indeed spam (its safety).",76,77
12,15424937,"Another answer was: 'Astaxanthin is an approved colour additive in the feed of salmonids' (SD-11) The first definition was found in a biochemistry paper on the digestability and accumulation of astaxanthin, whereas the second one was extracted from a fishery research paper which discusses potential issues for human health and safety from net-pen salmon farming.",56,57
13,15424937,"The readers of the second paper may be experts on fish biology but not necessarily on chemicals, food safety or even salmon farming, whereas the first paper is more limited to a single discipline.",19,20
14,5552464,ref #357 this concession to the unions ignores the reality that all airlines have different safety procedures which even differ between aircrafts within each airline .,16,17
15,5552464,bas this concession unions ignores the fact that all airlines have different safety procedures which are even within each of the companies in accordance with the types of equipment .,12,13
16,5552464,+aux this concession to the trade unions ignores the reality according to which all the airlines have different safety procedures which differ even within each of the companies in accordance with the types of equipment .,19,20
17,645466,A related translation is a translation which is only semantically related to the source term: insecure → ohne Sicherheit 'without safety'.,22,23
18,231637581,"Polysemic ""words"" Monosemic ""words"" ases (0) obtain ( 10 ) impairment (1) virtually ( 10 ) convenience (1) represent ( 10 ) oring ( 1 ) safety ( 10 ) ums (1) defence ( 10 ) turnover ( 1 ) coordinated ( 10 ) occurrence (1) handling ( 10 ) tent (2) July ( 10 ) ture (2) previous (10) mation (2) better (10) Table 7 : Analyzing the variation of embeddings across domains.",36,37
19,13577644,Information and Communication Technologies (ICT) appears to be a good opportunity to make use of this information to offer monitoring and alert services which contribute in the end to patient safety.,32,33
20,13577644,Not all HAI have the same effect but they all jeopardize patient safety and increase the time spent in hospitals.,12,13
21,13577644,This is a great opportunity to prove that an NLP based monitoring system can be used inside a hospital information workflow to improve patient safety.,24,25
22,6644543,Lexical Transfer MT Engine PANGLOSS uses a simple and traditional lexical transfer MT engine as a safety net.,16,17
23,237418675,"Several possible avenues for potential HLT products were identified: • Social domain language-related products • Commercial targeting of potential customers (advertising) • Automating the creation of call center systems • Information integration (e.g., customer relationship management, internal and external business intelligence, and brand marketing) 2 • Construction industry language problems for foreign workers (5% of revenue is spent correcting mistakes, and there are also safety problems) • Vertical high-accuracy translation markets, such as legal system translation • Hospitals' need to provide medical help in a variety of languages • Assignment of insurance categories to medical reports • Law enforcement applications • Service to government goals or the government organization itself • Reducing language barriers in information access (e.g., cross-lingual search engines) • Question answering in any language • Translingual information mining and access across media • Communicating with the speech impaired (text-tospeech), the manually impaired (speech-to-text), the visually impaired (speech again), or linguistic minorities (machine translation) One thought was to look at 18-year olds to find where the markets will be in near future (e.g., instant messaging has moved into business, video gaming).",77,78
24,6155481,"Also, the postprocessing step acts as a safety net that filters out well-formedness errors (e.g. argument sharing violations), thus making sure that the submission to the evaluation system is not rejected by the system.",8,9
25,219309702,"The topic type MIX is reserved for utterances which contain information not directly related to the domain (safety of the downtown area, business taking longer than expected, a friend coming for a visit etc.),",18,19
26,14970525,"The topic type MIX is reserved for utterances which contain information not directly related to the domain (safety of the downtown area, business taking longer than expected, a friend coming for a visit etc.),",18,19
27,14971938,"Introduction The activity of Pharmacovigilance (science devoted to the detection and prevention of any possible drug-related problem, including adverse drug effects) has gained significant importance in the recent decades, due to the growing number of drug safety incidents (Bond and Raehl, 2006) as well as to their high associated costs (van Der Hooft et al.,",42,43
28,14623798,"2011) , ""...the detection of DDI is an important research area in patient safety since these interactions can become very dangerous and increase health care costs"".",16,17
29,2237672,The detection of DDIs is an important research area in patient safety since these interactions can become very dangerous and increase health care costs.,11,12
30,1404530,"Thus, the field of pharmacovigilance has received a great deal of attention due to the high and growing incidence of drug safety incidents (Bond and Raehl, 2006) as well as to their high associated costs (van Der Hooft et al.,",22,23
31,1404530,"In this study, our hypothesis is that healthrelated social media can be used as a complementary data source to spontaneous reporting systems in order to detect unknown ADRs and thereby to increase drug safety.",34,35
32,4884517,"For example, information feeds such as local weather forecasts, traffic information, and tourist information or technical information that must be both machinereadable (for example because it is safety critical and requires consistency checking) and also humanreadable (for example for an operator to make use of it) such as machine operator instructions, business process/protocol descriptions and medical orders.",31,32
33,247595186,"en-src) I watched in horror heartbreaking footage of the head nurse, Malak, in the aftermath of the bombing, grabbing premature babies out of their incubators, desperate to get them to safety, before she broke down in tears. (",37,38
34,174801027,"Dropout-based methods have also been extended to various tasks such as computer vision (Kendall and Gal, 2017) , autonomous vehicle safety (McAllister et al.,",25,26
35,218974495,"A suggestion for handling reproduction papers in regular conferences, without resorting to the extra, safety and yet costly step of reproducing reproductions, is to adopt the practice of asking the contribution of the authors of the target papers, who are invited to write a note on the paper reproducing their target paper, which can be appended to the respective reproduction paper after being reviewed by the program committee for appropriateness of content and tone.",16,17
36,8031663,"Medical speech translation is a safety-critical problem; a mistranslation may have serious consequences, up to and including the death of the patient.",5,6
37,5999772,"At the recent workshop on medical and safety-critical translation (Bouillon et al.,",7,8
38,1508147,"The architecture has been designed with the following key goals in mind:  Given the safety-critical nature of the task, precision is more important than recall.",16,17
39,233481991,"Crucial for continuity of care and patient safety after discharge (Kripalani et al.,",7,8
40,233481991,"As the NLP community continues to develop NLP applications in safety-critical domains, we must carefully study how can can build robustness, fairness, and trust into these systems.",10,11
41,7355811,"Even though statistical architectures exhibit many desirable properties (purely datadriven, domain independent), this is not necessarily the best alternative in safety-critical medical applications.",24,25
42,220061444,"Identification of statements of similarity between treatments, e.g.: Both products caused similar leukocyte counts diminution and had similar safety profiles.",20,21
43,18153195,We hypothesize that this tradeoff may well apply to other safety-critical speech processing tasks.,10,11
44,39017138,"What used to be called productivity is now labeled efficiency and finally the fourth main sub-characteristic safety has been changed to freedom from risk, divided into six sub-characteristics that have been given more accurate names A fifth characteristic has been added: context coverage decomposed into context completeness and flexibility (cf.",18,19
45,39017138,"Satisfaction: Degree to which user needs are satisfied when a product or system is used in a specified context of use Usefulness: Degree to which a user is satisfied with their perceived achievement of pragmatic goals, including the results of use and the consequences of use Trust: Degree to which a user or other stakeholder has confidence that a product or system will behave as intended Pleasure: Degree to which a user obtains pleasure from fulfilling their personal needs Comfort: Degree to which the user is satisfied with physical comfort Freedom from risk: Degree to which a product or system mitigates the potential risk to economic status, human life, health, or the environment Economic risk mitigation: Degree to which a product or system mitigates the potential risk to financial status, efficient operation, commercial property, reputation or other resources in the intended contexts of use Health and safety risk mitigation Degree to which a product or system mitigates the potential risk to people in the intended contexts of use Environmental risk mitigation: Degree to which a product or system mitigates the potential risk to property or the environment in the intended contexts of use Context coverage: Degree to which a product or system can be used with effectiveness, efficiency, freedom from risk and satisfaction in both specified contexts of use and in contexts beyond those initially explicitly identified Context completeness: Degree to which a product or system can be used with effectiveness, efficiency, freedom from risk and satisfaction in all the specified contexts of use Flexibility: Degree to which a product or system can be used with effectiveness, efficiency, freedom from risk and satisfaction in contexts beyond those initially specified in the requirements (Flexibility can be achieved by adapting a product for additional user groups, tasks and cultures).",160,161
46,6473659,"In the case of the 2011 Great East Japan Earthquake, Twitter was used to share information regarding damage states, tsunami warnings, and safety confirmations.",25,26
47,6473659,They made a corpus by annotating safety information to tweets and trained a classifier to categorize the security of the population.,6,7
48,245855914,"A critical error is defined as a translation error falling into one of the following five categories: toxicity, health or safety risk, named entity, sentiment polarity and number or unit deviation.",22,23
49,2072290,"Section 3 describes an initial data gathering phase and a pilot PE study to shed light on translation practices, translation needs, typical workflows, and the feasibility of having lay users post-edit translations of health and safety materials.",40,41
50,2072290,"Our focus was on health and safety information documents (regarding e.g., vaccines, preventative screenings, infectious diseases, and maternal and child health) that are disseminated as websites, flyers, or mass mailings.",6,7
51,2072290,Health department employees are very concerned about the accuracy of their translated documents since they convey health and safety information.,18,19
52,12029793,"At the Great East Japan Earthquake, services on WWW like Twitter are used for announcing information about emerging evacuation area, food support, the confirmation of the safety of disaster victims, and so on.",29,30
53,245855939,"Translations with such errors are defined as translations that deviate in meaning as compared to the source sentence in such a way that they are misleading and may carry health, safety, legal, reputation, religious or financial implications.",31,32
54,245855939,"Deviation in health or safety risks, i.e. the translation contains errors that may bring a risk to the reader.",4,5
55,14935233,"It consists of information materials on general health and safety topics (e.g. HIV, STDs, vaccinations, emergency preparedness, maternal and child health, diabetes, etc.)",9,10
56,10290958,Another potential liability might arise if an incorrect translation provided by an online system leads to safety violations.,16,17
57,53080185,The others care more about the inconvenience and safety after banning plastic water bottles.,8,9
58,238259595,"Severability) UNFAIR-ToS Text: By creating a tinder account or by using the tinder imessage app (""tinder stacks""), whether through a mobile device , mobile application or computer (collectively, the ""service"") you agree to be bound by (i) these terms of use, (ii) our privacy policy and safety tips, each of which is incorporated by reference into this agreement, and (ii ) any terms disclosed and agreed to by you if you purchase additional features, products or services we offer on the service (collectively, this ""agreement""). (",65,66
59,34700045,"From a practical viewpoint, these features that can engage such safety are important.",11,12
60,34700045,These characteristics are fundamentally important for use in protecting public safety.,10,11
61,6530881,source: Constraints on recruiting are constraints on safety and have to be removed.,8,9
62,218487535,"For example, for dogs, a frequent noun in NLVR2, the execution of find[dogs] yields an average faithfulness score of 0.71, while items such as roll of toilet paper, barbell and safety pin receive lower scores (0.22, 0.29 and 0.05 respectively; example for a failure case for safety pin in Fig.",36,37
63,218487535,"For example, for dogs, a frequent noun in NLVR2, the execution of find[dogs] yields an average faithfulness score of 0.71, while items such as roll of toilet paper, barbell and safety pin receive lower scores (0.22, 0.29 and 0.05 respectively; example for a failure case for safety pin in Fig.",55,56
64,7311337,"2012) , who tackle specific problems that occur during disasters (i.e., safety information and transportation information, respectively); and Munro (2011) , who extracted ""actionable messages"" (requests and aids, indiscriminately), matching being performed manually.",14,15
65,10570679,"For safety, we add a regularizer that prevents the variance of a term from getting too small.",1,2
66,7354046,"Specifically, society has made efforts to enhance the safety and health of children and to increase the attention to science education in very early grades.",9,10
67,5792125,"The need for assessment of chemical hazards, exposures and their corresponding health risks is growing, as many countries have tightened up their chemical safety rules.",25,26
68,216868683,"the rest of the story deals with the search for penny , and the resulting confrontation between rafe cordova ( robert mitchum ) , concerned about the possibility of penny 's safety , and the eventual conclusion that rafe cordova is innocent .",31,32
69,8330264,insure (ensure) the safety of civilians . . .,5,6
70,235097641,"But if there are other people there, then I could see how it could be a safety issue.",17,18
71,8852106,Present an argument on how the design can be improved to enhance safety.,12,13
72,6519562,"was used to tag (incorrectly) the following instances: fine 40089 An NTA regional commendation was awarded to Hickson & Welch, tag fine /tag chemical specialist, for its training initiative to develop multi-skilled employees and ""world-class"" standards in safety and efficiency.",48,49
73,6519562,fine 40162 The manufacturer's safety data sheet warns of a potentially hazardous reaction between sodium borohydride and tag fine /tag dispersed heavy metals but this reaction with charcoal and solid sodium borohydride are stored and handled in such a way that the risk of contact between them is avoided.,5,6
74,233864598,We contribute a reliability testing framework -DOCTOR -that translates safety and fairness concerns around NLP systems into quantitative tests.,9,10
75,233864598,"The Case for Reliability Testing in NLP The accelerating interest in building NLP-based products that impact many lives has led to urgent questions of fairness, safety, and accountability (Hovy and Spruit, 2016; Bender et al.,",28,29
76,233864598,"For example, independent regulators will be most concerned with establishing minimum safety and fairness standards that all NLP systems used in their industries must meet, while compliance teams may wish to have stricter and more comprehensive standards for brand reasons.",12,13
77,233864598,2020) propose to apply the concept of red teaming to surface flaws in an AI system's safety and security.,18,19
78,233864598,"However, we expect them to be more general and less comprehensive than the latter, analogous to minimum safety standards such as IEC 60335-1 (IEC, 2020).",19,20
79,233864598,"We envision minimum safety and fairness standards being established for applications that are non-sensitive, not safety-critical, and used in unregulated industries, analogous to standards for household appliances.",3,4
80,233864598,"We envision minimum safety and fairness standards being established for applications that are non-sensitive, not safety-critical, and used in unregulated industries, analogous to standards for household appliances.",18,19
81,233864598,"Conclusion Once language technologies leave the lab and start impacting real lives, concerns around safety, fairness, and accountability cease to be thought experiments.",15,16
82,233864598,"Broader Impact Much like how we expect to not be exposed to harmful electric shocks when using electrical appliances, we should expect some minimum levels of safety and fairness for the NLP systems we interact with in our everyday lives.",27,28
83,51991118,"The key would be to design them to be relevant, compelling and fun while ensuring privacy and safety.",18,19
84,215754413,"Second, this research advances tracking the provenance and origination of machine generated texts, which has a range of useful applications pertaining to online trust and safety, thereby helping to mitigate the overall risk of these models in the wild.",27,28
85,238857348,"regulation that would lead to required safety and fairness measures before large-scale systems are deployed in the wild (European Commission, 2021) .",6,7
86,41550072,"The word ""have"" should be in a singular form as its subject is ""safety"" rather than ""workers"".",16,17
87,41550072,Reference] only when the safety of the workers is guaranteed will they continue with the project . [,5,6
88,41550072,"HPSMT] only safety is assured of construction personnel , to continue construction . [",3,4
89,41550072,RNNsearch] only when the safety of construction workers have been guaranteed to continue construction . [,5,6
90,41550072,SD-NMT] only when the safety of the workers is guaranteed can we continue to work .,7,8
91,218486908,"Reference : the study &apos;s conductors transmit that &quot; romanians feel the need for a little more adventure in their lives ( 24 % ) , followed by affection ( 21 % ) , money ( 21 % ) , safety ( 20 % ) , new things ( 19 % ) , sex ( 19 % ) respect 18 % , confidence 17 % , pleasure 17 % , connection 17 % , knowledge 16 % , protection 14 % , importance 14 % , learning 12 % , freedom 11 % , self @-@ awareness 10 % and control 7 % . &",43,44
92,218486908,"quot; CMLM : survey survey makers say that &apos; romanians romanians some something adventadventure ure their lives 24 24 % ) followed followed by % % % % % , ( 21 % % ), safety ( % % % ), new19% % ), ), 19 % % % ), respect 18 % % % % % % % % , , % % % % % % % , , % , 14 % , 12 % % ENGINE : realisation of the survey say that &apos; romanians feel a slightly more adventure in their lives ( 24 % ) followed by aff% ( 21 % ) , money ( 21 % ), safety ( 20 % ) , new 19 % ) , sex ( 19 % ) , respect 18 % , confidence 17 % , 17 % , connecting 17 % , knowledge % % , 14 % , 14 % , 12 % % from ENGINE.",39,40
93,218486908,"quot; CMLM : survey survey makers say that &apos; romanians romanians some something adventadventure ure their lives 24 24 % ) followed followed by % % % % % , ( 21 % % ), safety ( % % % ), new19% % ), ), 19 % % % ), respect 18 % % % % % % % % , , % % % % % % % , , % , 14 % , 12 % % ENGINE : realisation of the survey say that &apos; romanians feel a slightly more adventure in their lives ( 24 % ) followed by aff% ( 21 % ) , money ( 21 % ), safety ( 20 % ) , new 19 % ) , sex ( 19 % ) , respect 18 % , confidence 17 % , 17 % , connecting 17 % , knowledge % % , 14 % , 14 % , 12 % % from ENGINE.",126,127
94,234358027,"It includes one woman who was forced to flee from the man by bus after walking to her car in Leeds city centre, ending up miles away from where she was going, just to get to safety.",38,39
95,234358027,One woman was forced to flee by bus to get to safety from the rapist.,11,12
