,corpus_id,sentence,start_idx,end_idx
1822,222177236,We then measure the Perspective API toxicity scores of the posts in SBIC that are offensive to at least one minority group.,6,7
1823,222177236,"First, although it was trained on comments from online forums such as discussions of Wikipedia and New York Times, it could misclassify SBIC examples due to a domain mismatch leading to different manifestations of overt toxicity.",37,38
1824,222177236,"In addition, as we discuss above, misclassifications can be attributed to novel lexicons of toxicity, to (intentional or unintentional) spelling variations, or to more subtly expressed implicit offenses.",16,17
1825,222177236,"Our set of veiled offenses covers any of these forms, as they are hidden from the original toxicity detection model.",18,19
1826,222177236,"11  We extract all SBIC posts annotated as nonoffensive and also sort their Perspective API toxicity scores from low to high in x 1 , x (2) , • • • , x (n ) .",16,17
1827,222177236,"For the SBIC posts that are identified as offensive, we extract those with Perspective API toxicity score > 0.8 (a recommended threshold by Perspective API for determining bad language) and consider them as our overtly offensive set.",16,17
1828,222177236,Student model evaluation Would a vanilla toxicity classifier recognize veiled offenses?,6,7
1829,222177236,All of the updated models still preserve the utility in recognizing the overt toxicity.,13,14
1830,222177236,"They got low toxicity scores from Perspective API, but were annotated as offensive to at least one social group according to the SBIC dataset.",3,4
1831,234679223,"We would like to remind our dataset users that there could have potential bias, toxicity, and subjective opinions in the selected conversations which may impact model training.",15,16
1832,248779948,2019) toxicity classifier 5 fine-tuned from RuBERT Conversational.,2,3
1833,248779948,That means that models produce the same or almost the same sentences for the language on which they were not fine-tuned so that toxicity is not eliminated.,25,26
1834,248780527,"Introduction Detection of toxicity (Zampieri et al.,",3,4
1835,248780527,We suggest that such messages could be automatically rewritten to keep the useful content intact and eliminate toxicity.,17,18
1836,248780527,"Detoxification is usually formulated as style transfer from toxic to neutral (non-toxic) style, so it uses non-parallel datasets labeled for toxicity and considers toxic and neutral sentences as two subcorpora.",27,28
1837,248780527,2018 ) create their own toxicity-labelled datasets of sentences from Reddit and Twitter.,5,6
1838,248780527,Crowdsourcing Tasks We ask crowd workers to generate paraphrases and then evaluate them for content preservation and toxicity.,17,18
1839,248780527,2 Task 1: Generation of Paraphrases The first crowdsourcing task asks users to eliminate toxicity in a given sentence while keeping the content (see the task interface in Figure 1 ).,15,16
1840,248780527,"Some sentences cannot be detoxified, because they do not contain toxicity or because they are meaningless.",12,13
1841,248780527,"Moreover, in some cases toxicity cannot be removed.",5,6
1842,248780527,"Task 3: Toxicity Check Finally, we check if the workers succeeded in removing toxicity.",15,16
1843,248780527,We fetch them from corpora labeled for toxicity and additionally filter them with a toxicity classifier (described in Section 3.3).,7,8
1844,248780527,We fetch them from corpora labeled for toxicity and additionally filter them with a toxicity classifier (described in Section 3.3).,14,15
1845,248780527,"However, we run Task 3 twice, because we need to check both parts of the pair for toxicity.",19,20
1846,248780527,"Analogously to the generation pipeline, we use a toxicity classifier to pre-select pairs of sentences where one sentence is toxic and the other one is neutral.",9,10
1847,248780527,"Crowdsourcing Settings Preprocessing To pre-select toxic sentences, we need a toxicity classifier.",13,14
1848,248780527,We plot the percentage of paraphrases which were filtered out by content and toxicity checks in Figure 8 .,13,14
1849,248780527,"We then sample 6,000 random pairs from this list and ask workers to evaluate them for toxicity and content preservation.",16,17
1850,248780527,Ethical Considerations The research on toxicity raises some ethical issues.,5,6
1851,248780527,"No toxicity this is all coming out of our darned pockets, and i am not confident!",1,2
1852,232035490,"Despite their popularity, toxicity detection tasks have focused majorly on sequence classification, rather than sequence tagging.",4,5
1853,232035490,Finding which spans make a comment or document toxic in nature is crucial in explaining the reasons behind their toxicity.,19,20
1854,232035490,"Additionally, such attributions would allow for more efficient semi-automated quality-based moderation of content, especially for verbose documents, in comparison to quantitative toxicity scores.",28,29
1855,232035490,2020) discuss context requirement for toxicity detection.,6,7
1856,232035490,"From the valid spans, the score is calculated as the average of start and end logit scores, as well as the mean of toxicity logits over the span under consideration.",25,26
1857,232035490,"The score is given as: S(i s , i e ) = ŝis + êie 2 + ie k=is tk e − s + 1 where i s and i e are start and end indices, ŝis and êie are start and end logits at those indices, and tk is toxicity logit at index k. A threshold, similar to Section 3.2 is tuned on the dev set.",55,56
1858,232035490,"For the Token Classification model, the targets are softmax outputs of toxicity logits of those tokens which the model predicts to be toxic, with a score greater than 0.5.",12,13
1859,232035490,"For all such toxicity logits as targets, we calculate attributions with respect to the embedding layer outputs for all the tokens, and average them to get token-wise importance scores.",3,4
1860,232035490,"Additionally, some words outside of the span may contribute to toxicity of a particular span.",11,12
1861,232035490,"The first instance of 'ignorant' does not seem to be as toxic as the second instance and therefore, more analysis needs to be done to determine the 'degree' of toxicity of the spans.",34,35
1862,195218693,"For instance, the sentence ""I am gay"" receives a high score on a toxicity model as seen in Table 1 .",16,17
1863,195218693,Our main intuition is that undesirable correlations between toxicity labels and instances of identity terms cause the model to learn unfair biases which can be corrected by incorporating priors on these identity terms.,8,9
1864,195218693,"As shown in our experiments, by setting a positive target attribution for known toxic words 1 , one can improve the performance of a toxicity classifier in a scarce data regime.",25,26
1865,195218693,"The dataset was annotated by human raters, where toxicity was defined as a ""rude, disrespectful, or unreasonable comment that is likely to make you leave a discussion"" per Dixon et al. (",9,10
1866,195218693,"Please refer to the corresponding paper for more details about collection methodology, biases present in the data, and toxicity distribution per comment length.",20,21
1867,195218693,"However, the impact of our approach diminishes after adding more data, since the model starts to learn to focus on toxic words itself for predicting toxicity without the need for prior injection.",27,28
1868,196185011,"2018) , or inequality of sentiment or toxicity for various protected groups (Caliskan-Islam et al.,",8,9
1869,236460291,"We show that pre-trained convolutions are competitive against pre-trained Transformers via a set of experiments on a potpourri of NLP tasks, like toxicity detection, sentiment classification, news classification, query understanding and semantic parsing/compositional generalization (Kim and Linzen, 2020) .",27,28
1870,231847004,"We demonstrate that toxicity models, as exemplified by Perspective, are inadequate for the analysis of incivility in news.",3,4
1871,231847004,"Applying off-the-shelf tools for toxicity detection is appealingly convenient, but such use has not been validated for any domain, while uses in support of moderation efforts have been validated only for online comments.",8,9
1872,231847004,"We examine the feasibility of quantifying incivility in the news via the Jigsaw Perspective API, which has been trained on over a million online comments rated for toxicity and deployed in several scenarios to support moderator effort online 1 .",28,29
1873,231847004,"Incivility is more subtle and nuanced than toxicity, which includes identity slurs, profanity, and threats of violence along other unacceptable incivility.",7,8
1874,231847004,"To pinpoint some of the sources of the noise in predictions, we characterize individual words as likely triggers of errors in Perspective or sub-error triggers that lead to over-prediction of toxicity.",35,36
1875,231847004,Another category of incivility detection that more closely aligns with our work is toxicity prediction.,13,14
1876,231847004,2018) collected a dataset for toxicity identification in online comments on Wikipedia talk pages.,6,7
1877,231847004,"They defined toxicity as comments that are rude, disrespectful, or otherwise likely to make someone leave a discussion.",2,3
1878,231847004,2019) were released for the system to show how well the system is able to predict toxicity when certain identity words are mentioned in a text.,17,18
1879,231847004,"Simple templates such as ""I am <IDENTITY>"" were used to measure the toxicity associated with identity words.",16,17
1880,231847004,"More recently, many more incorrect associations with toxicity were discovered.",8,9
1881,231847004,"2019) found that Perspective returned a higher toxicity score when certain names are mentioned, and Hutchinson et al. (",8,9
1882,231847004,"I am a blind person"" had a significantly higher toxicity score than ""I am a tall person"".",10,11
1883,231847004,"Further, we propose a way to establish a reference set of words and then find words associated with markedly higher toxicity than the reference.",21,22
1884,231847004,This approach reveals a larger set of words which do not lead to errors but trigger uncommonly elevated predictions of toxicity in the lower ranges of the toxicity scale.,20,21
1885,231847004,This approach reveals a larger set of words which do not lead to errors but trigger uncommonly elevated predictions of toxicity in the lower ranges of the toxicity scale.,27,28
1886,231847004,"For automatic analysis, we obtain Perspective scores for each speaker turn as marked in the transcript and count the number of turns predicted as having toxicity 0.5 or greater.",26,27
1887,231847004,There is only one snippet with Perspective toxicity score over 0.5 for the civil to borderline civil segments from the news shows; this indicates it has good precision for binary identification of civil content.,7,8
1888,231847004,"The recall for incivility is not that good, with some of these snippets receiving low toxicity scores.",16,17
1889,231847004,"Their analysis, similar to other work on bias in word representations, starts with a small list of about 50 words to be analyzed in an attempt to find toxicity over-prediction triggers.",30,31
1890,231847004,"Given our text domain of interest (news) and the desiderata to characterize sources rather than individual text segments, we also find sub-errors, or words that do not lead to errors in toxicity prediction but have much higher than average toxicity associated with them compared to other words.",37,38
1891,231847004,"Given our text domain of interest (news) and the desiderata to characterize sources rather than individual text segments, we also find sub-errors, or words that do not lead to errors in toxicity prediction but have much higher than average toxicity associated with them compared to other words.",45,46
1892,231847004,7.63 0.10 Table 2 : Snippets from MSNBC rated as highly uncivil by humans but with low toxicity score from Perspective.,17,18
1893,231847004,The average toxicity of templates filled in with a given word now provides us with a word-specific incivility score by which we can compare the full set of selected words.,2,3
1894,231847004,The five templates we use are: We use Perspective to predict the toxicity of each template when WORD is substituted with each of the words in our list for analysis.,13,14
1895,231847004,We will consider words to be error triggers if at least one template was judged by Perspective to have toxicity greater than 0.5.,19,20
1896,231847004,"Sub-error triggers are words for which all five templates had toxicity lower than 0.5, but their average toxicity was markedly higher than that for other words.",12,13
1897,231847004,"Sub-error triggers are words for which all five templates had toxicity lower than 0.5, but their average toxicity was markedly higher than that for other words.",20,21
1898,231847004,"The average template toxicity for offensive words is 0.48, compared to 0.11 for the 2,606 nonoffensive words in the list we analyzed.",3,4
1899,231847004,"Of the 65 offensive words, 54% had at least one template with toxicity greater than 0.5.",14,15
1900,231847004,It produces toxicity scores below 0.5 for about half of the offensive words.,2,3
1901,231847004,"Overall, 89% of the offensive words meet either the error triggers or sub-error triggers criteria, confirming that these ranges of toxicity are the appropriate ones in which we should focus our attention in search of words that may have an unusually high association with toxicity.",25,26
1902,231847004,"Overall, 89% of the offensive words meet either the error triggers or sub-error triggers criteria, confirming that these ranges of toxicity are the appropriate ones in which we should focus our attention in search of words that may have an unusually high association with toxicity.",49,50
1903,231847004,They are ones for which Perspective over-predicts toxicity.,9,10
1904,231847004,Error Trigger Words for Perspective We consider a word to be an error trigger if at least one of the templates has a toxicity score of 0.5 or greater from Perspective.,23,24
1905,231847004,"Many of these identities, like gay and Muslim, were known triggers of incorrect toxicity prediction, and Perspective was specially altered to address this problem (Dixon et al.,",15,16
1906,231847004,Perhaps this is why words broadly related semantically are associated with toxicity.,11,12
1907,231847004,Sub-Error Triggers Sub-error triggers of incivility are words that are not offensive and for which Perspective returns a toxicity score below 0.5 for each of the five templates when the word is plugged in the template.,22,23
1908,231847004,"To establish a reference point for the expected average template civility of non-offensive words, we sample 742 words that appeared in at least 10 speaker turns (i.e., were fairly common) and ap-peared in speaker turns in the news shows that received low toxicity predictions from Perspective, below 0.15.",50,51
1909,231847004,We define sub-error triggers to be those whose average template toxicity score is two standard deviations higher than the average in the reference list.,12,13
1910,231847004,The second-person pronouns are likely spuriously associated with toxicity due to overrepresentation in direct toxic comments directed to other participants in the conversation.,10,11
1911,231847004,"Similarly, the association of female pronouns with toxicity is likely due to the fact that a large fraction of the indirect toxic comments online are targeted to women.",8,9
1912,231847004,Conclusion The work we presented was motivated by the desire to apply off-the-shelf methods for toxicity prediction to analyse civility in American news.,19,20
1913,225040675,Both researchers and social platforms have been focused on developing models to detect toxicity in online communication for a while now.,13,14
1914,225040675,"The low entry threshold and relative anonymity of the Internet have resulted not only in the exchange of information and content but also in the rise of trolling, hate speech, and overall toxicity 2 .",34,35
1915,225040675,"They tend to classify comments mentioning certain commonly harassed identities (e.g. containing words such as woman, black, jew or женщина, черный, еврей) as toxic, while the comment itself may lack any actual toxicity.",39,40
1916,225040675,Identity terms of frequently targeted social groups have higher toxicity scores since they are found more often in abusive and toxic comments than terms related to other social groups.,9,10
1917,225040675,Inappropriately high toxicity scores of terms related to specific social groups can potentially negate the benefits of using machine learning models to fight the spread of hate speech.,2,3
1918,225040675,"In 66 this paper, our main goal is to reduce the false toxicity scores of non-toxic comments that include identity terms empirically known to introduce model bias.",13,14
1919,225040675,2 Related Work Hate Speech Detection in Russian Little research has been done on the automatic detection of toxicity and hate speech in the Russian language.,18,19
1920,225040675,"2020) proposed a model that learns to predict the toxicity of a comment, as well as the protected identities present, in order to reduce unintended bias as shown by an increase in Generalized Mean of Bias AUCs.",10,11
1921,225040675,"In our setup, the loss from an extra classifier head is weighted equal to the loss from the toxicity classifier.",19,20
1922,225040675,"As the loss function for Multi-Task learning, we used the average loss score between two tasks: predicting the toxicity score, and predicting the protected identity class.",22,23
1923,225040675,"We showed that, for our dataset and for the benchmark from (Smetanin, 2020) , adding an extra task of predicting the class of a protected identity can indeed improve the quality of toxicity classification in terms of reducing unintended bias.",36,37
1924,231583180,"In future work, we intend to test the approach not only for repetition, but also for various other metrics, such as the toxicity level or bias of generated text.",25,26
1925,231861515,Experimenting with the largest toxicity detection dataset to date (Civil Comments) our model generates sentences that are more fluent and better at preserving the initial content compared to earlier text style transfer systems which we compare with using several scoring systems and human evaluation.,4,5
1926,231861515,"Consequently, we limit our setting to the unsupervised case where the comments are only annotated in attributes related to toxicity, such as the Civil Comments dataset (Borkan et al.,",20,21
1927,231861515,We summarize our investigations with the following research question: RQ: Can we fine-tune end-to-end a pre-trained text-to-text transformer to suggest civil rephrasings of rude comments using a dataset solely annotated in toxicity?,45,46
1928,231861515,"Here, we apply attribute transfer to a large dataset annotated in toxicity, but we also use the Yelp review dataset from Shen et al. (",12,13
1929,231861515,"Experiments Datasets We employed the largest publicly available toxicity detection dataset to date, which was used in the 'Jigsaw Unintended Bias in Toxicity Classification' Kaggle challenge.",8,9
1930,231861515,"Each of these comments was annotated by crowd raters (at least 3 each) for toxicity and toxicity subtypes (Borkan et al.,",16,17
1931,231861515,"Each of these comments was annotated by crowd raters (at least 3 each) for toxicity and toxicity subtypes (Borkan et al.,",18,19
1932,231861515,2019) toxicity classifier on the Civil Comments dataset.,2,3
1933,231861515,"5 Eventually, we created X T (respectively X C ) with sentences whose system-generated toxicity score (using our BERT classifier) is greater than 0.9 (respectively less than 0.1) to increase the dataset's polarity.",18,19
1934,231861515,The test ROC-AUC of the toxicity classifier is 0.98 with a precision of 0.95 and a recall of 0.38.,7,8
1935,231861515,"We employed a pre-trained BERT as our toxicity classifier, fine-tuned on the Civil Comments dataset (see Section 4.1).",9,10
1936,231861515,"Interestingly, our model is able to add toxicity in civil comments as shown by the examples in the Appendix Table 10 .",8,9
1937,231861515,The nature of large datasets labeled in toxicity and the lack of incentives for crowd-sourcing civil rephrasing annotation makes it expensive and difficult to train systems in a supervised framework.,7,8
1938,231861515,"In our case, evaluating whether the attribute is actually transferred requires to train an accurate toxicity classifier.",16,17
1939,231861515,"Algorithm 1: CAE-T5 training Input :T5's pre-trained parameters θ 0 , unpaired dataset labelled in toxicity X = X T ∪ X C Output :CAE-T5's fine-tuned parameters θ T for step τ ∈ [1; T ] do if τ %2 == 0 then Sample a mini-batch x of sentences in X T else Sample a mini-batch x of sentences in X C end θ ← θτ−1 θ ← θτ−1 xDAE ← f θ (η(x), α(x)) xCC ← f θ (f θ(x, ᾱ(x)), α(x)) DAE ← H(x, xDAE ) CC ← H(x, A.3 Appen settings Figure 3 and Figure 4 detail the guidelines we wrote on the crowdsourcing website Appen 11 , when we asked human crowd-workers to rate automatic rephrasings and to rephrase toxic comments.",22,23
1940,236478314,"For instance, when training on English the model would at times invent ""toxicity cardiaque "" for the French test set instead of extracting ""toxicité cardiaque"".",14,15
1941,236478036,We present experiments with two text classification datasets annotated with demographic information: the Trustpilot Corpus (sentiment) and CivilComments (toxicity).,22,23
1942,236478036,"We evaluate FSP across two architectures, two pruning strategies and two datasets, including multilingual sentiment classification and English toxicity classification.",20,21
1943,236478036,"2019) , 3 which contains comments annotated for toxicity, for the purpose of hate speech detection.",9,10
1944,236478036,"4 Likewise for CivilComments, we threshold comments with a toxicity rating > 0.5 as toxic, and otherwise label them as a non-toxic.",10,11
1945,236478036,"We measure group disparity, using fairness sensitivity to pruning, on the Trustpilot Corpus, a sentiment classification dataset covering 3 languages, as well as CivilComments, a toxicity classification dataset, for both feed-forward and recurrent neural networks.",30,31
1946,250390650,"2021) provide the only available resource of human-written or machine-generated responses with annotations, but the original task does not involve assessing counternarrative quality but rather classifying the contextual toxicity of dialogue re-  3 Counterspeech and Microintervention Generation Task Formalization Counternarrative generation can be viewed as a type of conditional or constrained text generation, in which the output is expected to oppose the input text.",34,35
1947,13696741,"2009) , highlighting rationale phrases in Both cohorts showed signs of optic nerve toxicity due to ethambutol.",14,15
1948,233365230,"For example, sentiment analysis, topic modeling, toxicity classification, and other language modeling techniques have become common in interactive user-facing systems.",9,10
1949,233365230,"However, the same technology has also incorrectly discovered a positive correlation between identity terms containing information on race or sexual orientation (e.g., the phrase ""I am a gay black woman"" received a high toxicity score) (developers.google.com).",38,39
1950,52194540,"Google and Jigsaw developed a tool called Perspective 7 that measures the ""toxicity"" of comments.",13,14
1951,52194540,The tool is published as an API and gives a toxicity score between 0 and 100 using a machine learning model.,10,11
1952,53593090,Language toxicity identification presents a gray area in the ethical debate surrounding freedom of speech and censorship.,1,2
1953,53593090,"In response, we focused on training a multi-label classifier to detect both the type and level of toxicity in online content.",20,21
1954,53593090,"Furthermore, building a representative and high volume annotated dataset of social media contents for multiple types of toxicity can be exhaustive.",18,19
1955,53593090,"Our research gave life to a language toxicity identification tool, which will be presented alongside this paper.",7,8
1956,226283547,"In the broad area of abusive language detection, there exists several other datasets collected and annotated for cyberbullying, toxicity, aggression and so on (we would not discuss those in-depth as they are out of the scope of this work).",20,21
1957,236459882,"While several toxicity detection datasets (Wulczyn et al.,",2,3
1958,236459882,"In fact, highlighting toxic spans can assist human moderators who often deal with lengthy comments, and who prefer attribution instead of just a system-generated unexplained toxicity score per post. *",29,30
1959,236459882,"We apply the trained model on the SemEval 2021 Task 5: Toxic Spans Detection test set comments to predict their toxicity, then, we use the LIME technique to explain the predictions (Figure 3 ).",21,22
1960,236459882,"By training the linear support vector machine classifier on the SemEval 2021 Task 5: Toxic Spans Detection test set, we guarantee that the model accurately predicts the toxicity of its comments with precision, recall, f-score, and accuracy of 1 (the model correctly predict the toxicity of all 2000 reviews in the test set).",29,30
