,corpus_id,sentence,start_idx,end_idx
0,245906443,"2020) , toxicity, and bias (Xu et al.,",3,4
1,245906443,"Responsibility, toxicity and bias can also be measured (Xu et al.,",2,3
2,218971825,"2019) , sentiment analysis (Kiritchenko and Mohammad, 2018) , and hate speech/toxicity detection (e.g., Park et al.,",17,18
3,218971825,"2017) ; (b) sentiment analysis systems yielding different intensity scores for sentences containing names associated with African Americans and sentences containing names associated with European Americans (Kiritchenko and Mohammad, 2018) ; and (c) toxicity detection systems scoring tweets containing features associated with African-American English as more offensive than tweets without these features (Davidson et al.,",41,42
4,218971825,"2019) focus on the effect of priming annotators with information about possible dialectal differences when asking them to apply toxicity labels to sample tweets, fnding that annotators who are primed are signifcantly less likely to label tweets containing features associated with African-American English as offensive.",20,21
5,218971825,"2018)) , and that toxicity detection systems score tweets containing features associated with AAE as more offensive than tweets without them (Davidson et al.,",6,7
6,218971825,"Researchers and practitioners should be concerned about ""racial bias"" in toxicity detection systems not only because performance differences impair system performance, but because they reproduce longstanding injustices of stigmatization and disenfranchisement for speakers of AAE.",12,13
7,645466,"In our case, these components are morpheme-like items which either (i) bear referential lexical meaning like confixes (-cyto-, -bio-) and autonomous lexical items (cancer, toxicity) or (ii) can substantially change the meaning of a word, especially prefixes (anti-, post-) and some suffixes (-less, -like).",34,35
8,645466,"For example, toxic can be translated to toxique 'toxic', toxicité 'toxicity' or vénéneux 'poisonous'.",15,16
9,13983070,"These components may be either free (i.e. they can occur in texts as autonomous lexical items like toxicity in cardiotoxicity) or bound (i.e. they cannot occur as autonomous lexical items, in that case they correspond to bound morphemes likecardioin cardiotoxicity).",18,19
10,13983070,Translation occurs regardless of the components' degree of freedom: -cardiomay be translated as coeur 'heart' as in cardiotoxicity → toxicité pour le coeur 'toxicity to the heart'.,28,29
11,13983070,"Allomorphy happens regardless of the components' degree of freedom: -cardio-, coeur 'heart', cardiaque 'cardiac' are possible instantiations of the same abstract component and may lead to terminological variation as in cardiotoxicity → cardiotoxicité 'cardiotoxicity', toxicité pour le coeur 'toxicity to the heart', toxicité cardiaque 'cardiac toxicity'.",50,51
12,13983070,"Allomorphy happens regardless of the components' degree of freedom: -cardio-, coeur 'heart', cardiaque 'cardiac' are possible instantiations of the same abstract component and may lead to terminological variation as in cardiotoxicity → cardiotoxicité 'cardiotoxicity', toxicité pour le coeur 'toxicity to the heart', toxicité cardiaque 'cardiac toxicity'.",60,61
13,13983070,"In our case, these components are morpheme-like items which either (i) bear referential lexical meaning like confixes 4 (-cyto-, -bio-, -ectomy-) and autonomous lexical items (cancer, toxicity) or (ii) can substantially change the meaning of a word, especially prefixes (anti-, post-, co-...) and some suffixes (-less, -like...).",37,38
14,248512793,"More critically, it can be used to prevent the inherent toxicity of language models trained on the internet, or to not reproduce gender or race stereotypes.",11,12
15,248512793,"The ethical interests are thus important, such as adding constraint about race diversity, gender equality, non toxicity, factual faithfulness, etc.",19,20
16,245855914,"A critical error is defined as a translation error falling into one of the following five categories: toxicity, health or safety risk, named entity, sentiment polarity and number or unit deviation.",18,19
17,245855939,"Deviation in toxicity (hate, violence or profanity) be against an individual or a group (a religion, race, gender, etc.).",2,3
18,245855939,"This error can happen because toxicity is introduced in the translation when it is not in the source, deleted in the translation when it was in the source, or mistranslated into different (toxic or not) words, or not translated at all (i.e. the toxicity remains in the source language or it is transliterated). •",5,6
19,245855939,"This error can happen because toxicity is introduced in the translation when it is not in the source, deleted in the translation when it was in the source, or mistranslated into different (toxic or not) words, or not translated at all (i.e. the toxicity remains in the source language or it is transliterated). •",49,50
20,245855939,"Give the nature of this dataset (user generated content with high chances of toxicity, named entities, etc.),",14,15
21,245855939,"LAMA-ICL used additional features to detect the presence/deviation of toxicity, sentiment and named entities, also followed by ensenbling of models with different individual features.",13,14
22,219176615,"Although several 'toxicity' detection datasets and models have been published, most of them ignore the context of the posts, implicitly assuming that comments may be judged independently.",3,4
23,219176615,"We investigate this assumption by focusing on two questions: (a) does context affect the human judgement, and (b) does conditioning on context improve performance of toxicity detection systems?",31,32
24,219176615,We find that context can both amplify or mitigate the perceived toxicity of posts.,11,12
25,219176615,"Moreover, a small but significant subset of manually labeled posts (5% in one of our experiments) end up having the opposite toxicity labels if the annotators are not provided with context.",25,26
26,219176615,"Surprisingly, we also find no evidence that context actually improves the performance of toxicity classifiers, having tried a range of classifiers and mechanisms to make them context aware.",14,15
27,219176615,"Apart from a growing volume of press articles concerning toxicity online, 1 there is increased research interest on detecting abusive and other unwelcome comments labeled 'toxic' by moderators, both for English and other languages.",9,10
28,219176615,"2019) , toxicity is defined as ""a rude, disrespectful, or unreasonable comment that is likely to make you leave a discussion"" (Wulczyn et al.,",3,4
29,219176615,TARGET I blame you for my alcoholism add that too Table 1: Comments that are not easily labeled for toxicity without the 'parent' (previous) comment.,20,21
30,219176615,current datasets do not include the preceding comments in a conversation and such context was not shown to the annotators who provided the gold toxicity labels.,24,25
31,219176615,Table 1 shows additional examples of comments that are not easily judged for toxicity without the parent comment.,13,14
32,219176615,"Interestingly, even basic statistics on how often context affects the perceived toxicity of online posts have not been published.",12,13
33,219176615,"Hence, in this paper we focus on the following two foundational research questions: • RQ1: How often does context affect the toxicity of posts as perceived by humans in online conversations?",24,25
34,219176615,And how often does context amplify or mitigate the perceived toxicity?,10,11
35,219176615,"RQ2: Does context actually improve the performance of toxicity classifiers, when they are made context-aware?",9,10
36,219176615,And how can toxicity classifiers be made context-aware?,3,4
37,219176615,"To investigate these questions we created and make publicly available two new toxicity datasets that include context, which are based on discussions in Wikipedia Talk Pages (Hua et al.,",12,13
38,219176615,We used this dataset to show that the perceived toxicity of a significant subset of posts (5.2% in our experiment) changes when context is (or is not) provided.,9,10
39,219176615,We conclude that a small but significant subset of manually labeled posts end up having wrong toxicity labels if the annotators are not provided with context.,16,17
40,219176615,1.6%) the perceived toxicity.,5,6
41,219176615,"To investigate the second question, concerning the effect of context on the performance of toxicity classifiers, we created a larger dataset of 20k comments; 10k comments were annotated out of context, 10k in context.",15,16
42,219176615,"Surprisingly, we found no evidence that context actually improves the performance of toxicity classifiers.",13,14
43,219176615,"While most previous work does not address toxicity in general, instead addressing particular subtypes, toxicity and its subtypes are strongly related, with systems trained to detect toxicity being effective also at subtypes, such as hateful language (van Aken et al.,",7,8
44,219176615,"While most previous work does not address toxicity in general, instead addressing particular subtypes, toxicity and its subtypes are strongly related, with systems trained to detect toxicity being effective also at subtypes, such as hateful language (van Aken et al.,",16,17
45,219176615,"While most previous work does not address toxicity in general, instead addressing particular subtypes, toxicity and its subtypes are strongly related, with systems trained to detect toxicity being effective also at subtypes, such as hateful language (van Aken et al.,",29,30
46,219176615,"Both small and large toxicity datasets have been developed, but approximately half of them contain tweets, which makes reusing the data difficult, because abusive tweets are often removed by the platform.",4,5
47,219176615,"2017a) used professional moderators, who were monitoring entire threads and were thus able to use the context of the thread to judge for the toxicity of the comments.",26,27
48,219176615,Hence no toxicity dataset includes the raw text of both target and parent comments with sufficient links between the two.,2,3
49,219176615,This means that toxicity detection methods cannot exploit the conversational context when being trained on existing datasets.,3,4
50,219176615,"Mikolov and Zweig (2012) , for example, used LDA to encode the preceding sentences and pass the en-  For each comment and group of annotators, the toxicity scores of the annotators were averaged and rounded to the nearest binary decision (toxic, non-toxic) to compute the number of toxic comments (#toxic).",31,32
51,219176615,"3 Experiments Experiments with CAT-SMALL for RQ1 To investigate how often context affects the perceived toxicity of posts, we created CAT-SMALL, a small Context-Aware Toxicity dataset of 250 randomly selected comments from the Wikipedia Talk Pages (Table 4 ).",17,18
52,219176615,We gave these comments to two groups of crowd-workers to judge their toxicity.,14,15
53,219176615,Their depth in their threads was from 2 Figure 1 : Toxicity ratio (%) of the comments of CAT-SMALL when using the toxicity labels of GN (annotators with no context) or GC (annotators with context).,26,27
54,219176615,"For each comment and group of annotators, the toxicity scores of the annotators were first averaged and rounded to the nearest binary decision, as in Table 4 .",9,10
55,219176615,"Figure 1 shows that the toxicity ratio (toxic comments over total) of CAT-SMALL is higher when annotators are given context (GC), compared to when no context is provided (GN).",5,6
56,219176615,"The toxicity ratio increases by 2 percentage points (4.4% to 6.4%) when context is provided, but this is an aggregated result, possibly hiding the true size of the effect of context.",1,2
57,219176615,"The perceived toxicity of some comments may be increasing when context is provided, but for other comments it may be decreasing, and these effects may be partially cancelling each other when measuring the change in toxicity ratio.",2,3
58,219176615,"The perceived toxicity of some comments may be increasing when context is provided, but for other comments it may be decreasing, and these effects may be partially cancelling each other when measuring the change in toxicity ratio.",37,38
59,219176615,"To get a more accurate picture of the effect of context, we measured the number of comments of CAT-SMALL for which the (averaged and rounded) toxicity label was different between the two groups (GN, GC).",30,31
60,219176615,"We found that the toxicity of 4 comments out of 250 (1.6%) decreased with context, while the toxicity of 9 comments (3.6%) increased.",4,5
61,219176615,"We found that the toxicity of 4 comments out of 250 (1.6%) decreased with context, while the toxicity of 9 comments (3.6%) increased.",21,22
62,219176615,"Hence, perceived toxicity was affected for 13 comments (5.2% of comments).",3,4
63,219176615,"While the small size of CAT-SMALL does not allow us to produce accurate estimates of the frequency of posts whose perceived toxicity changes with context, the experiments on CAT-SMALL indicate that context has a statistically significant effect on the perceived toxicity, and that context can both amplify or mitigate the perceived toxicity, thus making a first step to addressing our first research question (RQ1).",23,24
64,219176615,"While the small size of CAT-SMALL does not allow us to produce accurate estimates of the frequency of posts whose perceived toxicity changes with context, the experiments on CAT-SMALL indicate that context has a statistically significant effect on the perceived toxicity, and that context can both amplify or mitigate the perceived toxicity, thus making a first step to addressing our first research question (RQ1).",45,46
65,219176615,"While the small size of CAT-SMALL does not allow us to produce accurate estimates of the frequency of posts whose perceived toxicity changes with context, the experiments on CAT-SMALL indicate that context has a statistically significant effect on the perceived toxicity, and that context can both amplify or mitigate the perceived toxicity, thus making a first step to addressing our first research question (RQ1).",57,58
66,219176615,"Nevertheless, larger annotated datasets need to be developed to estimate more accurately the frequency of context-sensitive posts in online conversations, and how often context amplifies or mitigates toxicity.",31,32
67,219176615,"Experiments with CAT-LARGE for RQ2 To investigate whether adding context can benefit toxicity detection classifiers, we could not use CAT-SMALL, because its 250 comments are too few to effectively train a classifier.",14,15
68,219176615,Figure 2 shows that the toxicity ratio increased (from 0.6% to 1.5%) when context was given to the annotators.,5,6
69,219176615,"Again, the change of toxicity ratio is an indication that context does affect the perceived toxicity, but it does not accurately show how many comments are affected by context, since the perceived toxicity may increase for some comments when context is given, and decrease for others.",5,6
70,219176615,"Again, the change of toxicity ratio is an indication that context does affect the perceived toxicity, but it does not accurately show how many comments are affected by context, since the perceived toxicity may increase for some comments when context is given, and decrease for others.",16,17
71,219176615,"Again, the change of toxicity ratio is an indication that context does affect the perceived toxicity, but it does not accurately show how many comments are affected by context, since the perceived toxicity may increase for some comments when context is given, and decrease for others.",35,36
72,219176615,"Unlike CAT-SMALL, in CAT-LARGE we cannot count for how many comments the perceived toxicity increased or decreased with context, because the two groups of annotators (GN, GC) did not annotate the same comments.",19,20
73,219176615,The toxicity ratios of CAT-LARGE (Fig.,1,2
74,219176615,"1 ), though they both show a trend of increased toxicity ratio when context is provided.",11,12
75,219176615,"The toxicity ratios of CAT-LARGE are more reliable estimates of toxicity in online conversations, since they are based on a much larger dataset.",1,2
76,219176615,"The toxicity ratios of CAT-LARGE are more reliable estimates of toxicity in online conversations, since they are based on a much larger dataset.",12,13
77,219176615,We used CAT-LARGE to experiment with both context-insensitive and context-sensitive toxicity classifiers.,16,17
78,219176615,"On top of the concatenated last states (from the two directions) of the BILSTM, we add a feed-forward neural network (FFNN), consisting of a hidden dense layer with 128 neurons and tanh activations, then a dense layer leading to a single output neuron with a sigmoid that produces the toxicity probability.",58,59
79,219176615,"We used the general toxicity labels of that dataset, and fine-tuned for a single epoch.",4,5
80,219176615,"PERSPECTIVE The third context-insensitive classifier is a CNN-based model for toxicity detection, trained on millions of user comments from online publishers.",14,15
81,219176615,"In each fold (split) of the MC cross-validation, the training, development, and test subsets are 60%, 20%, and 20% of the data, respectively, preserving in each subset the toxicity ratio of the entire dataset.",42,43
82,219176615,"This is not surprising, since these systems were trained (fine-tuned in the case of BERT-CCTK) on much larger toxicity datasets than the other systems (upper two zones of Table 5 ), and BERT-CCTK was also pre-trained on even larger corpora.",25,26
83,219176615,"We conclude for our second research question (RQ2) that we found no evidence that context actually improves the performance of toxicity classifiers, having tried both simple (BILSTM) and more powerful classifiers (BERT), having experimented with several methods to make the classifiers context aware, and having also considered the effect of gold labels obtained out of context vs. gold labels obtained by showing context to annotators.",22,23
84,219176615,Conclusions and Future Work We investigated the role of context in detecting toxicity in online comments.,12,13
85,219176615,"We showed that context does have a statistically significant effect on toxicity annotation, but this effect is seen in only a narrow slice (5.2%) of the (first) dataset.",11,12
86,219176615,"We also found no evidence that context actually improves the performance of toxicity classifiers, having tried both simple and more powerful classifiers, having experimented with several methods to make the classifiers context aware, and having also considered the effect of gold labels obtained out of context vs. gold labels obtained by showing context to the annotators.",12,13
87,219176615,"A Data Annotation Annotators were asked to judge the toxicity of each comment, given the following definitions: • VERY TOXIC: A very hateful, aggressive, disrespectful comment or otherwise very likely to make a user leave a discussion or give up on sharing their perspective. •",9,10
88,219176615,NOT TOXIC: Not containing any toxicity.,6,7
89,219176615,"GC annotators had one more question, which was asking them to compare the toxicity of the target comment to that of the parent comment.",14,15
90,219176615,"On top of the BERT [CLS] representation, we added a FFNN of 128 hidden nodes and a sigmoid to yield the toxicity probability.",24,25
91,184482657,This paper presents the application of two strong baseline systems for toxicity detection and evaluates their performance in identifying and categorizing offensive language in social media.,11,12
92,184482657,"Perspective is an API, that serves multiple machine learning models for the improvement of conversations online, as well as a toxicity detection system, trained on a wide variety of comments from platforms across the Internet.",22,23
93,184482657,"Perspective performed better than BERT in detecting toxicity, but BERT was much better in categorizing the offensive type.",7,8
94,184482657,"The first baseline is a Convolutional Neural Network (CNN) for toxicity detection, trained on millions of user comments from different online publishers, which is made publicly available through the Perspective API.",12,13
95,184482657,"Apart from the growing volume of popular press concerning toxicity online, the increased interest in research into offensive language is partly due to the recent Workshops on Abusive Language Online, 4 as well as other fora, such as GermEval for German texts, 5 or TA-COS 6 and TRAC (Kumar et al.,",9,10
96,184482657,"2018 ) is a deep bidirectional network built using Transformers (Vaswani et Results Offensive Language Detection For Subtask A, we used the toxicity score from Perspective and returned the offensive label (OFF) when the returned score was above 0.5.",24,25
97,184482657,"The performance of Perspective in this subtask is particularly interesting, considering that the training data for these models were not labeled for offensiveness, but rather for other attributes such as toxicity, threats, and insults.",32,33
98,236460230,"Current toxicity detection systems classify whole posts as toxic or not (Schmidt and Wiegand, 2017; Pavlopoulos et al.,",1,2
99,236460230,"This would allow the moderators to more quickly identify objectionable parts of the posts, especially in long posts, and more easily approve or reject the decisions of the toxicity detection systems.",30,31
100,236460230,"As a first step along this direction, Task 5 of SemEval 2021 provided the participants with posts previously rated to be toxic, and required them to identify toxic spans, i.e., spans that were responsible for the toxicity of the posts, when identifying such spans was possible.",40,41
101,236460230,"2017) was used on the Appen crowd rating platform to label the comments using a number of attributes including 'toxicity', 'obscene', 'threat ' Borkan et al. (",21,22
102,236460230,"When studying the toxicity subtypes, we find that the vast majority of posts are annotated as insulting.",3,4
103,236460230,A toxic span was defined to be a sequence of words that attribute to the post's toxicity.,17,18
104,236460230,"The latter is first fine-tuned to classify posts as toxic or nontoxic, using three Kaggle toxicity datasets.",18,19
105,236460230,Rationales Some participants experimented with training toxicity classifiers on external datasets containing posts labeled as toxic or non-toxic; and then employing model-specific or model-agnostic rationale extraction mechanisms to produce toxic spans as explanations of the decisions of the classifier.,6,7
106,236460230,The model-specific rationale mechanism of Rusert (2021) used the attention scores of an LSTM toxicity classifier to detect the toxic spans.,18,19
107,236460230,2016) with a Logistic Regression (LR) or with a linear Support Vector Machine (SVM) toxicity classifier.,19,20
108,236460230,"An added value of these approaches is that easy to use resources (toxicity lexicons) are built and shared publicly, such as the one suggested by Pluciński and Klimczak (2021) .",13,14
109,236460230,"8  Custom losses Zhen Wang and Liu (2021) experimented with a new custom loss, which weighted false toxicity predictions based on their location in the text.",21,22
110,236460230,"2021) , or to filter posts (Luu and Nguyen, 2021) that were not labeled as toxic by a toxicity classifier.",22,23
111,236460230,The strong dependency of toxicity on context makes it particularly difficult to solve with systems based on vocabulary.,4,5
112,236460230,"Finally, future competitions could require participants to distinguish toxic posts of different kinds (e.g., insult, threat, profanity, along with supporting spans), which are sometimes easier to define compared to the more general umbrella toxicity term we (and others) have used.",41,42
113,236486094,User posts whose perceived toxicity depends on the conversational context are rare in current toxicity detection datasets.,4,5
114,236486094,User posts whose perceived toxicity depends on the conversational context are rare in current toxicity detection datasets.,14,15
115,236486094,"Hence, toxicity detectors trained on current datasets will also disregard context, making the detection of context-sensitive toxicity a lot harder when it occurs.",2,3
116,236486094,"Hence, toxicity detectors trained on current datasets will also disregard context, making the detection of context-sensitive toxicity a lot harder when it occurs.",20,21
117,236486094,"We constructed and publicly release a dataset of 10k posts with two kinds of toxicity labels per post, obtained from annotators who considered (i) both the current post and the previous one as context, or (ii) only the current post.",14,15
118,236486094,"We introduce a new task, context sensitivity estimation, which aims to identify posts whose perceived toxicity changes if the context (previous post) is also considered.",17,18
119,236486094,"Such systems could be used to enhance toxicity detection datasets with more context-dependent posts, or to suggest when moderators should consider the parent posts, which may not always be necessary and may introduce an additional cost.",7,8
120,236486094,2017) are called toxicity (or abusive language) detection systems.,4,5
121,236486094,"2018) , is that they disregard the conversational context (e.g., the parent post in the discussion), making the detection of context-sensitive toxicity a lot harder.",28,29
122,236486094,"Although toxicity datasets that include conversational context have recently started to appear, in previous work we showed that context-sensitive posts are still too few in those datasets (Pavlopoulos et al.,",1,2
