,corpus_id,sentence,start_idx,end_idx
496,235313967,"We finetune GPT-2 Large We can see that even with a dataset of 40,960 tokens (""650 comments) corresponding to ă 0.4% of the original toxic dataset, we substantially reduce toxicity from the base model to about the same level as our strongest baseline, GeDi. (",34,35
497,235313967,"PPLM As with toxicity §3, we retrain the sentiment classifier for PPLM with a larger embedding size compatible with our base model.",3,4
498,235313967,"As with toxicity experiments ( §3), we use nucleus sampling with p "" 0.9, and include our training and generation details in Appendix A. Automatic Evaluation We evaluate our generations for the target sentiment, fluency, and diversity.",2,3
499,235313967,"Part of our work requires automatically detecting toxicity in generated texts, for which we use the Perspective API.",7,8
500,235313967,7 a commercially deployed toxicity detection tool.,4,5
501,235313967,"However, the mismatch between the construct of toxicity and its operationalization through an automatic classifier can cause biased or unintended model behavior (Jacobs and Wallach, 2021) .",8,9
502,235313967,"Specifically, recent work has shown that such hate speech classifiers overestimate the prevalence of toxicity in text that contains a minority identity mention (Hutchinson et al.,",15,16
503,235313967,"To address this limitation, we also perform a human evaluation of toxicity, for which we obtained IRB approval and sought to pay our workers a fair wage (""US$7-9/h).",12,13
504,235313967,"Nevertheless, toxicity in pretrained LMs is an unsolved issue (Sheng et al.,",2,3
505,235313967,"PPLM For our implementation of PPLM in experiments, we retrain the toxicity and sentiment classifiers to be compatible with our base model GPT-2 (large), as the original paper used GPT-2 medium for experiments.",12,13
506,235313967,"GeDi For toxicity and sentiment steering, we download the class-conditioned language models (based on GPT-2 Medium) made available by the original authors.",2,3
507,235313967,D Additional Results D.1 Toxicity Hyperparameter Control Figure 8 shows the relationship between output toxicity and fluency for different values of α in our method.,14,15
508,235313967,"We finetune the sentiment (anti-)experts and all DAPT models for 3 epochs, and the toxicity (anti-)experts for one epoch.",16,17
509,238857348,"2021) and toxicity detection (Halevy et al.,",3,4
510,21688491,"In parallel to the progress in DDI extraction from texts, Graph Convolutional Networks (GCNs) have been proposed and applied to estimate physical and chemical properties of molec-ular graphs such as solubility and toxicity (Duvenaud et al.,",37,38
511,221949376,"A Class overlap and interpretation of ""toxicity""  To see if our results generalize beyond threat, we experimented on the identity-hate class in Kaggle's toxic comment classification dataset.",7,8
512,201070022,"We considered the version of the dataset that corresponds to the Kaggle competition: ""Toxic Comment Classification Challenge"" (Google, 2018) which features 7 classes of toxicity: toxic, severe toxic, obscene, threat, insult, identity hate and non-toxic.",30,31
513,248023030,"2019) , toxicity (Gehman et al.,",3,4
514,248023030,"2021) , and toxicity agreement (Baheti et al.,",4,5
515,1006882,"In our data, this candidate generation process has a recall of 98.9, as a few instances exist in which a conjunction is not used, such as: • I am looking for any information you have about heavy metal toxicity, [treatment, outcomes] EXEMPLIFICATION+COORDINATION .",42,43
516,236459793,"This task aims to locate those spans that attribute to the text's toxicity within a text, which is crucial for semiautomated moderation in online discussions.",13,14
517,6128897,"The corpus is available at http://diego.asu.edu/index.php/projects Introduction Pharmacogenomics is a relatively new area of biomedical research that merges pharmacology and molecular genomics, among other disciplines, and focuses on studying the effects of genetic variability on drug toxicity and efficacy, on the discovery of novel genomic targets for drug development, and on the identification and functional characterization of polymorphisms relevant to drug action.",38,39
518,250390502,"To protect users from online toxicity, social media providers have been increasingly implementing censorship-based measures.",5,6
519,199379867,"Introduction Unexpected Food-Drug Interactions (FDIs) occasionally result in treatment failure, toxicity and an increased risk of side-effects.",15,16
520,33850483,"Product-Dependent Factors Product-dependent internationalization factors pertain to specific features that the product needs to comply with, for example, toxicity regulation and transport dimensions, or that will be acceptable to the market locale, for example, colors or certain types of ingredients and so on.",24,25
521,239618387,"For developing our rule-based system for toxicity detection we also used a corpus of annotated tweets from Germeval challenges of previous years (Wiegand et al.,",8,9
522,239618387,The experiments in this section and the qualitative analysis in Section 7 were performed only for the toxicity detection task.,17,18
523,239618387,"For the toxicity detection task we experimented with simple strategies for automatic bootstrapping of keyword lists, which are then reviewed and corrected manually.",2,3
524,239618387,"The method involves extracting simple patterns from comments in the training data and ranking them according to their potential as rules, i.e. looking for patterns that in themselves have a very high precision as predictors of toxicity.",37,38
525,239618387,"The majority of good patterns comes from the larger toxicity dataset available to us, the 2018 and 2019 Germeval training datasets (Wiegand et al.,",9,10
526,239618387,"While in the smaller 2021 dataset the top-ranked patterns occurred in no more than 3 or 4 positive examples of toxicity, the combined training datasets of previous years allowed us to find patterns with 15-25 positive examples, a much stronger indicator that a word might be a good keyphrase for domain-independent detection of offensive speech.",22,23
527,239618387,Two of the patterns we identified were introduced in the final rule-based system: for the toxicity detection task we categorize a comment as toxic if it contains at least two words with at least four characters each written in ALL-CAPS.,18,19
528,239618387,Results on toxicity detection (Subtask 1) are presented in Table 1 .,2,3
529,239618387,Qualitative analysis The main focus of our rule-based experiments was the toxicity detection.,13,14
530,239618387,"Indeed this group contains several examples where a deep understanding of the comment is necessary to account for its toxicity, demonstrating the complexity of the task.",19,20
531,239618387,"Indeed, if a human expert were to build a complex rule-based model for the toxicity detection task, it may very well contain patterns such as PROTECTED_GROUP + NEGATIVE_PREDICATE and lexica for what words and phrases are to be considered as belonging to each of these categories.",17,18
532,239618387,The analysis in this section was intended to provide examples of the types of challenges a model of toxicity must concern itself with.,18,19
533,239618387,"In particular, false negative predictions are responsible for more than 70% of errors made by both of our top-performing systems, and our analysis suggests that identifying most of these would require more complex rules for modeling specific types of toxicity and the ability to detect sarcasm.",44,45
534,239618387,"Conclusion We described simple methods for the semiautomatic construction of rule-based systems for detecting toxicity in social media, and used them to improve the performance of a BERTbased classifier on the dataset of the 2021 Ger-mEval shared task.",16,17
535,241583270,"Other indicators include: abiotic resource depletion, blue water shortage, human toxicity... Existing tools for deep learning programs focus on the carbon footprint only.",13,14
536,237593022,"For instance, in toxicity classification, certain sub-groups are often predicted more confidently for toxicity (encouraging false negatives for the majority sub-group), which tend to be close to the margin for the non-toxic class (encouraging false positives; Borkan et al. (",4,5
537,237593022,"For instance, in toxicity classification, certain sub-groups are often predicted more confidently for toxicity (encouraging false negatives for the majority sub-group), which tend to be close to the margin for the non-toxic class (encouraging false positives; Borkan et al. (",17,18
538,248118802,"The existing studies have been evaluated on English datasets containing rich demographic variations, such as Wikipedia toxicity comments (Cabrera et al.,",17,18
539,237593027,"γ g is the inverse proportion of positive examples in each group, |g| |g y=1 | , meaning that the more underrepresented a group is wrt some target class (say toxicity), the smaller its accepted deviation from the overall performance.",32,33
540,238226547,"Through a case study on a publicly available toxicity detection model, we demonstrate that our method identifies salient groups of cross-geographic errors, and, in a follow up, demonstrate that these groupings reflect human judgments of offensive and inoffensive language in those geographic contexts.",8,9
541,238226547,"In this paper, we propose a new weakly supervised method (outlined in Figure 1 ) to address shortcomings of current bias detection methods and robustly detect lexical biases in models (i.e. biases that associate the presence or lack of toxicity with certain words) when applied to noisy text (in particular, text generated by social media users from non-predominantly Anglophone nations).",42,43
542,238226547,"As an example, such biases are present even in a commonly-used toxicity detector like the Perspective API, as shown in Table 1 .",14,15
543,238226547,"In the first two sets of rows, we see that the mentions of certain identity groups (e.g., muslims, Tamilian) causes the toxicity model to assign a higher toxicity score.",26,27
544,238226547,"In the first two sets of rows, we see that the mentions of certain identity groups (e.g., muslims, Tamilian) causes the toxicity model to assign a higher toxicity score.",32,33
545,238226547,"The third and fourth set of rows demonstrate that the model does not recognize the toxicity association on the words presstitute and Madarchod, 2 whereas it does recognize the toxicity of words/phrases with the same/similar meanings.",15,16
546,238226547,"The third and fourth set of rows demonstrate that the model does not recognize the toxicity association on the words presstitute and Madarchod, 2 whereas it does recognize the toxicity of words/phrases with the same/similar meanings.",30,31
547,238226547,"Such overrepresentation could be due to different reasons: (1) the model has learned some of these words to be offensive and hence their presence causes it to assign a higher toxicity score, or (2) some of the words appear more often in offensive contexts (e.g., frequent victims of toxicity) but their presence is merely correlational (i.e., the model doesn't have any toxicity association for these words).",33,34
548,238226547,"Such overrepresentation could be due to different reasons: (1) the model has learned some of these words to be offensive and hence their presence causes it to assign a higher toxicity score, or (2) some of the words appear more often in offensive contexts (e.g., frequent victims of toxicity) but their presence is merely correlational (i.e., the model doesn't have any toxicity association for these words).",56,57
549,238226547,"Such overrepresentation could be due to different reasons: (1) the model has learned some of these words to be offensive and hence their presence causes it to assign a higher toxicity score, or (2) some of the words appear more often in offensive contexts (e.g., frequent victims of toxicity) but their presence is merely correlational (i.e., the model doesn't have any toxicity association for these words).",73,74
550,238226547,Another consideration is whether the association of a particular word towards toxicity is desirable or not.,11,12
551,238226547,"Here, we investigate how the sensitivity varies across the range of toxicity scores, which gives important clues about the desirability of biases.",12,13
552,238226547,2019) representations for each term by creating vectors x ∈ R d such that x i is the toxicity after replacing person in the i-th template with a word from a lexicon.,19,20
553,238226547,We then cluster terms that have similar behaviour together to qualitatively distinguish the kind of association they have with toxicity.,19,20
554,238226547,Experimental Setting We use the Perspective API's toxicity model for our analysis.,8,9
555,238226547,"Cluster C0 (top left of Figure 3a ) contains words such as feminist and muslim that increase the toxicity of the templates with the largest changes occurring in the middle, indicating undesirable biases in the model.",19,20
556,238226547,"In contrast, cluster C1 (top right) has words such as shithead that uniformly raise the toxicity of the templates to the very high range, regardless of the initial toxicity of the template.",18,19
557,238226547,"In contrast, cluster C1 (top right) has words such as shithead that uniformly raise the toxicity of the templates to the very high range, regardless of the initial toxicity of the template.",32,33
558,238226547,"Our results show that the words in C0 and C3 are often very similar in their perceived toxicity and, in the case of India, have no statistical difference in their toxicity ratings.",17,18
559,238226547,"Our results show that the words in C0 and C3 are often very similar in their perceived toxicity and, in the case of India, have no statistical difference in their toxicity ratings.",32,33
560,238226547,"Appendix B. The clusters found by our method do correspond to in-community judgments of toxicity and reflect meaningful groups of biases in the model, which can be used by experimenters for later bias testing and mitigation.",16,17
561,238226547,Towards Mitigating Undesirable Biases Our pipeline provides an unsupervised approach to identifying potential latent biases in toxicity models.,16,17
562,238226547,"Experimental Setting Performing bias mitigation experiments involves retraining the model, and hence requires toxicity annotated training data.",14,15
563,238226547,"Since we do not have access to the training data used to train the Perspective API model, we employ the dataset provided by Jigsaw for the Kaggle competition on toxicity classification (Jigsaw, 2019) that contains public comments from the Civil Comments platform and annotated toxicity ratings (on a continuous scale in the range [0, 1]).",30,31
564,238226547,"Since we do not have access to the training data used to train the Perspective API model, we employ the dataset provided by Jigsaw for the Kaggle competition on toxicity classification (Jigsaw, 2019) that contains public comments from the Civil Comments platform and annotated toxicity ratings (on a continuous scale in the range [0, 1]).",48,49
565,238226547,"We train the toxicity model for this analysis by fine-tuning a DistilBert model (Sanh et al.,",3,4
566,238226547,The last two metrics compare the toxicity scoring distributions of the instances with the target words and those instances without.,6,7
567,238226547,"First, mitigation strategies varied in their net effect on recognizing toxicity.",11,12
568,238226547,"In these cases, AUC remained largely the same as without mitigation suggesting these models are still capable of ordering instances correctly by toxicity, but the overall scoring has changed sufficiently to affect classification decisions.",23,24
569,238226547,"Third, the Balance and Tune strategy had negligible effect on both bias correction or toxicity performance.",15,16
570,238226547,Ethical Considerations The proposed method provides an efficient distantly-supervised method for practitioners to identify potential biases in their toxicity detection methods.,20,21
571,238226547,A Templates We present the list of templates as well as their corresponding toxicity scores according to the Perspective model.,13,14
572,244050420,"This is a valid concern, as up to 3% of the web content is considered to contain toxicity (Founta et al.,",19,20
573,236486080,"Further, it covers a wide range of labels of different kinds of toxicity, e.g., sexism, aggression, and hate.",13,14
574,236486080,"How well do hate speech, toxicity, abusive and offensive language classification models generalize across datasets?",6,7
575,236486080,"Collection Creation We consider all publicly accessible comment datasets for the collection that contain labels that are subclasses of toxicity, such as offensive language, abusive language, and aggression.",19,20
576,236486080,The broad definition of toxicity as a higher-level concept builds a bridge between the different lowerlevel concepts.,4,5
577,236486080,"There is a large set of labels that occurs only in one dataset, with each label referring to a particular subclass of toxicity and target, e.g., female football players as in the dataset by Fortuna et al. (",23,24
578,53447013,"Their metric of constructiveness (relevant remarks, specific points, and appropriate evidence) is set in contrast to toxicity (hate speech, verbal abuse, offensiveness).",20,21
579,52310274,"Besides looking at toxicity of online comments (Wulczyn et al.,",3,4
580,52310274,"Besides traditional binary classification tasks, related work considers different aspects of toxic language, such as ""racism"" (Greevy and Smeaton, 2004; Waseem, 2016; Kwok and Wang, 2013) and ""sexism"" (Waseem and Hovy, 2016; Jha and Mamidi, 2017) , or the severity of toxicity (Davidson et al.,",59,60
581,52310274,The toxicity of a comment often depends on expressions made in early parts of the comment.,1,2
582,52310274,Our algorithms can detect their toxicity only if they can recognize multiple words as a single (typical) hateful phrase.,5,6
583,222271929,"Therefore, identifying these comments is an important task for studying and preventing the proliferation of toxicity in social media.",16,17
584,222271929,"In this paper, we propose a new large-scale dataset for Brazilian Portuguese with tweets annotated as either toxic or non-toxic or in different types of toxicity.",30,31
585,222271929,An error analysis and experiments with multi-label classification show the difficulty of classifying certain types of toxic comments that appear less frequently in our data and highlights the need to develop models that are aware of different categories of toxicity.,41,42
586,222271929,"Nevertheless, there are multiple challenges specific to process toxic comments automatically, e.g. (i) toxic language may not be explicit, i.e. may not contain explicit toxic terms; (ii) there is a large spectrum of types of toxicity (e.g. sexism, racism, insult); (iii) toxic comments correspond to a minority of comments, which is fortunate, but means that automatic data-driven approaches need to deal with highly unbalanced data.",43,44
587,222271929,"5 ToLD-Br is available at: https://github.com/ JAugusto97/ToLD-Br Finally, we experiment with multi-label classification, where each different type of toxicity is automatically classified.",29,30
588,222271929,"However, using this strategy alone may hinder learning a model capable of generalising the concept of toxicity beyond the scope of keywords.",17,18
589,222271929,"From these candidates, 42 were selected based on their demographic information, aiming to balance annotation bias as the interpretation of toxicity may vary.",22,23
590,222271929,"When we set an example as positive for toxicity only when all the annotators consider it to have the same category of offence, we insert bias to  ments.",8,9
591,222271929,"In this paper, we consider the least restrictive case, where if at least one annotator marked any offence category in an example, the example is positive for toxicity.",30,31
592,222271929,"We believe that it is essential that if any person feels uncomfortable with a post, it should be flagged as having a certain degree of toxicity.",26,27
593,222271929,"False negative rate LGBTQ+phobia Importance of Large Datasets In this experiment, we highlight the importance of collecting a considerable amount of examples, as toxicity can be expressed in many different ways.",25,26
594,218974083,The stemming misleads the classifiers to wrongly explain the toxicity of the comment with this word.,9,10
595,218974083,"These sparse explanations are suitable for our dataset, as there is typically a small set of toxic words, which explains the toxicity of the entire comment.",23,24
596,218974083,This negative relevance score means that this word speaks against the toxicity of the comment.,11,12
597,218974083,"Without the full context, none of the single words explains the toxicity of the comment.",12,13
598,218974083,"This result confirms that the classifiers detect those words that often constitute the toxicity of a comment (e.g., swear words).",13,14
599,218974083,"However, the true positives of the LSTM approach also contain comments whose toxicity can only be detected with context.",13,14
600,222291028,"We compute Toxicity reward scores using this classifier as Bot Toxicity (e.g. lower toxicity score, higher Bot toxicity reward).",14,15
601,222291028,"We compute Toxicity reward scores using this classifier as Bot Toxicity (e.g. lower toxicity score, higher Bot toxicity reward).",19,20
602,237048417,The first is the 'toxicity' attribute returned by Perspective API (P-TX).,5,6
603,237048417,We test this model because toxicity ratings are the most popular attributes.,5,6
604,229923220,"Round 1 (R1) The target model in R1 is M1, a RoBERTa model trained on R0 which consists of 11 English language training datasets for hate and toxicity taken from hatespeechdata.com, as reported in Vidgen and Derczynski (2020) .",30,31
605,229923220,"2020) , of which Perspective's toxicity classifier 4 is best performing with 77% overall accuracy, including 90% on 'Hate' and 48% on 'Not Hate'.",7,8
606,244464114,"Multi-label toxicity detection is highly prominent, with many research groups, companies, and individuals engaging with it through shared tasks and dedicated venues.",3,4
607,244464114,We selected multi-label toxicity over other label definitions based on its adaptability and feedback from annotators.,5,6
608,244464114,"Related Research The Conversation AI group defined multi-label toxicity, and Wulczyn et al. (",10,11
609,244464114,was for multi-label toxicity to serve as a compatible annotation model for tasks beyond the original Wikipedia dataset.,5,6
610,244464114,"For a detailed overview of multi-label toxicity, look to van Aken et al.,",8,9
611,244464114,A current challenge within the sub-field of toxicity detection is the definition and operationalisation as a concrete task.,9,10
612,244464114,"In addition, we performed further annotation for multi-label toxicity, following the label guidelines of Wulczyn et al.. AMiCA Instant Messages Multi-label Toxicity Annotation To annotate the AMiCA dataset for Multi-label toxicity labels, we used the annotation instructions outlined in (Wulczyn et al.,",11,12
613,244464114,"In addition, we performed further annotation for multi-label toxicity, following the label guidelines of Wulczyn et al.. AMiCA Instant Messages Multi-label Toxicity Annotation To annotate the AMiCA dataset for Multi-label toxicity labels, we used the annotation instructions outlined in (Wulczyn et al.,",39,40
614,244464114,"We calculated an F1 score of 0.51, revealing that multi-label toxicity does not align with cyberbullying.",13,14
615,244464114,"Sub-label Performance Summary We have demonstrated that by using multilingual pre-trained language models within an ensemble approach, we can classify multi-label toxicity in an alternate language.",28,29
616,227231751,"2017) as it is a large dataset annotated for personal attacks, aggression and toxicity -components of offensiveness.",15,16
617,248780050,Then other crowd workers checked the rewritten sentence for toxicity and semantic similarity with the original one.,9,10
618,248780050,All the generated detoxified sentences are then checked for the absence of toxicity and semantic similarity to the original sentence.,12,13
619,248780050,We select only the sentences which were classified as toxic by a pretrained toxicity classifier.,13,14
620,248780050,Style (STA a ) is evaluated with a BERT-based classifier for toxicity detection.,14,15
621,248780050,"We choose this method over perplexity, because it ranges from 0 to 1 and its greater values mean higher quality, just like metrics we use for evaluating toxicity and content.",29,30
622,248780050,Toxicity (STA m ) The toxicity level is defined as: • non-toxic (1) -the sentence does not contain any aggression or offence.,6,7
623,248780050,Note also that toxicity should not be mixed with the lack of formality.,3,4
624,248780050,"It should also be noted that content and toxicity dimensions are independent, so if the output sentence is toxic, it can still be good in terms of content. •",8,9
625,248780050,Crowdsourcing tasks In the toxicity detection task (see Figure 1 ) we show workers the transferred sentence and ask them if it is offensive.,4,5
626,248780050,"We see that automatic and manual toxicity scores are much better correlated for the Delete and RoBERTareplace models, which are the only models to explicitly remove or replace toxic words identified by a classifier or via a manually compiled list of toxic words.",6,7
