,corpus_id,sentence,start_idx,end_idx
1167,222141135,"Finally, we apply the word classifier to inform feature selection for the original classification task (e.g., sentiment classification and toxicity detection).",22,23
1168,222141135,Experiments Data We experiment with four datasets for two binary classification tasks: sentiment classification and toxicity detection.,16,17
1169,222141135,We label sentences with toxicity scores ≥ 0.7 as toxic and ≤ 0.5 as non-toxic. •,4,5
1170,222141135,"For toxicity classification, we only consider toxic words.",1,2
1171,222141135,"E.g., 'joke' is positive in ""He is humorous and always tell funny jokes"", but is negative in ""This movie is a joke""; (iii) in the toxic classification task, there's no direct relation between toxicity and sentiment.",46,47
1172,226283852,"The Wikipedia Detox project, for example, provides two more data sets with the same structure, but with different tasks (toxicity and aggression).",23,24
1173,202778702,"2017) , with surveys of the area also overlooking this important and challenging task of recognizing this subtle toxicity (van Aken et al.,",19,20
1174,202778702,"Indeed, as Figure 1 suggests, current popular tools for toxic language detection do not recognize the toxicity of MAS and further, sentiment tools can label these comments as being positive.",18,19
1175,202778702,"For each category, the overall toxicity score (measured in [0,1] using the Google Perspective API) is low, indicating that currently none are reliably recognized as being offensive.",6,7
1176,202778702,"In this work, we posit that covert toxicity can be detected through contextualized analysis of subtle linguistic cues: pronoun uses, adjectives, mentions of social groups, stylistic cues, etc.",8,9
1177,237630643,"For example, in the task of toxicity prediction of online comments, we can first categorize the comments into different identity groups according to the sensitive attributes they describe (e.g., race, sexual orientation), and then improve classifier fairness with respect to the protected groups using our regularization approach.",7,8
1178,237303836, ing our automatic toxicity and stance classifiers is presented in Table 3 .,4,5
1179,237303836,"Modeling, Training and Testing Details We use CTG techniques that were found effective in reducing toxicity in language models by Gehman et al. (",16,17
1180,233209922,"For instance, a toxicity classifier is biased if it tends to increase the toxicity if we substitute straight → gay in an input sentence (Dixon et al.,",4,5
1181,233209922,"For instance, a toxicity classifier is biased if it tends to increase the toxicity if we substitute straight → gay in an input sentence (Dixon et al.,",14,15
1182,233209922,"This phenomenon is opposite to the behavior of toxicity classifiers (Dixon et al.,",8,9
1183,235097560,"Considering variations of online abuse, toxicity, hate speech, and offensive language as abusive language, this work addresses the detection of abusive versus non-abusive comments.",6,7
1184,235097225,"We consider the variations of online abuse, toxicity, hate speech, and offensive language as abusive language and this work addresses the detection of abusive versus non-abusive comments.",8,9
1185,222140831,Experiments on toxicity classification and object classification tasks show that LOGAN identifies bias in a local region and allows us to better analyze the biases in model predictions.,2,3
1186,222140831,"For example, the performance gap of a toxicity classifier for sentences mentioning black and white race groups is 4.8%.",8,9
1187,222140831,Our experiments on toxicity classification and MS-COCO object classification demonstrate the effectiveness of LOGAN.,3,4
1188,222140831,"For example, we find that different topics lead to different levels of local group bias in the toxicity classification.",18,19
1189,222140831,"In our work, we use toxicity classification as one example to detect local group bias in texts and show that such local group bias could be caused by different topics in the texts.",6,7
1190,222140831,"For toxicity classification tasks, we run the model on a GeForce GTX 1080 Ti GPU for 2 epochs, which takes about 3 hours to finish the fine-tuning procedure.",1,2
1191,249062740,"2020) is a collection of posts from Twitter, Reddit, and hate websites (e.g., Gab, Stormfront) annotated through crowd-sourcing for various aspects of biased or abusive language, including offensiveness (overall rudeness, disrespect, or toxicity of a post), intent to offend (whether the perceived motivation of the author is to offend), lewd (the presence of lewd or sexual references), group implications (whether the offensive post targets an individual or a group), targeted group (the social or demographic group that is referenced or targeted by the post), implied statement (power dynamic or stereotype that is referenced in the post) and in-group language (whether the author of a post may be a member of the same social/demographic group that is targeted).",45,46
1192,218869965,"In current hate speech datasets, there exists a high correlation between annotators' perceptions of toxicity and signals of African American English (AAE).",16,17
1193,218869965,"In §2, we describe our methodology in general terms, as it can be useful in any text classification task that seeks to predict a target attribute (here, toxicity) without basing predictions on a protected attribute (here, AAE).",32,33
1194,218869965,"Experiments 3.1 Dataset To the best of our knowledge, there are no datasets that are annotated both for toxicity and for AAE dialect.",19,20
1195,218869965,"Instead, we use two toxicity datasets and one English dialect dataset that are all from the same domain (Twitter): DWMW17 (Davidson et al.,",5,6
1196,218869965,"In order to obtain toxicity labels for the BROD16 dataset, we consider all tweets in this dataset to be non-toxic.",4,5
1197,218869965,"Thus, for both evaluation criteria, we have or infer AAE labels and toxicity labels, and we can compute how often text inferred as AAE is misclassified as hateful, abusive, or offensive.",14,15
1198,218869965,Both examples are drawn from a toxicity dataset and are classified as AAE by the dialectal prediction model.,6,7
1199,218869965,"Conclusion In this work, we use adversarial training to demote a protected attribute (AAE dialect) when training a classifier to predict a target attribute (toxicity).",28,29
1200,218869965,"While we focus on AAE dialect and toxicity, our methodology readily generalizes to other settings, such as reducing bias related to age, gender, or income-level in any other text classification task.",7,8
1201,236460028,Introduction Social media being a key factor in the world dynamics and toxicity in user-generated contents is a real threat.,12,13
1202,236460028,"Hence, it is a formidable task to precisely detect toxicity in comments and posts to be able to moderate those portions and provide the users a safe online platform to express themselves.",10,11
1203,236460028,We need to detect such spans accurately to remove toxicity from user content and preserve the safe and sound flow of online information.,9,10
1204,236460028,The unintended bias created in publicly used toxicity detection models due to many reasons such as the influence of regional culture was investigated by Borkan et al. (,7,8
1205,12911878,"2004 ) is an interface enabling knowledge-based visualization and interactive exploration of time-oriented data at different levels of temporal abstractions (e.g., abstraction of periods of bone marrow toxicity from raw individual hematological data).",33,34
1206,236460354,"To retrieve additional data, we first selected posts classified as toxic by at least half of its toxicity annotators.",18,19
1207,239050477,"Figure 5 takes a closer look at the example topic pesticides, which is concerned with different pesticides and their toxicity.",20,21
1208,250391081,"Previous work encompassing categories like hate speech, sexism, and toxicity detection in memes has primarily been explored from a textual perspective using Natural Language Processing(NLP).",11,12
1209,224704496,Wearing face masks can cause carbon dioxide toxicity; can weaken immune system.,7,8
1210,247451179,"2021) which is a compendium of domain generalization bechmarks for tasks such as image classification, text sentiment and toxicity prediction.",20,21
1211,218973961,"To address this problem, a significant number of scientific publications focused on two different (albeit related) tasks: (i) the compilation and annotation of corpora and (ii) the automatic detection of different types of offensive speech, among them, e.g., toxicity, hate, abuse, using generic state-of-the-art (i.e., machine learning-based) natural language processing techniques.",49,50
1212,218973961,"We analyze six different publicly available datasets on offensive speech in English, annotated in terms of a varying number of categories (including, e.g., 'hate speech', 'toxicity', 'sexism'), with respect to their similarity and compatibility and compare the performance of a state-of-the-art classification algorithm, which can be used via the Perspective API (Jigsaw, 2019a), on the different categories of these datasets.",33,34
1213,218973961,"According to the annotation instructions for this dataset, 'severe toxicity', 'obscene', 'threat', 'insult' and 'identity attack' are subtypes of 'toxicity' (cf.",11,12
1214,218973961,"According to the annotation instructions for this dataset, 'severe toxicity', 'obscene', 'threat', 'insult' and 'identity attack' are subtypes of 'toxicity' (cf.",34,35
1215,218973961,"However, we noticed that the data is not consistent in this respect, as there are messages belonging to 'obscene' (N=317), 'insult' (N=301), 'identity hate' (N=54) and 'threat' (N=22), but not to 'toxicity'.",53,54
1216,218973961,"For the toxicity dataset provided in Toxkaggle, we could not find any specific definition of the categories.",2,3
1217,218973961,"Another aspect to take into account is that it is often difficult to comprehend the difference between the labels 'aggression', 'toxicity' and 'offense'.",24,25
1218,218973961,"For the Davidson dataset, we created a new category 'toxicity' that subsumes the union of its hate speech and offensive categories.",11,12
1219,218973961,"We could also convert it to a gen-eral category such as 'toxicity', however we opt not to do it as TRAC aims to identify subtler aggression, which is a dimension not mentioned in the Toxkaggle dataset.",14,15
1220,218973961,"The API provides several classifiers that compute scores between 0 and 1 for different categories (among others, 'toxicity' (Jigsaw, 2019a)), given an input text.",20,21
1221,218973961,"Perspective API provides the following definitions of the relevant categories: • toxicity is a ""rude, disrespectful, or unreasonable comment that is likely to make people leave a discussion."" •",12,13
1222,218973961,"severe toxicity is a ""very hateful, aggressive, disrespectful comment or otherwise very likely to make a user leave a discussion or give up on sharing their perspective."" •",1,2
1223,218973961,"The Conversation-AI team at OffensEval-2019 applied Perspective API as a baseline system for toxicity detection, without any additional training on the contest data and obtained a very competitive result (12th out of 103 submissions, F1 of 0.79).",15,16
1224,218973961,"We think that this property, and also the fact that this is the only dataset collected from Wikipedia comments may justify why the toxicity dataset categories are mapped together in the upper part of the figure and are more difficult to compare to the categories of the other datasets.",24,25
1225,218973961,"For instance, the general categories 'toxicity' from toxkaggle ('toxkaggle-toxic') and 'aggression' from TRAC ('trac-CAG' or 'trac-OAG') do not appear close, despite the fact that both toxicity and aggression are defined as general umbrella terms for offensive, toxic or abusive online behavior.",7,8
1226,218973961,"For instance, the general categories 'toxicity' from toxkaggle ('toxkaggle-toxic') and 'aggression' from TRAC ('trac-CAG' or 'trac-OAG') do not appear close, despite the fact that both toxicity and aggression are defined as general umbrella terms for offensive, toxic or abusive online behavior.",47,48
1227,218973961,"In contrast, 'toxkaggle-toxic' and 'davidson-toxicity', which in our category standardization were assigned the label 'toxicity', appear closer in the plot.",12,13
1228,218973961,"In contrast, 'toxkaggle-toxic' and 'davidson-toxicity', which in our category standardization were assigned the label 'toxicity', appear closer in the plot.",25,26
1229,218973961,"Additionally, between these two categories, 'amievalita-sexism-misoginy' is situated, indicating that 'sexism' can be one of the main types of toxicity in those datasets.",30,31
1230,218973961,"Amievalita-misogynous' appears to be close to Davidson's 'offensive' and Toxkaggle's 'toxicity', but it is also not so far away from Waseem's 'sexism'.",18,19
1231,218973961,This may indicate that the Toxkaggle 'toxicity' category contains sexist messages that are more similar to the 'waseem-sexist' messages.,7,8
1232,218973961,"Nevertheless, it is unexpected that Waseem's 'sexism' category appears more similar to 'toxicity' than to 'amievalitamisogyny'.",17,18
1233,218973961,"unexpected, since their labels suggest that the main difference between these two categories is the intensity of the expressed toxicity.",20,21
1234,218973961,"For the general categories, 'toxicity' and 'aggression', the classifier achieves a higher F1 on the Davidson dataset than on the Toxkaggle dataset.",6,7
1235,218973961,"This means that, indeed, the 'aggression' category as used in the TRAC dataset cannot be compared and merged with the 'toxicity' category.",26,27
1236,218973961,"We saw that the proportion between offense, toxicity, abuse or hate messages can vary across different datasets, and this factor greatly impacts the classifiers' performance.",8,9
1237,218973961,"However, the categories aiming at the representation of classes that cover all types of pejorative online speech, such as toxicity and aggression, do not seem related among each other.",21,22
1238,218973961,"The second experiment, which implied the use of the Perspective API classifier, showed that even when datasets use very generic categories, their diverging definitions, data samples or inconsistent annotation may lead to diverging classifier performance -as, e.g., in the case of 'aggression' from the TRAC dataset and 'toxicity' from the Toxkaggle dataset.",56,57
1239,218973961,"For instance, it would be worth to explore why the 'waseem-racism' category is very close in the PCA plot to the TRAC 'aggression' categories, or why 'waseem-sexism' is, according to this plot, more similar to 'toxicity' than to 'misogyny', or what makes most of the studied categories rather heterogenous (in contrast to, e.g., âwaseem-racismâ).",50,51
1240,235097499,"2018 ) list toxicity without swearwords, rhetorical questions and comparisons/metaphorical language.",3,4
1241,250390730,"Han and Tsvetkov (2020) propose a classification approach for what they call veiled toxicity, an umbrella term for many different subtypes of implicit abuse.",15,16
1242,235694304,"Here a model has learned to erroneously associate African American Vernacular English (AAVE) with toxicity (Sap et al.,",16,17
1243,235694304,"Returning to toxicity detection, this might reveal that punctuation marks (such as ""!"")",2,3
1244,235694304,2019) observed that publicly available hate speech detection systems for social media tend to assign higher toxicity scores to posts written in African-American Vernacular English (AAVE).,17,18
1245,235694304,"We find that there is a strong correlation between punctuation and ""toxicity"", and other seemingly irrelevant tokens.",12,13
1246,235694304,"2017) , which we exclude from consideration (these are indicators of toxicity and so do not satisfy our definition of artifact)-surfaced by aggregating feature attribution scores are: [.,",13,14
1247,235694304,"you, and is to predict toxicity.",6,7
1248,235694304,"Verification To confirm that punctuation marks and other identified tokens indeed affect toxicity predictions, we modified tweets containing these tokens observe changes in model predictions.",12,13
1249,235422493,"2019) , toxicity detection (Han and Tsvetkov, 2020; Pavlopoulos et al.,",3,4
1250,7193856,"Again, these results were achieved without substantial toxicity.",8,9
1251,7193856,"Not surprisingly, there was a higher incidence of grade 3/4 hematological toxicity in this patient population, 20%, 17% and 15% of patients developing grade 3/4 thrombocytopenia, anemia or neutropenia, respectively.",12,13
1252,247519233,"Using three publicly-available datasets, we show that finetuning a toxicity classifier on our data improves its performance on human-written data substantially.",12,13
1253,247519233,We also demonstrate that TOXI-GEN can be used to fight machine-generated toxicity as finetuning improves the classifier significantly on our evaluation subset.,15,16
1254,247519233,"Importantly, such biases in toxicity detection risk further marginalizing or censoring minority groups (Yasin, 2018; Sap et al.,",5,6
1255,247519233,"While such human-like bias and toxicity poses real threats, we use this undesirable behavior in models like GPT-3 to improve existing toxic language classifiers, providing a path forward for mitigating systemic bias.",7,8
1256,247519233,"Created using demonstrationbased prompting and pretrained toxicity classifiers, TOXIGEN covers over 135k toxic and 135k benign statements about 13 minority identity groups (e.g., African Americans, women, LGBTQ+ folks, etc.).",6,7
1257,247519233,"First, it allows us to limit spurious identity-toxicity correlations (Dixon et al.,",10,11
1258,247519233,"Second, machine generation and careful prompting enables us to generate implicit toxicity (i.e., without swearwords or slurs), which is by definition hard to detect or find and thus often missing in toxic language corpora (Wiegand et al.,",12,13
1259,247519233,We use ALICE to control the toxicity of output text by pitting a toxicity classifier against a text generator during beam search decoding.,6,7
1260,247519233,We use ALICE to control the toxicity of output text by pitting a toxicity classifier against a text generator during beam search decoding.,13,14
1261,247519233,"Similarly, we can steer a language model with neutral prompting towards higher toxicity generations.",13,14
1262,247519233,Our experiments with five publicly-available toxicity classifiers show that the generated sentences in both cases above fool toxicity classifiers (see Figure 1 ).,7,8
1263,247519233,Our experiments with five publicly-available toxicity classifiers show that the generated sentences in both cases above fool toxicity classifiers (see Figure 1 ).,19,20
1264,247519233,This indicates that our data generation approaches (with or without ALICE) successfully control the generation towards the desired toxicity and minority group mention.,20,21
1265,247519233,"Further experimental results demonstrate that 2 Adversarial Language Imitation with Constrained Exemplars 4 Delphi does not produce toxicity probabilities, so we use Open AI's content filter to game Delphi.",17,18
1266,247519233,"This indicates that the dataset generated in this work and the approaches for generating data provide major steps towards improving toxicity classifiers, and could potentially be used downstream to address the issues from biased machine generation (Sheng et al.,",20,21
1267,247519233,"Implicit Hate Against Minority Groups Detecting implicit toxicity about minority groups (e.g., stereotyping, microaggressions), remains an elusive goal for NLP systems (Han and Tsvetkov, 2020; Wiegand et al.,",7,8
1268,247519233,"One key challenge is that, in contrast to explicit toxicity, implicit toxicity is not marked by the use of profanity or swearwords, is sometimes positive in sentiment, and is generally harder to detect or collect at scale (MacAvaney et al.,",10,11
1269,247519233,"One key challenge is that, in contrast to explicit toxicity, implicit toxicity is not marked by the use of profanity or swearwords, is sometimes positive in sentiment, and is generally harder to detect or collect at scale (MacAvaney et al.,",13,14
1270,247519233,"A second challenge for detecting subtle toxicity about minority groups is that minority mentions are more often the targets of social biases and toxicity (Hudson, 2017) .",6,7
1271,247519233,"A second challenge for detecting subtle toxicity about minority groups is that minority mentions are more often the targets of social biases and toxicity (Hudson, 2017) .",23,24
1272,247519233,"As such, minority mentions often co-occur with toxicity labels in datasets scraped from online platforms (Dixon et al.,",10,11
1273,247519233,"In turn, models trained on such data can exploit these spurious minority-toxicity correlations instead of considering the deeper semantics of text (Zhou et al.,",14,15
1274,247519233,"With TOXIGEN, we aim for generating a large scale dataset that represent implicit toxicity while balancing between toxic and benign statements, to address the gaps of previous work.",14,15
1275,247519233,"As shown in Table 1 , existing datasets contain large amounts of explicit toxicity.",13,14
1276,247519233,"To encourage implicit toxicity from a LLM, we find examples of human-written sentences with implicit toxicity towards each group from hate forums (de Gibert et al.,",3,4
1277,247519233,"To encourage implicit toxicity from a LLM, we find examples of human-written sentences with implicit toxicity towards each group from hate forums (de Gibert et al.,",18,19
1278,247519233,There is no guarantee that these statements will be challenging to existing toxicity detectors.,12,13
1279,247519233,2021) during decoding that generates statements that are adversarial to a given pre-trained toxicity classifier.,16,17
1280,247519233,ALICE creates an adversarial game between a pre-trained language model (PLM) and a toxicity classifier (CLF) during constrained beam search decoding.,17,18
1281,247519233,"With ALICE, we instead want to enforce soft constraints on the probabilities coming from a given toxicity classifier CLF during beam search: 5 log p(w i+1 |w 0 :i ) ∝ λ L log p LM (w i+1 |w 0:i ) + λ C log p CLF (w 0:i+1 ) (1) Here, λ L and λ C denote hyperparameters that determine the respective contribution of the language model and classifier to the decoding scoring function.",17,18
1282,247519233,"By using this weighted combination, we can steer generations towards a higher or lower probability of toxicity without sacrificing coherence enforced by the language model.",17,18
1283,247519233,"To create examples that challenge existing toxicity classifiers, we use two adversarial setups: • False negatives: We use toxic prompts to encourage the language model to generate toxic outputs, then maximize the classifier's probability of the benign class during beam search. •",6,7
1284,247519233,2021) as the toxicity classifier (CLF).,4,5
1285,247519233,"As we show in §4, the ALICEgenerated data is successful at attacking the given toxicity classifier, contributing a challenging, adversarial subset of TOXIGEN.",16,17
1286,247519233,"Specifically, we investigate the reliability of our promptbased and ALICE-based methods at generating human-like statements and controlling statements' toxicity and the minority groups mentioned ( §4.2).",24,25
1287,247519233,"To investigate the quality of our annotations, we compute agreement on toxicity ratings.",12,13
1288,247519233,"Average toxicity scores are on a 1-5 scale (1 being benign and 5 being clearly offensive), and are averaged across annotator responses.",1,2
1289,247519233,"Interestingly, there is no significant difference in toxicity when we account for whether annotators perceive scores as written by humans or AI (Figure 5 ).",8,9
1290,247519233,"We also find that the most common framing tactic is ""moral judgement"", or questioning the morality of an identity group, which has been linked to toxicity by prior work (Hoover et al.,",29,30
1291,247519233,"We then collect annotations for the 250 statements using the setup described in §4.1, and get toxicity scores from HateBERT.",18,19
1292,247519233,"human-annotated toxicity score for ALICE-decoded sentences with a toxic prompt is 2.97, compared to 3.75 for topk.",3,4
1293,247519233,"2021) models on the training portion of TOXIGEN, using the prompt labels as proxies for a true toxicity label.",19,20
1294,247519233,"The improvement on human-written datasets shows that TOXIGEN can be used to improve existing classifiers, helping them better tackle the challenging human-generated implicit toxicity detection task.",28,29
1295,247519233,"Fine-tuned HateBERT performs strongly on TOXIGEN-HUMANVAL, demonstrating that our data can successfully help guard against machinegenerated toxicity.",21,22
1296,247519233,"We proposed ALICE, an adversarial decoding scheme to evaluate robustness of toxicity classifiers and generate sentences to attack them, and showed the effectiveness of ALICE on a number of publicly-available toxicity detection systems.",12,13
1297,247519233,"We proposed ALICE, an adversarial decoding scheme to evaluate robustness of toxicity classifiers and generate sentences to attack them, and showed the effectiveness of ALICE on a number of publicly-available toxicity detection systems.",34,35
1298,247519233,"In our experiments, we showed that fine-tuning pre-trained hate classifiers on TOXIGEN can improve their performance on three popular human-generated toxicity datasets.",27,28
1299,247519233,"Still, toxicity is inherently subjective (Sap et al.,",2,3
